Categoria;Fundo;Data Inicio;Cota (R$);Variacao Dia (%);Acum. Mes (%);Acum. Ano (%);Acum. 12M (%);PL (mi R$);PL Medio 30d (mi R$);Taxa Adm %;Aberto;Aplic. Min (R$);Benchmark;Resgate Conv.;Resgate Pgto;% CDI Ano;% CDI 12m
ACOES;CAIXA ATENA BRASIL ACOES LIVRE QUANT FIC FIF ACOES - RESP LTDA;2019-07-31T00:00:00Z;1,90981400;-1,193;-3,72;-7,88;4,86;720,497;763,238;2,00;Nao;0,01;NÃO SE APLICA;D+13 (du);D+15 (du);3,44;147,92
ACOES;CAIXA ATENA FIC FIF ACOES FUNCIONARIOS ACOES LIVRE QUANT RESP LTDA;2020-07-06T00:00:00Z;1.837,22718300;-1,188;-3,67;-7,45;5,99;9,387;10,222;0,80;Sim;0,01;IBOV;D+13 (du);D+15 (du);28,01;166,70
ACOES;CAIXA ATENA FIC FIF ACOES LIVRE QUANT RESP LTDA;2019-07-31T00:00:00Z;1,78472600;-1,190;-3,71;-7,89;4,82;47,038;48,596;2,00;Sim;0,01;IBOV;D+13 (du);D+15 (du);3,09;141,69
ACOES;CAIXA BRASIL ETF IBOVESPA FIF ACOES - RESP LTDA;2012-11-27T00:00:00Z;3,47570100;-0,678;-2,10;4,25;20,51;8,795;9,183;0,50;Nao;0,01;IBOV;D+1 (du);D+03 (du);290,89;194,64
ACOES;CAIXA BRASIL IBX-50 FIF ACOES - RESP LTDA;2008-02-18T00:00:00Z;1,95004100;-0,599;-1,73;2,88;17,98;192,496;199,571;0,70;Sim;0,01;IBX50;D+1 (du);D+03 (du);251,29;177,37
ACOES;CAIXA BRASIL INDEXA IBOVESPA FIF ACOES - RESP LTDA;2011-07-29T00:00:00Z;3,78007900;-0,690;-2,13;4,40;20,91;277,950;295,316;0,50;Sim;0,01;IBOV;D+1 (du);D+03 (du);295,87;197,69
ACOES;CAIXA EXPERT CLARITAS VALOR FIC FIF AÇÕES - RESP LTDA;2020-10-20T00:00:00Z;1.448,34133200;-0,717;-2,42;-3,17;5,96;20,877;21,954;0,60;Sim;10.000,00;IBOV;D+23 (du);D+25 (du);124,77;125,43
ACOES;CAIXA EXPERT VERDE AM LONG BIAS FIC FIF ACOES - RESP LTDA;2020-10-05T00:00:00Z;969,75225500;-0,701;-2,09;-1,08;12,45;7,865;8,089;0,70;Sim;10.000,00;IBOV;D+22 (du);D+24 (du);162,11;166,85
ACOES;CAIXA EXPERT VINCI VALOR DIVIDENDOS RPPS FIC FIF ACOES - RESP LTDA;2012-08-23T00:00:00Z;3,35467340;-0,496;-0,87;3,12;16,03;1.286,441;1.320,850;;Sim;10.000,00;IBOV;D+30 (du);D+32 (du);219,56;164,40
ACOES;CAIXA EXPERT VINCI VALOR RPPS FIC FIF ACOES - RESP LTDA;2011-12-12T00:00:00Z;2,41697323;-0,737;-1,88;2,26;16,58;739,832;774,592;;Sim;10.000,00;IBOV;D+21 (du);D+23 (du);250,95;178,02
ACOES;CAIXA FIC FIF ACOES ACOES MULTIGESTOR RESP LTDA;2019-06-25T00:00:00Z;1,22030000;-0,914;-3,11;-5,19;2,53;275,776;289,893;1,50;Sim;0,01;IBOV;D+23 (du);D+25 (du);89,50;95,49
ACOES;CAIXA FIC FIF ACOES COMPROMISSO BDR NIVEL I RESP LTDA;2021-11-05T00:00:00Z;1,18003900;-1,694;-0,12;-2,49;13,20;3,647;3,842;1,00;Sim;0,01;BDRX;D+1 (du);D+03 (du);-49,32;94,36
ACOES;CAIXA FIC FIF ACOES DIVIDENDOS QUANTITATIVO RESP LTDA;2021-09-02T00:00:00Z;1,86441000;-1,060;-2,81;-8,36;4,00;1,681;1,775;2,00;Sim;0,01;IDIV;D+13 (du);D+15 (du);-40,48;106,39
ACOES;CAIXA FIC FIF ACOES E FUNDO IBOVESPA RESP LTDA;2012-10-05T00:00:00Z;2,50692100;-0,689;-2,13;4,19;20,36;12,923;13,487;0,80;Sim;0,01;IBOV;D+1 (du);D+03 (du);290,28;193,37
ACOES;CAIXA FIF ACOES BANCO DO BRASIL PLUS RESP LTDA;2019-10-23T00:00:00Z;1.225,53744500;0,046;-2,67;-10,35;-11,23;40,230;41,033;1,50;Sim;0,01;IBOV;D+1 (du);D+03 (du);-54,67;-179,46
ACOES;CAIXA FIF ACOES BDR NIVEL I - RESP LTDA;2013-06-24T00:00:00Z;10,01278800;-0,624;-2,40;1,12;17,39;275,128;276,062;1,50;Sim;0,01;BDRX11;D+1 (du);D+03 (du);-67,01;116,71
ACOES;CAIXA FIF ACOES CAIXA SEGURIDADE RESP LTDA;2021-04-30T00:00:00Z;2,88035300;1,489;8,90;18,91;40,22;475,826;448,920;0,20;Sim;0,01;IBOV;D+1 (du);D+03 (du);207,63;168,52
ACOES;CAIXA FIF ACOES CONSTRUCAO CIVIL RESP LTDA;2009-06-22T00:00:00Z;1,78857600;-2,630;-3,50;-5,93;9,66;108,878;113,811;2,00;Sim;0,01;IMOB-IMOBILIÁRIO;D+1 (du);D+03 (du);-31,28;152,26
ACOES;CAIXA FIF ACOES CONSUMO RESP LTDA;2012-04-26T00:00:00Z;1,05805400;-1,889;-3,61;-9,10;-5,61;54,299;57,724;1,60;Sim;0,01;ICON11;D+1 (du);D+03 (du);-34,64;25,61
ACOES;CAIXA FIF ACOES ELETROBRAS RESP LTDA;2022-05-30T00:00:00Z;1,77493000;-1,449;2,41;3,25;74,17;270,314;272,811;0,45;Sim;0,01;OUTROS;D+1 (du);D+03 (du);329,26;519,89
ACOES;CAIXA FIF ACOES IBOVESPA ATIVO RESP LTDA;2007-02-01T00:00:00Z;2,14348300;-0,867;-1,95;2,16;18,83;34,159;35,822;2,00;Sim;0,01;IBOV;D+1 (du);D+03 (du);245,64;187,71
ACOES;CAIXA FIF ACOES IBrX ATIVO -RESP LTDA;2005-09-12T00:00:00Z;4,66748600;-0,831;-1,78;4,01;20,80;22,560;23,330;1,50;Sim;0,01;IBX;D+1 (du);D+03 (du);271,07;196,06
ACOES;CAIXA FIF ACOES INDEXA IAGRO RESP LTDA;2022-06-14T00:00:00Z;0,81799300;-1,281;-4,00;-15,02;-19,74;2,809;2,956;0,80;Sim;0,01;OUTROS;D+1 (du);D+03 (du);-125,86;-82,72
ACOES;CAIXA FIF ACOES INDEXA PIBB IBRX 50 RESP LTDA;2005-09-12T00:00:00Z;5,66291400;-0,664;-2,41;5,27;21,95;41,649;43,670;0,80;Sim;0,01;PIBB11;D+1 (du);D+03 (du);327,51;204,94
ACOES;CAIXA FIF ACOES INDEXA SETOR FINANCEIRO RESP LTDA;2021-01-27T00:00:00Z;1.467,99756100;-0,239;-1,06;0,87;11,63;29,162;30,025;0,80;Sim;0,01;IFNC;D+1 (du);D+03 (du);151,56;101,32
ACOES;CAIXA FIF ACOES INFRAESTRUTURA RESP LTDA;2010-04-19T00:00:00Z;2,75524800;-1,445;-4,46;1,09;10,32;120,395;130,389;2,00;Sim;0,01;IBOV;D+1 (du);D+03 (du);329,00;179,66
ACOES;CAIXA FIF ACOES PETROBRAS PLUS RESP LTDA;2019-06-28T00:00:00Z;4,22611700;-0,559;-7,52;34,20;33,56;70,690;79,271;1,50;Nao;0,01;PETR3;D+1 (du);D+03 (du);1.374,44;379,46
ACOES;CAIXA FIF ACOES PETROBRAS PRE-SAL RESP LTDA;2010-09-28T00:00:00Z;6,00636200;0,084;-7,24;28,06;32,04;108,422;123,286;0,50;Sim;0,01;PETR4;D+1 (du);D+03 (du);1.240,37;365,83
ACOES;CAIXA FIF ACOES SMALL CAPS ATIVO RESP LTDA;2012-11-01T00:00:00Z;1,39732600;-1,464;-4,30;-8,34;-4,62;423,437;446,225;1,50;Sim;0,01;SMLL;D+1 (du);D+03 (du);-20,21;52,67
ACOES;CAIXA FIF ACOES SUSTENTABILIDADE EMPRESARIAL ISE-IS RESP LTDA;2007-11-05T00:00:00Z;1,64144100;-1,115;-2,90;-3,70;3,32;2,028;2,186;0,80;Sim;0,01;ISE;D+1 (du);D+03 (du);124,46;115,19
ACOES;CAIXA INSTITUCIONAL BDR NIVEL I FIF ACOES - RESP LTDA;2013-06-24T00:00:00Z;11,22658519;-0,624;-2,38;1,45;18,31;2.310,072;2.314,934;0,70;Sim;0,01;BDRX11;D+1 (du);D+03 (du);-60,80;123,24
ACOES;CAIXA SEGURIDADE II FIF AÇÕES - RESP LTDA;2025-03-24T00:00:00Z;1,42279200;1,489;8,89;18,82;40,02;21,019;19,893;0,20;Nao;0,01;NÃO SE APLICA;D+1 (du);D+03 (du);229,70;166,72
CAMBIAL;CAIXA FIC FIF INDEXA DOLAR CAMBIAL - RESP LTDA;2005-06-27T00:00:00Z;3,79095200;-0,228;1,37;-5,69;-2,34;96,030;96,344;0,80;Sim;0,01;PTAX;D+1 (du);D+01 (du);-239,61;-57,16
FII;CAIXA RIO BRAVO FUNDO DE FII;2013-11-22T00:00:00Z;;;;;;;;1,20;Nao;0,00;IBOV;D+0 (du);D+00 (du);;
FII;CAIXA RIO BRAVO FUNDO DE FII II;2019-04-18T00:00:00Z;;;;;;;;1,15;Nao;0,00;CDI;D+0 (du);D+00 (du);;
FII;FII CAIXA CARTEIRA IMOBILIÁRIA;2022-03-16T00:00:00Z;;;;;;;;0,70;Nao;;IFIX; (du); (du);;
MULTIMERCADO;CAIXA BRASIL ESTRATEGIA LIVRE FIC FIF MM LONGO PRAZO - RESP LTDA;2019-10-23T00:00:00Z;1.538,57864500;-0,377;-0,59;3,65;10,89;129,291;130,625;1,50;Sim;0,01;CDI;D+13 (du);D+15 (du);111,58;93,02
MULTIMERCADO;CAIXA CAPITAL PROTEGIDO CICLICO III FIC FIF MM - RESP LTDA;2022-01-10T00:00:00Z;1,53156200;-0,383;-0,89;2,57;18,24;14,429;14,523;0,90;Nao;5.000,00;NÃO SE APLICA;D+0 (du);D+02 (du);75,95;132,12
MULTIMERCADO;CAIXA CAPITAL PROTEGIDO IBOV CICLICO I FIC FIF MM - RESP LTDA;2011-11-08T00:00:00Z;3,28148000;0,303;0,09;2,99;8,66;156,292;155,199;1,60;Nao;5.000,00;CDI;D+1 (du);D+03 (du);39,66;45,06
MULTIMERCADO;CAIXA CARTEIRA QUANTITATIVA DUO FIC FIF MM LP - RESP LTDA;2026-04-07T00:00:00Z;1,00714300;-0,064;0,18;;;2,415;2,116;0,80;Sim;0,01;NÃO SE APLICA;D+8 (du);D+10 (du);;
MULTIMERCADO;CAIXA CARTEIRA QUANTITATIVA QUALI FIC FIF MM LP - RESP LTDA;2026-04-07T00:00:00Z;0,96498900;-0,140;-0,05;;;1,287;0,618;0,80;Sim;0,01;NÃO SE APLICA;D+14 (du);D+16 (du);;
MULTIMERCADO;CAIXA CARTEIRA QUANTITATIVA UNO FIC FIF MM LP - RESP LTDA;2026-04-07T00:00:00Z;1,02034300;-0,051;0,44;;;12,575;9,286;0,80;Sim;0,01;NÃO SE APLICA;D+1 (du);D+03 (du);;
MULTIMERCADO;CAIXA EXPERT BTG PACTUAL X 10 FIC FF MM LP - RESP LTDA;2013-03-21T00:00:00Z;6,80116600;-0,291;-0,48;5,75;15,09;128,394;129,260;1,00;Sim;10.000,00;CDI;D+8 (du);D+10 (du);145,98;119,31
MULTIMERCADO;CAIXA EXPERT GIANT ZARATHUSTRA FIC FIF MM - RESP LTDA;2021-02-12T00:00:00Z;1,34618100;-0,549;1,29;4,88;4,09;12,754;13,503;0,40;Sim;10.000,00;NÃO SE APLICA;D+22 (du);D+25 (du);55,70;15,26
MULTIMERCADO;CAIXA EXPERT HASHDEX NASDAQ CRYPTO INDEX FIC FIF MM - RESP LTDA;2025-10-07T00:00:00Z;0,46675735;-1,917;-8,45;-35,36;;3,711;3,899;0,70;Sim;100,00;OUTROS;D+3 (du);D+08 (du);-538,29;
MULTIMERCADO;CAIXA EXPERT PIMCO INCOME IE FIC FIF MM LP - RESP LTDA;2023-08-21T00:00:00Z;1,43543900;-0,343;0,70;4,19;13,90;284,248;280,799;0,93;Sim;10.000,00;NÃO SE APLICA;D+3 (du);D+08 (du);73,23;113,18
MULTIMERCADO;CAIXA EXPERT SPX NIMITZ FIC FIF MM - RESP LTDA;2020-05-04T00:00:00Z;1,79298500;0,181;0,64;1,50;9,36;175,702;176,172;2,00;Sim;10.000,00;CDI;D+22 (du);D+24 (du);-0,15;71,88
MULTIMERCADO;CAIXA FIC FIF ALOCACAO MACRO MM LP RESP LTDA;2007-02-01T00:00:00Z;5,59747900;-0,267;-0,18;5,05;12,89;894,106;898,176;0,50;Sim;10.000,00;CDI;D+1 (du);D+03 (du);121,91;100,08
MULTIMERCADO;CAIXA FIC FIF CAPITAL PROTEGIDO CESTA AGRO MM LP - RESP LTDA;2022-07-04T00:00:00Z;1,38268200;0,007;0,70;1,96;9,50;70,856;70,861;0,90;Nao;5.000,00;OUTROS;D+0 (du);D+02 (du);69,45;62,22
MULTIMERCADO;CAIXA FIC FIF ESTRAT. LIVRE MULTIMERCADO LP - RESP LTDA;2019-10-21T00:00:00Z;1.623,76337600;-0,377;-0,60;3,63;10,86;113,482;115,666;1,50;Sim;0,01;CDI;D+13 (du);D+15 (du);111,24;92,96
MULTIMERCADO;CAIXA FIC FIF ESTRATEGICO MULTIMERCADO LP RESP LTDA;2006-04-10T00:00:00Z;5,30470760;-0,260;-0,41;3,38;10,86;32,535;32,933;1,20;Sim;0,01;CDI;D+0 (du);D+01 (du);98,90;91,33
MULTIMERCADO;CAIXA FIC FIF FOF SMART LONG SHORT LP RESP LTDA;2023-07-18T00:00:00Z;1,25224900;-0,088;0,11;2,53;8,97;6,308;6,442;1,00;Sim;0,01;CDI;D+24 (du);D+26 (du);63,48;84,14
MULTIMERCADO;CAIXA FIC FIF FUNCIONARIOS ESTRATEGIA LIVRE MM LP RESP LTDA;2020-07-06T00:00:00Z;1.645,56436200;-0,376;-0,56;4,05;11,80;14,334;14,853;0,60;Sim;0,01;CDI;D+13 (du);D+15 (du);121,24;100,29
MULTIMERCADO;CAIXA FIC FIF HEDGE MULTIMERCADO LONGO PRAZO - RESP LTDA;2020-10-26T00:00:00Z;1.696,75800500;0,414;1,75;7,70;13,86;29,797;30,360;1,00;Sim;0,01;CDI;D+1 (du);D+01 (du);105,18;74,27
MULTIMERCADO;CAIXA FIC FIF JUROS E MOEDAS MM LP - RESP LTDA;2012-06-28T00:00:00Z;3,66001900;0,017;0,26;5,23;12,34;744,650;748,137;0,70;Sim;10.000,00;CDI;D+0 (du);D+00 (du);109,05;90,73
MULTIMERCADO;CAIXA FIC FIF JUROS E MOEDAS MUL PLUS LP - RESP LTDA;2018-03-05T00:00:00Z;1,90972700;0,015;0,25;5,05;11,94;21,540;21,724;1,00;Sim;0,01;CDI;D+0 (du);D+00 (du);105,62;87,95
MULTIMERCADO;CAIXA FIC FIF LONG BIAS MM - RL;2024-04-01T00:00:00Z;1,11206400;-0,588;-1,80;-4,09;9,23;3,565;3,475;2,00;Sim;0,01;OUTROS;D+13 (du);D+15 (du);25,34;158,86
MULTIMERCADO;CAIXA FIC FIF MULTIGESTOR GLOBAL EQUITIES IE MM RESP LTDA;2020-11-12T00:00:00Z;1.210,12475800;-0,625;1,16;-3,56;1,71;36,884;36,318;1,00;Sim;0,01;CDI;D+7 (du);D+12 (du);-207,94;-14,12
MULTIMERCADO;CAIXA FIC FOF SMART LONG BIAS MM RESP LTDA;2023-07-18T00:00:00Z;1,39721200;-0,174;-1,48;2,36;12,89;11,585;11,897;1,00;Sim;0,01;IPCA;D+24 (du);D+26 (du);175,29;166,27
MULTIMERCADO;CAIXA FIC FOF SMART MACRO MM LP RESP LTDA;2023-07-18T00:00:00Z;1,28990100;-0,126;-0,17;2,20;8,05;27,706;27,911;1,00;Sim;0,01;CDI;D+24 (du);D+26 (du);52,98;77,77
MULTIMERCADO;CAIXA FIC FOF SMART MULTIESTRATEGIA MM RESP LTDA;2014-06-09T00:00:00Z;2,85171600;-0,125;-0,29;2,10;8,19;73,493;75,884;1,50;Sim;0,01;CDI;D+24 (du);D+26 (du);62,01;79,94
MULTIMERCADO;CAIXA FIF FIC FIM CAPITAL PROTEGIDO CICLICO II LP - RESP LTDA;2022-07-18T00:00:00Z;1,47054700;-0,765;-1,16;1,69;12,12;190,672;191,743;0,90;Nao;5.000,00;NÃO SE APLICA;D+0 (du);D+02 (du);22,10;92,96
MULTIMERCADO;CAIXA FIF INDEXA BOLSA AMERICANA MULTIMERCADO LP RESP LTDA;2018-10-16T00:00:00Z;3,76377800;-1,202;-1,97;11,89;30,12;2.344,183;2.348,297;0,80;Sim;0,01;CDI;D+0 (du);D+01 (du);269,97;251,57
MULTIMERCADO;CAIXA FIF INDEXA EURO MM LP - RL;2024-04-01T00:00:00Z;1,10713800;-0,843;0,48;-8,17;-6,71;3,777;3,554;0,80;Sim;0,01;NÃO SE APLICA;D+1 (du);D+03 (du);-253,33;-47,74
MULTIMERCADO;CAIXA FIF INDEXA OURO MULTIMERCADO LP - RESP LTDA;2013-02-15T00:00:00Z;4,57496800;0,679;-2,15;2,97;39,08;570,691;628,980;0,80;Sim;0,01;NÃO SE APLICA;D+1 (du);D+02 (du);242,05;351,21
MULTIMERCADO;CAIXA FIF INDEXA SHORT DOLAR MM LP - RESP LTDA;2020-10-26T00:00:00Z;2.428,38644500;0,327;-0,36;18,23;29,76;13,449;13,119;0,80;Sim;0,01;PTAX;D+1 (du);D+01 (du);515,54;268,33
NAN;CAIXA ABSOLUTO PRÉ FIC DE CLASSE DE FIF RENDA FIXA LONGO PRAZO - RESPONSABILIDADE LIMITADA;2003-04-30;19,74531100;-0,315;-0,50;3,02;9,30;118,735;122,867;1,10;Sim;0,01;CDI;D+0 (du);D+00 (du);81,85;81,38
NAN;CAIXA CAPITAL ÍNDICE DE PREÇOS FIC DE CLASSE DE FIF RENDA FIXA LONGO PRAZO - RESP LIMITADA;2003-04-30;13,42036500;-0,237;-0,48;4,36;9,03;27,493;28,125;1,50;Sim;0,01;IPCA+6%;D+3 (du);D+03 (du);115,97;66,40
NAN;CAIXA CLÁSSICO FIC DE CLASSE DE FIF RENDA FIXA LONGO PRAZO - RESPONSABILIDADE LIMITADA;2003-04-30;14,98649700;0,048;0,53;5,76;12,88;27,729;27,830;1,40;Nao;100,00;CDI;D+0 (du);D+00 (du);113,78;90,64
NAN;CAIXA DIVIDENDOS FUNDO DE INVESTIMENTO FINANCEIRO EM AÇÕES - RESPONSABILIDADE LIMITADA;2003-10-03;6,55830700;-0,370;-0,37;3,41;17,38;322,369;341,439;1,50;Sim;0,01;IDIV11;D+1 (du);D+03 (du);204,96;164,12
NAN;CAIXA EMPREENDER FIC DE CLASSE DE FIF RENDA FIXA LONGO PRAZO - RESPONSABILIDADE LIMITADA;2003-04-30;46,25910400;0,047;0,53;5,72;12,79;40,573;40,592;1,50;Nao;50,00;CDI;D+0 (du);D+00 (du);113,02;90,01
NAN;CAIXA ESPECIAL FIC DE CLASSE DE FIF RENDA FIXA LONGO PRAZO - RESPONSABILIDADE LIMITADA;2003-08-25;10,62497800;0,054;0,60;6,29;14,11;2.373,743;2.373,904;0,40;Sim;100.000,00;CDI;D+0 (du);D+00 (du);123,66;99,08
NAN;CAIXA EXECUTIVO FIC DE CLASSE DE FIF RENDA FIXA LONGO PRAZO - RESPONSABILIDADE LIMITADA;2003-04-30;32,86261700;0,049;0,55;5,92;13,25;2.194,540;2.193,119;1,10;Sim;1.000,00;CDI;D+0 (du);D+00 (du);116,93;93,24
NAN;CAIXA IBOVESPA FUNDO DE INVESTIMENTO EM COTAS DE CLASSE DE FIF EM AÇÕES - RESPONSABILIDADE LIMITADA;1997-01-15;8,39652500;-0,693;-2,18;3,71;19,12;83,718;90,020;2,00;Sim;0,01;IBOV;D+1 (du);D+03 (du);280,13;184,07
NAN;CAIXA IDEAL FIC DE CLASSE DE FIF RENDA FIXA LONGO PRAZO - RESPONSABILIDADE LIMITADA;2003-04-30;9,72663400;0,047;0,53;5,74;12,82;583,143;583,543;1,50;Sim;0,01;CDI;D+0 (du);D+00 (du);113,31;90,22
NAN;CAIXA INVESTIDOR FIC DE CLASSE DE FIF RENDA FIXA LONGO PRAZO - RESPONSABILIDADE LIMITADA;2003-04-30;19,08342200;0,052;0,58;6,09;13,63;951,524;953,972;0,85;Sim;5.000,00;CDI;D+0 (du);D+00 (du);119,59;95,67
NAN;CAIXA PATRIMÔNIO ÍNDICE DE PREÇOS FIC DE CLASSE DE FIF RENDA FIXA LONGO PRAZO - RESP LIMITADA;2003-04-30;23,67854600;-0,177;-0,27;5,76;11,16;93,680;94,357;0,30;Sim;100.000,00;IPCA+6%;D+3 (du);D+03 (du);141,76;79,23
NAN;CAIXA PERSONAL FIC DE CLASSE DE FIF RENDA FIXA LONGO PRAZO - RESPONSABILIDADE LIMITADA;2003-04-30;30,69754300;0,053;0,59;6,21;13,90;3.113,722;3.108,001;0,60;Sim;50.000,00;CDI;D+0 (du);D+00 (du);121,95;97,63
NAN;CAIXA PETROBRAS FUNDO DE INVESTIMENTO FINANCEIRO EM AÇÕES - RESPONSABILIDADE LIMITADA;2000-07-10;39,20033600;-0,558;-7,51;34,27;33,69;770,595;866,707;1,50;Sim;0,01;PETR3;D+1 (du);D+03 (du);1.375,48;380,23
NAN;CAIXA PRÁTICO FIC DE CLASSE DE FIF RENDA FIXA CURTO PRAZO - RESPONSABILIDADE LIMITADA;2003-04-30;9,44241200;0,045;0,51;5,49;12,09;2.931,714;2.870,808;1,70;Nao;0,01;CDI;D+0 (du);D+00 (du);109,19;84,26
NAN;CAIXA RV 30 FUNDO DE INVESTIMENTO FINANCEIRO MULTIMERCADO LONGO PRAZO - RESPONSABILIDADE LIMITADA;2003-04-30;12,46506100;-0,318;-0,64;5,01;15,01;321,000;326,894;1,00;Sim;0,01;70% CDI + 30% IBOV;D+1 (du);D+03 (du);165,32;122,80
NAN;CAIXA SEBRAE FUNDO DE INVESTIMENTO FINANCEIRO RENDA FIXA LONGO PRAZO - RESPONSABILIDADE LIMITADA;2003-04-30;17,99589400;0,052;0,56;6,30;14,17;4.796,116;4.781,658;;Sim;0,01;CDI;D+0 (du);D+01 (du);125,39;100,01
NAN;CAIXA SELEÇÃO FIC DE CLASSE DE FIF RENDA FIXA - RESPONSABILIDADE LIMITADA;2003-10-01;29,32093300;0,048;0,53;5,73;28,37;21,042;21,150;1,10;Nao;30.000,00;CDI;D+0 (du);D+00 (du);113,86;195,72
NAN;CAIXA SOBERANO FIC DE CLASSE DE FIF RENDA FIXA LONGO PRAZO - RESPONSABILIDADE LIMITADA;2003-04-30;20,25874900;0,047;0,52;5,63;12,53;64,430;64,608;1,50;Nao;50,00;CDI;D+0 (du);D+00 (du);111,47;87,96
NAN;CAIXA VALE DO RIO DOCE FUNDO DE INVESTIMENTO FINANCEIRO EM AÇÕES - RESPONSABILIDADE LIMITADA;2002-02-20;37,73146400;-2,040;-2,43;9,22;60,31;633,942;658,658;2,00;Sim;0,01;VALE3;D+1 (du);D+03 (du);360,65;403,15
PRIVATIZACAO;CAIXA FMP FGTS ELETROBRAS - RESP LTDA;2022-06-14T00:00:00Z;1,76859200;-1,445;2,41;3,31;74,51;1.606,952;1.660,385;0,20;Nao;200,00;OUTROS;D+1 (du);D+05 (du);324,82;529,35
PRIVATIZACAO;CAIXA FMP FGTS ELETROBRAS MIGRAÇÃO - RESP LTDA;2022-06-10T00:00:00Z;1,81364800;-1,439;2,39;3,30;74,47;4,956;5,081;0,20;Sim;200,00;OUTROS;D+1 (du);D+05 (du);323,39;528,52
PRIVATIZACAO;CAIXA FUNDO MÚTUO DE PRIVATIZAÇÃO - FGTS - PETROBRAS II - RESPONSABILIDADE LIMITADA;2000-08-17;38,53034500;-0,559;-7,51;34,39;33,82;542,368;603,857;1,40;Sim;0,01;PETR3;D+1 (du);D+05 (du);1.445,00;399,74
PRIVATIZACAO;CAIXA FUNDO MÚTUO DE PRIVATIZAÇÃO - FGTS - PETROBRAS III - RESPONSABILIDADE LIMITADA;2000-08-17;40,97035900;-0,558;-7,51;34,54;34,12;621,644;694,877;1,20;Nao;10.000,00;PETR3;D+1 (du);D+05 (du);1.448,41;402,10
PRIVATIZACAO;CAIXA FUNDO MÚTUO DE PRIVATIZAÇÃO - FGTS - PETROBRAS IV - RESPONSABILIDADE LIMITADA;2000-08-17;43,61472300;-0,558;-7,50;34,67;34,41;628,243;698,314;0,95;Nao;300,00;PETR3;D+1 (du);D+05 (du);1.451,48;404,68
PRIVATIZACAO;CAIXA FUNDO MÚTUO DE PRIVATIZAÇÃO - FGTS - VALE DO RIO DOCE I - RESPONSABILIDADE LIMITADA;2002-03-27;35,99365000;-2,044;-2,43;9,23;60,35;451,580;464,850;1,90;Nao;0,01;VALE3;D+1 (du);D+05 (du);373,51;423,55
PRIVATIZACAO;CAIXA FUNDO MÚTUO DE PRIVATIZAÇÃO - FGTS - VALE DO RIO DOCE II - RESPONSABILIDADE LIMITADA;2002-03-27;41,81365500;-2,039;-2,40;9,47;61,15;751,171;775,390;1,40;Nao;10.000,00;VALE3;D+1 (du);D+05 (du);378,64;429,52
PRIVATIZACAO;CAIXA FUNDO MÚTUO DE PRIVATIZAÇÃO - FGTS - VALE DO RIO DOCE MIGRAÇÃO- RESPONSABILIDADE LIMITADA;2002-02-26;35,03928600;-2,042;-2,46;9,20;60,01;11,896;11,872;1,90;Sim;0,01;VALE3;D+1 (du);D+05 (du);373,38;421,57
PRIVATIZACAO;CAIXA FUNDO MÚTUO DE PRIVATIZAÇÃO - FGTS CARTEIRA LIVRE - FGTS CL ABSOLUTO - RESP LIMITADA;2001-08-24;15,75605200;-1,025;-3,19;-6,58;7,57;108,470;114,386;1,90;Sim;0,01;PETR3;D+1 (du);D+05 (du);42,83;177,20
RENDA FIXA;CAIXA BRASIL 2027 TP FIF RF - RESP LTDA;2022-06-06T00:00:00Z;1,14140907;0,035;0,25;3,95;6,83;516,033;516,244;0,20;Sim;300.000,00;IPCA + 5%;D+0 (du);D+00 (du);150,30;40,19
RENDA FIXA;CAIXA BRASIL 2027 TP X FIF RF LP - RESP LTDA;2023-05-16T00:00:00Z;1,10450685;0,035;0,26;3,98;6,90;572,916;574,193;0,15;Sim;300.000,00;IPCA + 5%;D+0 (du);D+00 (du);150,89;40,67
RENDA FIXA;CAIXA BRASIL 2028 X TP FIF RF - RESP LTDA;2023-05-16T00:00:00Z;1,07047008;-0,154;-0,53;2,29;4,16;559,678;560,627;0,15;Sim;300.000,00;IPCA + 5%;D+0 (du);D+00 (du);60,52;33,38
RENDA FIXA;CAIXA BRASIL 2030 II TP FIF RF - RESP LTDA;2014-03-26T00:00:00Z;1,92409766;-0,536;-1,10;0,54;1,43;1.061,587;1.069,666;0,20;Sim;300.000,00;CDI;D+0 (du);D+00 (du);43,54;24,06
RENDA FIXA;CAIXA BRASIL 2030 III TP  FIF RF - RESP LTDA;2015-03-16T00:00:00Z;1,73983162;-0,536;-1,10;0,54;1,46;237,069;238,874;0,20;Sim;300.000,00;CDI;D+1 (du);D+02 (du);43,60;24,28
RENDA FIXA;CAIXA BRASIL ATIVA FIC FIF RENDA FIXA LONGO PRAZO - RESP LTDA;2020-04-15T00:00:00Z;1.643,75687700;-0,027;0,16;4,74;11,23;459,887;458,990;0,40;Sim;0,01;CDI;D+0 (du);D+01 (du);100,70;77,03
RENDA FIXA;CAIXA BRASIL GESTAO ESTRATEGICA FIC FIF RF - RESP LTDA;2016-11-04T00:00:00Z;2,39681100;-0,199;-0,28;4,07;11,22;3.595,214;3.696,254;0,40;Sim;0,01;IPCA;D+0 (du);D+00 (du);98,16;85,99
RENDA FIXA;CAIXA BRASIL IDKA IPCA 2A TP FIF RF LONGO PRAZO - RESP LTDA;2012-08-16T00:00:00Z;3,79986600;-0,156;-0,51;5,56;11,53;2.995,653;2.975,924;0,20;Sim;0,01;IDKA2;D+0 (du);D+00 (du);142,65;81,23
RENDA FIXA;CAIXA BRASIL IMA B 5 TP FIF RF LONGO PRAZO - RESP LTDA;2010-07-09T00:00:00Z;5,16443500;-0,198;-0,30;5,79;11,28;5.547,071;5.470,461;0,20;Sim;0,01;IMA-B 5;D+0 (du);D+00 (du);143,14;80,44
RENDA FIXA;CAIXA BRASIL IMA GERAL TP FIF RF LONGO PRAZO - RESP LTDA;2010-07-08T00:00:00Z;4,74624000;-0,151;0,02;5,15;11,85;515,747;518,272;0,20;Sim;0,01;IMA-GERAL TOTAL;D+0 (du);D+00 (du);119,01;90,97
RENDA FIXA;CAIXA BRASIL IMA-B 5+ TP FIF RF LONGO PRAZO - RESP LTDA;2012-04-18T00:00:00Z;3,41993800;-0,731;-1,24;2,51;5,66;763,007;796,420;0,20;Sim;0,01;IMA-B 5+;D+0 (du);D+00 (du);115,19;68,43
RENDA FIXA;CAIXA BRASIL IMA-B TP FIF RF LONGO PRAZO - RESP LTDA;2010-03-08T00:00:00Z;5,11202800;-0,484;-0,81;3,97;8,04;2.562,092;2.565,468;0,20;Sim;0,01;IMA-B TOTAL;D+0 (du);D+00 (du);127,69;73,65
RENDA FIXA;CAIXA BRASIL IRF M 1 MAIS TP FIF RF LONGO PRAZO - RESP LTDA;2012-05-11T00:00:00Z;3,73774600;-0,411;-0,76;2,78;9,22;717,520;716,872;0,20;Sim;0,01;IRF-M 1+;D+0 (du);D+00 (du);83,69;85,59
RENDA FIXA;CAIXA BRASIL IRF-M 1 TP FIF RF - RESP LTDA;2010-05-28T00:00:00Z;4,49463900;0,036;0,52;5,93;13,64;11.064,577;10.934,263;0,20;Sim;0,01;IRF-M 1;D+0 (du);D+00 (du);118,05;96,20
RENDA FIXA;CAIXA BRASIL IRF-M TP FIF RF LONGO PRAZO - RESP LTDA;2012-08-16T00:00:00Z;3,61763500;-0,285;-0,40;3,63;10,47;1.736,255;1.731,110;0,20;Sim;0,01;IRF-M TOTAL;D+0 (du);D+00 (du);92,58;88,66
RENDA FIXA;CAIXA BRASIL MATRIZ FIF RF - RESP LTDA;2015-12-17T00:00:00Z;2,61896300;0,052;0,58;6,34;14,22;9.186,617;9.226,473;0,20;Sim;0,01;CDI;D+0 (du);D+00 (du);125,22;99,91
RENDA FIXA;CAIXA BRASIL TP FIF RF LONGO PRAZO - RESP LTDA;2006-02-10T00:00:00Z;7,20457600;0,051;0,55;6,27;14,05;12.871,038;12.954,440;0,20;Sim;0,01;CDI;D+0 (du);D+00 (du);124,81;99,16
RENDA FIXA;CAIXA FI MERCURIO RF LP;2019-05-29T00:00:00Z;1,92092500;0,055;0,60;6,39;14,30;7.127,218;7.055,474;0,07;Sim;0,01;CDI;D+0 (du);D+00 (du);125,74;100,43
RENDA FIXA;CAIXA FI SENAR RENDA FIXA LONGO PRAZO;2022-06-01T00:00:00Z;1,64940600;0,053;0,57;6,34;14,22;1.050,461;1.037,953;0,10;Sim;0,00;NÃO SE APLICA;D+0 (du);D+00 (du);125,99;100,17
RENDA FIXA;CAIXA FIC FIF ATIVA RENDA FIXA LP - RESP LTDA;2020-04-22T00:00:00Z;1.773,64955900;0,014;0,27;5,30;12,58;123,004;124,745;0,40;Sim;50.000,00;CDI;D+0 (du);D+01 (du);110,04;92,29
RENDA FIXA;CAIXA FIC FIF BRASIL IDKA PRE 2A RF LP - RESP LTDA;2022-09-21T00:00:00Z;1,43811700;-0,240;-0,41;3,14;10,24;169,047;170,355;0,20;Sim;0,01;IDKA PRÉ 2A;D+0 (du);D+00 (du);81,98;84,27
RENDA FIXA;CAIXA FIC FIF DESENVOLVER RF LP - RESP LTDA;2012-12-18T00:00:00Z;3,00618300;0,046;0,52;5,60;12,56;1,630;1,644;1,30;Nao;500,00;CDI;D+0 (du);D+00 (du);110,52;88,47
RENDA FIXA;CAIXA FIC FIF E-FUNDO RF LP - RESP LTDA;2012-10-05T00:00:00Z;3,36430300;0,050;0,57;6,11;13,67;63,266;61,925;0,70;Sim;0,01;CDI;D+0 (du);D+00 (du);120,51;96,19
RENDA FIXA;CAIXA FIC FIF EQUILIBRIO MPE RF LP - RESP LTDA;2006-07-05T00:00:00Z;5,91248200;0,051;0,57;5,99;13,42;41,098;41,251;1,00;Sim;1.000,00;CDI;D+0 (du);D+00 (du);117,81;94,23
RENDA FIXA;CAIXA FIC FIF FOCO IND. DE PRECOS RF LP - RESP LTDA;2012-03-19T00:00:00Z;3,13147200;-0,179;-0,30;5,43;10,41;77,877;79,227;1,00;Sim;100,00;NÃO SE APLICA;D+3 (du);D+03 (du);135,28;74,03
RENDA FIXA;CAIXA FIC FIF INSTITUCIONAL SOBERANO PLUS RF - RESP LTDA;2022-10-21T00:00:00Z;1,55636032;0,052;0,58;6,32;14,18;370,782;349,115;0,10;Sim;5.000.000,00;CDI;D+0 (du);D+00 (du);125,57;99,76
RENDA FIXA;CAIXA FIC FIF MUTUA RF LONGO PRAZO - RESP LTDA;2008-11-20T00:00:00Z;5,18303300;0,053;0,59;6,39;14,23;368,840;364,872;0,03;Sim;0,01;CDI;D+0 (du);D+00 (du);126,75;99,85
RENDA FIXA;CAIXA FIC FIF OBJETIVO PRE RF LP - RESP LTDA;2012-06-27T00:00:00Z;3,29603900;-0,287;-0,43;3,42;9,95;134,195;140,227;0,70;Sim;1.000,00;CDI;D+0 (du);D+00 (du);88,61;84,88
RENDA FIXA;CAIXA FIC FIF PERFORMANCE IMA B RF LP - RESP LTDA;2012-05-02T00:00:00Z;3,31210000;-0,496;-0,82;3,93;7,57;64,947;66,278;0,80;Sim;1.000,00;IMA-B TOTAL;D+0 (du);D+00 (du);127,19;71,35
RENDA FIXA;CAIXA FIC FIF RELACIONAMENTO IDEAL RF LP - RESP LTDA;2012-04-16T00:00:00Z;3,31295600;0,049;0,55;5,93;13,28;13,023;13,218;1,00;Nao;1.000,00;CDI;D+0 (du);D+00 (du);117,11;93,41
RENDA FIXA;CAIXA FIC FIF RELACIONAMENTO PERSONAL RF LP - RESP LTDA;2012-04-16T00:00:00Z;3,49578300;0,053;0,59;6,15;13,77;119,989;119,958;0,70;Sim;0,01;CDI;D+0 (du);D+00 (du);120,82;96,72
RENDA FIXA;CAIXA FIC FIF SUPREMO RF LONGO PRAZO - RESP LTDA;2006-07-04T00:00:00Z;6,20578100;0,052;0,58;6,10;13,66;121,597;122,347;0,80;Nao;70.000,00;CDI;D+0 (du);D+00 (du);119,89;95,96
RENDA FIXA;CAIXA FIC FIF TITULO PUBLICO MPE RF LP - RESP LTDA;2012-10-05T00:00:00Z;3,23260400;0,051;0,56;6,07;13,35;19,486;18,440;0,50;Sim;1.000,00;CDI;D+0 (du);D+00 (du);120,14;93,33
RENDA FIXA;CAIXA FIF BRASIL 2026 X TP RF - RESP LTDA;2024-04-11T00:00:00Z;1,11411147;0,053;0,60;4,70;7,62;1.007,009;998,546;0,10;Sim;300.000,00;IPCA + 5%;D+0 (du);D+00 (du);82,78;47,28
RENDA FIXA;CAIXA FIF BRASIL 2030 X TP RF RESP LTDA;2023-05-16T00:00:00Z;1,02461522;-0,536;-1,10;0,54;1,46;76,654;77,237;0,15;Sim;300.000,00;IPCA + 5%;D+0 (du);D+00 (du);43,60;24,25
RENDA FIXA;CAIXA FIF BRASIL 2032 X TP RF RESP LTDA;2023-05-16T00:00:00Z;0,99846117;-0,862;-1,62;-0,27;0,07;429,242;434,638;0,15;Sim;300.000,00;IPCA + 5%;D+0 (du);D+00 (du);46,17;23,90
RENDA FIXA;CAIXA FIF BRASIL 2033 X TP RF RESP LTDA;2023-05-16T00:00:00Z;0,99192168;-0,770;-1,70;-0,28;-0,63;664,743;678,993;0,15;Sim;300.000,00;IPCA + 5%;D+0 (du);D+00 (du);131,73;20,66
RENDA FIXA;CAIXA FIF BRASIL 2035 X TP RF - RL;2024-04-01T00:00:00Z;0,94441473;-0,708;-1,55;-1,28;-1,08;112,881;114,881;0,10;Sim;300.000,00;nan;D+0 (du);D+00 (du);105,77;18,86
RENDA FIXA;CAIXA FIF BRASIL 2040 X TP RF - RL;2024-03-26T00:00:00Z;0,95450118;-0,792;-1,22;-0,79;-1,18;65,257;65,851;0,10;Sim;300.000,00;NÃO SE APLICA;D+0 (du);D+00 (du);30,97;20,32
RENDA FIXA;CAIXA FIF BRASIL ESPECIAL 2026 TP RF - RESP LTDA;2024-08-14T00:00:00Z;1,11535961;0,053;0,60;4,71;7,65;3.527,663;3.496,854;0,06;Sim;500.000,00;IPCA + 5%;D+0 (du);D+00 (du);83,14;47,49
RENDA FIXA;CAIXA FIF BRASIL ESPECIAL 2027 TP RF - RESP LTDA;2024-08-14T00:00:00Z;1,06793859;0,035;0,26;4,03;7,00;752,563;751,639;0,06;Sim;500.000,00;IPCA + 5%;D+0 (du);D+00 (du);151,75;41,34
RENDA FIXA;CAIXA FIF BRASIL ESPECIAL 2028 TP RF - RESP LTDA;2024-08-14T00:00:00Z;1,06718402;-0,154;-0,53;2,34;4,25;1.229,355;1.222,724;0,06;Sim;500.000,00;IPCA + 5%;D+0 (du);D+00 (du);61,47;34,01
