Categoria;Fundo;Data Inicio;Cota (R$);Variacao Dia (%);Acum. Mes (%);Acum. Ano (%);Acum. 12M (%);PL (mi R$);PL Medio 30d (mi R$);Taxa Adm %;Aberto;Aplic. Min (R$);Benchmark;Resgate Conv.;Resgate Pgto;% CDI Ano;% CDI 12m
ACOES;CAIXA ATENA BRASIL ACOES LIVRE QUANT FIC FIF ACOES - RESP LTDA;2019-07-31T00:00:00Z;1,94586900;-0,945;;-6,14;13,28;730,073;731,461;2,00;Nao;0,01;NÃO SE APLICA;D+13 (du);D+15 (du);3,44;147,92
ACOES;CAIXA ATENA FIC FIF ACOES FUNCIONARIOS ACOES LIVRE QUANT RESP LTDA;2020-07-06T00:00:00Z;1.872,57523700;-0,939;;-5,67;14,41;9,406;9,585;0,80;Sim;0,01;IBOV;D+13 (du);D+15 (du);28,01;166,70
ACOES;CAIXA ATENA FIC FIF ACOES LIVRE QUANT RESP LTDA;2019-07-31T00:00:00Z;1,81832600;-0,942;;-6,15;13,24;47,862;47,702;2,00;Sim;0,01;IBOV;D+13 (du);D+15 (du);3,09;141,69
ACOES;CAIXA BRASIL ETF IBOVESPA FIF ACOES - RESP LTDA;2012-11-27T00:00:00Z;3,54788600;-0,593;;6,41;28,24;7,396;8,530;0,50;Nao;0,01;IBOV;D+1 (du);D+03 (du);290,89;194,64
ACOES;CAIXA BRASIL IBX-50 FIF ACOES - RESP LTDA;2008-02-18T00:00:00Z;2,00310800;-0,587;;5,68;25,94;197,734;194,884;0,70;Sim;0,01;IBX50;D+1 (du);D+03 (du);251,29;177,37
ACOES;CAIXA BRASIL INDEXA IBOVESPA FIF ACOES - RESP LTDA;2011-07-29T00:00:00Z;3,85979500;-0,669;;6,61;28,78;283,840;283,121;0,50;Sim;0,01;IBOV;D+1 (du);D+03 (du);295,87;197,69
ACOES;CAIXA EXPERT CLARITAS VALOR FIC FIF AÇÕES - RESP LTDA;2020-10-20T00:00:00Z;1.492,33462200;-0,717;;-0,23;16,16;21,519;21,248;0,60;Sim;10.000,00;IBOV;D+23 (du);D+25 (du);124,77;125,43
ACOES;CAIXA EXPERT VERDE AM LONG BIAS FIC FIF ACOES - RESP LTDA;2020-10-05T00:00:00Z;1.001,78076900;-0,568;;2,19;22,69;8,110;7,984;0,70;Sim;10.000,00;IBOV;D+22 (du);D+24 (du);162,11;166,85
ACOES;CAIXA EXPERT VINCI VALOR DIVIDENDOS RPPS FIC FIF ACOES - RESP LTDA;2012-08-23T00:00:00Z;3,46500208;-0,615;;6,51;25,15;1.328,749;1.301,622;;Sim;10.000,00;IBOV;D+30 (du);D+32 (du);219,56;164,40
ACOES;CAIXA EXPERT VINCI VALOR RPPS FIC FIF ACOES - RESP LTDA;2011-12-12T00:00:00Z;2,49399172;-0,725;;5,52;26,90;763,407;751,257;;Sim;10.000,00;IBOV;D+21 (du);D+23 (du);250,95;178,02
ACOES;CAIXA FIC FIF ACOES ACOES MULTIGESTOR RESP LTDA;2019-06-25T00:00:00Z;1,25691900;-0,636;;-2,34;12,18;283,951;280,619;1,50;Sim;0,01;IBOV;D+23 (du);D+25 (du);89,50;95,49
ACOES;CAIXA FIC FIF ACOES COMPROMISSO BDR NIVEL I RESP LTDA;2021-11-05T00:00:00Z;1,20744300;-0,606;;-0,22;17,54;3,727;3,732;1,00;Sim;0,01;BDRX;D+1 (du);D+03 (du);-49,32;94,36
ACOES;CAIXA FIC FIF ACOES DIVIDENDOS QUANTITATIVO RESP LTDA;2021-09-02T00:00:00Z;1,90585400;-0,653;;-6,32;10,92;1,717;1,710;2,00;Sim;0,01;IDIV;D+13 (du);D+15 (du);-40,48;106,39
ACOES;CAIXA FIC FIF ACOES E FUNDO IBOVESPA RESP LTDA;2012-10-05T00:00:00Z;2,55926500;-0,668;;6,37;28,18;13,132;13,078;0,80;Sim;0,01;IBOV;D+1 (du);D+03 (du);290,28;193,37
ACOES;CAIXA FIF ACOES BANCO DO BRASIL PLUS RESP LTDA;2019-10-23T00:00:00Z;1.256,34931400;-1,725;;-8,09;2,15;41,288;40,270;1,50;Sim;0,01;IBOV;D+1 (du);D+03 (du);-54,67;-179,46
ACOES;CAIXA FIF ACOES BDR NIVEL I - RESP LTDA;2013-06-24T00:00:00Z;10,18579000;0,976;;2,87;12,73;279,525;278,180;1,50;Sim;0,01;BDRX11;D+1 (du);D+03 (du);-67,01;116,71
ACOES;CAIXA FIF ACOES CAIXA SEGURIDADE RESP LTDA;2021-04-30T00:00:00Z;2,98589000;-0,001;;23,26;54,95;485,814;467,461;0,20;Sim;0,01;IBOV;D+1 (du);D+03 (du);207,63;168,52
ACOES;CAIXA FIF ACOES CONSTRUCAO CIVIL RESP LTDA;2009-06-22T00:00:00Z;1,91662200;-0,667;;0,80;25,48;116,365;112,001;2,00;Sim;0,01;IMOB-IMOBILIÁRIO;D+1 (du);D+03 (du);-31,28;152,26
ACOES;CAIXA FIF ACOES CONSUMO RESP LTDA;2012-04-26T00:00:00Z;1,09561500;-1,035;;-5,87;7,25;56,139;55,420;1,60;Sim;0,01;ICON11;D+1 (du);D+03 (du);-34,64;25,61
ACOES;CAIXA FIF ACOES ELETROBRAS RESP LTDA;2022-05-30T00:00:00Z;1,84198800;-1,331;;7,15;92,31;281,285;271,649;0,45;Sim;0,01;OUTROS;D+1 (du);D+03 (du);329,26;519,89
ACOES;CAIXA FIF ACOES IBOVESPA ATIVO RESP LTDA;2007-02-01T00:00:00Z;2,20297200;-0,614;;4,99;26,29;35,297;34,801;2,00;Sim;0,01;IBOV;D+1 (du);D+03 (du);245,64;187,71
ACOES;CAIXA FIF ACOES IBrX ATIVO -RESP LTDA;2005-09-12T00:00:00Z;4,78261200;-0,668;;6,57;29,07;23,301;22,839;1,50;Sim;0,01;IBX;D+1 (du);D+03 (du);271,07;196,06
ACOES;CAIXA FIF ACOES INDEXA IAGRO RESP LTDA;2022-06-14T00:00:00Z;0,83921700;-0,546;;-12,82;-13,10;2,879;2,860;0,80;Sim;0,01;OUTROS;D+1 (du);D+03 (du);-125,86;-82,72
ACOES;CAIXA FIF ACOES INDEXA PIBB IBRX 50 RESP LTDA;2005-09-12T00:00:00Z;5,77391600;-0,672;;7,34;29,56;42,716;42,275;0,80;Sim;0,01;PIBB11;D+1 (du);D+03 (du);327,51;204,94
ACOES;CAIXA FIF ACOES INDEXA SETOR FINANCEIRO RESP LTDA;2021-01-27T00:00:00Z;1.513,81352000;-0,729;;4,02;24,77;30,378;29,420;0,80;Sim;0,01;IFNC;D+1 (du);D+03 (du);151,56;101,32
ACOES;CAIXA FIF ACOES INFRAESTRUTURA RESP LTDA;2010-04-19T00:00:00Z;2,83977800;-1,004;;4,19;19,30;123,153;123,583;2,00;Sim;0,01;IBOV;D+1 (du);D+03 (du);329,00;179,66
ACOES;CAIXA FIF ACOES PETROBRAS PLUS RESP LTDA;2019-06-28T00:00:00Z;4,09983200;-1,235;;30,19;23,75;68,294;73,090;1,50;Nao;0,01;PETR3;D+1 (du);D+03 (du);1.374,44;379,46
ACOES;CAIXA FIF ACOES PETROBRAS PRE-SAL RESP LTDA;2010-09-28T00:00:00Z;5,88788300;-0,874;;25,53;24,65;105,112;112,337;0,50;Sim;0,01;PETR4;D+1 (du);D+03 (du);1.240,37;365,83
ACOES;CAIXA FIF ACOES SMALL CAPS ATIVO RESP LTDA;2012-11-01T00:00:00Z;1,44717700;-0,611;;-5,07;5,08;438,406;433,073;1,50;Sim;0,01;SMLL;D+1 (du);D+03 (du);-20,21;52,67
ACOES;CAIXA FIF ACOES SUSTENTABILIDADE EMPRESARIAL ISE-IS RESP LTDA;2007-11-05T00:00:00Z;1,71277900;-0,689;;0,48;16,02;2,113;2,075;0,80;Sim;0,01;ISE;D+1 (du);D+03 (du);124,46;115,19
ACOES;CAIXA INSTITUCIONAL BDR NIVEL I FIF ACOES - RESP LTDA;2013-06-24T00:00:00Z;11,42463454;0,984;;3,23;13,55;2.338,814;2.327,690;0,70;Sim;0,01;BDRX11;D+1 (du);D+03 (du);-60,80;123,24
ACOES;CAIXA SEGURIDADE II FIF AÇÕES - RESP LTDA;2025-03-24T00:00:00Z;1,47484500;-0,001;;23,17;54,74;21,720;20,748;0,20;Nao;0,01;NÃO SE APLICA;D+1 (du);D+03 (du);229,70;166,72
CAMBIAL;CAIXA FIC FIF INDEXA DOLAR CAMBIAL - RESP LTDA;2005-06-27T00:00:00Z;3,86357800;0,077;;-3,89;-3,91;97,496;97,158;0,80;Sim;0,01;PTAX;D+1 (du);D+01 (du);-239,61;-57,16
FII;CAIXA RIO BRAVO FUNDO DE FII;2013-11-22T00:00:00Z;;;;;;;;1,20;Nao;0,00;IBOV;D+0 (du);D+00 (du);;
FII;CAIXA RIO BRAVO FUNDO DE FII II;2019-04-18T00:00:00Z;;;;;;;;1,15;Nao;0,00;CDI;D+0 (du);D+00 (du);;
FII;FII CAIXA CARTEIRA IMOBILIÁRIA;2022-03-16T00:00:00Z;;;;;;;;0,70;Nao;;IFIX; (du); (du);;
MULTIMERCADO;CAIXA BRASIL ESTRATEGIA LIVRE FIC FIF MM LONGO PRAZO - RESP LTDA;2019-10-23T00:00:00Z;1.556,00165400;0,165;;4,83;11,03;130,547;129,524;1,50;Sim;0,01;CDI;D+13 (du);D+15 (du);111,58;93,02
MULTIMERCADO;CAIXA CAPITAL PROTEGIDO CICLICO III FIC FIF MM - RESP LTDA;2022-01-10T00:00:00Z;1,55145600;0,256;;3,91;22,76;14,616;14,459;0,90;Nao;5.000,00;NÃO SE APLICA;D+0 (du);D+02 (du);75,95;132,12
MULTIMERCADO;CAIXA CAPITAL PROTEGIDO IBOV CICLICO I FIC FIF MM - RESP LTDA;2011-11-08T00:00:00Z;3,30071900;-0,596;;3,60;7,56;157,209;156,367;1,60;Nao;5.000,00;CDI;D+1 (du);D+03 (du);39,66;45,06
MULTIMERCADO;CAIXA CARTEIRA QUANTITATIVA DUO FIC FIF MM LP - RESP LTDA;2026-04-07T00:00:00Z;1,01377700;0,032;;;;2,636;2,398;0,80;Sim;0,01;NÃO SE APLICA;D+8 (du);D+10 (du);;
MULTIMERCADO;CAIXA CARTEIRA QUANTITATIVA QUALI FIC FIF MM LP - RESP LTDA;2026-04-07T00:00:00Z;0,97247600;0,008;;;;1,308;1,127;0,80;Sim;0,01;NÃO SE APLICA;D+14 (du);D+16 (du);;
MULTIMERCADO;CAIXA CARTEIRA QUANTITATIVA UNO FIC FIF MM LP - RESP LTDA;2026-04-07T00:00:00Z;1,02662300;0,043;;;;11,756;12,196;0,80;Sim;0,01;NÃO SE APLICA;D+1 (du);D+03 (du);;
MULTIMERCADO;CAIXA EXPERT BTG PACTUAL X 10 FIC FF MM LP - RESP LTDA;2013-03-21T00:00:00Z;6,84284300;-0,192;;6,40;15,08;128,371;128,424;1,00;Sim;10.000,00;CDI;D+8 (du);D+10 (du);145,98;119,31
MULTIMERCADO;CAIXA EXPERT GIANT ZARATHUSTRA FIC FIF MM - RESP LTDA;2021-02-12T00:00:00Z;1,34032000;-0,208;;4,43;1,68;12,596;12,954;0,40;Sim;10.000,00;NÃO SE APLICA;D+22 (du);D+25 (du);55,70;15,26
MULTIMERCADO;CAIXA EXPERT HASHDEX NASDAQ CRYPTO INDEX FIC FIF MM - RESP LTDA;2025-10-07T00:00:00Z;0,43097636;-2,860;;-40,32;;3,411;3,658;0,70;Sim;100,00;OUTROS;D+3 (du);D+08 (du);-538,29;
MULTIMERCADO;CAIXA EXPERT PIMCO INCOME IE FIC FIF MM LP - RESP LTDA;2023-08-21T00:00:00Z;1,44383700;-0,287;;4,80;13,72;285,114;283,605;0,93;Sim;10.000,00;NÃO SE APLICA;D+3 (du);D+08 (du);73,23;113,18
MULTIMERCADO;CAIXA EXPERT SPX NIMITZ FIC FIF MM - RESP LTDA;2020-05-04T00:00:00Z;1,81879300;0,217;;2,96;11,20;176,589;176,240;2,00;Sim;10.000,00;CDI;D+22 (du);D+24 (du);-0,15;71,88
MULTIMERCADO;CAIXA FIC FIF ALOCACAO MACRO MM LP RESP LTDA;2007-02-01T00:00:00Z;5,65376100;0,139;;6,11;12,72;899,950;894,925;0,50;Sim;10.000,00;CDI;D+1 (du);D+03 (du);121,91;100,08
MULTIMERCADO;CAIXA FIC FIF CAPITAL PROTEGIDO CESTA AGRO MM LP - RESP LTDA;2022-07-04T00:00:00Z;1,38396400;-0,252;;2,05;7,31;70,921;70,774;0,90;Nao;5.000,00;OUTROS;D+0 (du);D+02 (du);69,45;62,22
MULTIMERCADO;CAIXA FIC FIF ESTRAT. LIVRE MULTIMERCADO LP - RESP LTDA;2019-10-21T00:00:00Z;1.642,19347800;0,166;;4,80;11,00;114,062;113,611;1,50;Sim;0,01;CDI;D+13 (du);D+15 (du);111,24;92,96
MULTIMERCADO;CAIXA FIC FIF ESTRATEGICO MULTIMERCADO LP RESP LTDA;2006-04-10T00:00:00Z;5,36209765;0,172;;4,50;10,89;32,839;32,626;1,20;Sim;0,01;CDI;D+0 (du);D+01 (du);98,90;91,33
MULTIMERCADO;CAIXA FIC FIF FOF SMART LONG SHORT LP RESP LTDA;2023-07-18T00:00:00Z;1,26228100;-0,027;;3,35;9,59;5,758;6,248;1,00;Sim;0,01;CDI;D+24 (du);D+26 (du);63,48;84,14
MULTIMERCADO;CAIXA FIC FIF FUNCIONARIOS ESTRATEGIA LIVRE MM LP RESP LTDA;2020-07-06T00:00:00Z;1.664,59309300;0,168;;5,26;11,88;14,467;14,434;0,60;Sim;0,01;CDI;D+13 (du);D+15 (du);121,24;100,29
MULTIMERCADO;CAIXA FIC FIF HEDGE MULTIMERCADO LONGO PRAZO - RESP LTDA;2020-10-26T00:00:00Z;1.693,86633500;0,107;;7,52;12,21;30,137;29,649;1,00;Sim;0,01;CDI;D+1 (du);D+01 (du);105,18;74,27
MULTIMERCADO;CAIXA FIC FIF JUROS E MOEDAS MM LP - RESP LTDA;2012-06-28T00:00:00Z;3,67410600;0,060;;5,63;11,66;735,576;742,125;0,70;Sim;10.000,00;CDI;D+0 (du);D+00 (du);109,05;90,73
MULTIMERCADO;CAIXA FIC FIF JUROS E MOEDAS MUL PLUS LP - RESP LTDA;2018-03-05T00:00:00Z;1,91682300;0,059;;5,45;11,28;21,479;21,699;1,00;Sim;0,01;CDI;D+0 (du);D+00 (du);105,62;87,95
MULTIMERCADO;CAIXA FIC FIF LONG BIAS MM - RL;2024-04-01T00:00:00Z;1,12449800;-0,578;;-3,02;17,39;3,570;3,546;2,00;Sim;0,01;OUTROS;D+13 (du);D+15 (du);25,34;158,86
MULTIMERCADO;CAIXA FIC FIF MULTIGESTOR GLOBAL EQUITIES IE MM RESP LTDA;2020-11-12T00:00:00Z;1.226,40107200;0,421;;-2,26;-0,44;37,299;36,973;1,00;Sim;0,01;CDI;D+7 (du);D+12 (du);-207,94;-14,12
MULTIMERCADO;CAIXA FIC FOF SMART LONG BIAS MM RESP LTDA;2023-07-18T00:00:00Z;1,42765000;0,107;;4,59;18,79;12,161;11,650;1,00;Sim;0,01;IPCA;D+24 (du);D+26 (du);175,29;166,27
MULTIMERCADO;CAIXA FIC FOF SMART MACRO MM LP RESP LTDA;2023-07-18T00:00:00Z;1,29939000;0,137;;2,95;9,59;27,921;27,727;1,00;Sim;0,01;CDI;D+24 (du);D+26 (du);52,98;77,77
MULTIMERCADO;CAIXA FIC FOF SMART MULTIESTRATEGIA MM RESP LTDA;2014-06-09T00:00:00Z;2,87659000;0,117;;2,99;10,01;72,724;73,545;1,50;Sim;0,01;CDI;D+24 (du);D+26 (du);62,01;79,94
MULTIMERCADO;CAIXA FIF FIC FIM CAPITAL PROTEGIDO CICLICO II LP - RESP LTDA;2022-07-18T00:00:00Z;1,47307400;0,128;;1,86;9,13;191,000;191,487;0,90;Nao;5.000,00;NÃO SE APLICA;D+0 (du);D+02 (du);22,10;92,96
MULTIMERCADO;CAIXA FIF INDEXA BOLSA AMERICANA MULTIMERCADO LP RESP LTDA;2018-10-16T00:00:00Z;3,81022100;0,711;;13,27;27,81;2.373,181;2.352,497;0,80;Sim;0,01;CDI;D+0 (du);D+01 (du);269,97;251,57
MULTIMERCADO;CAIXA FIF INDEXA EURO MM LP - RL;2024-04-01T00:00:00Z;1,11601500;0,022;;-7,44;-6,27;3,765;3,746;0,80;Sim;0,01;NÃO SE APLICA;D+1 (du);D+03 (du);-253,33;-47,74
MULTIMERCADO;CAIXA FIF INDEXA OURO MULTIMERCADO LP - RESP LTDA;2013-02-15T00:00:00Z;4,23127000;0,034;;-4,77;27,83;513,681;559,449;0,80;Sim;0,01;NÃO SE APLICA;D+1 (du);D+02 (du);242,05;351,21
MULTIMERCADO;CAIXA FIF INDEXA SHORT DOLAR MM LP - RESP LTDA;2020-10-26T00:00:00Z;2.402,83719200;0,022;;16,98;29,97;13,290;13,159;0,80;Sim;0,01;PTAX;D+1 (du);D+01 (du);515,54;268,33
NAN;CAIXA ABSOLUTO PRÉ FIC DE CLASSE DE FIF RENDA FIXA LONGO PRAZO - RESPONSABILIDADE LIMITADA;2003-04-30;19,97315900;0,280;;4,21;10,37;118,626;119,181;1,10;Sim;0,01;CDI;D+0 (du);D+00 (du);81,85;81,38
NAN;CAIXA CAPITAL ÍNDICE DE PREÇOS FIC DE CLASSE DE FIF RENDA FIXA LONGO PRAZO - RESP LIMITADA;2003-04-30;13,47497900;0,103;;4,79;9,60;27,569;27,603;1,50;Sim;0,01;IPCA+6%;D+3 (du);D+03 (du);115,97;66,40
NAN;CAIXA CLÁSSICO FIC DE CLASSE DE FIF RENDA FIXA LONGO PRAZO - RESPONSABILIDADE LIMITADA;2003-04-30;15,05102700;0,050;;6,22;12,08;27,725;27,723;1,40;Nao;100,00;CDI;D+0 (du);D+00 (du);113,78;90,64
NAN;CAIXA DIVIDENDOS FUNDO DE INVESTIMENTO FINANCEIRO EM AÇÕES - RESPONSABILIDADE LIMITADA;2003-10-03;6,72787500;-0,567;;6,08;24,13;330,543;329,315;1,50;Sim;0,01;IDIV11;D+1 (du);D+03 (du);204,96;164,12
NAN;CAIXA EMPREENDER FIC DE CLASSE DE FIF RENDA FIXA LONGO PRAZO - RESPONSABILIDADE LIMITADA;2003-04-30;46,45691600;0,049;;6,18;11,99;40,712;40,560;1,50;Nao;50,00;CDI;D+0 (du);D+00 (du);113,02;90,01
NAN;CAIXA ESPECIAL FIC DE CLASSE DE FIF RENDA FIXA LONGO PRAZO - RESPONSABILIDADE LIMITADA;2003-08-25;10,67493500;0,054;;6,79;13,21;2.401,510;2.380,729;0,40;Sim;100.000,00;CDI;D+0 (du);D+00 (du);123,66;99,08
NAN;CAIXA EXECUTIVO FIC DE CLASSE DE FIF RENDA FIXA LONGO PRAZO - RESPONSABILIDADE LIMITADA;2003-04-30;33,00814100;0,051;;6,39;12,42;2.181,988;2.192,574;1,10;Sim;1.000,00;CDI;D+0 (du);D+00 (du);116,93;93,24
NAN;CAIXA IBOVESPA FUNDO DE INVESTIMENTO EM COTAS DE CLASSE DE FIF EM AÇÕES - RESPONSABILIDADE LIMITADA;1997-01-15;8,56828500;-0,672;;5,83;26,96;85,514;85,415;2,00;Sim;0,01;IBOV;D+1 (du);D+03 (du);280,13;184,07
NAN;CAIXA IDEAL FIC DE CLASSE DE FIF RENDA FIXA LONGO PRAZO - RESPONSABILIDADE LIMITADA;2003-04-30;9,76834600;0,050;;6,19;12,02;582,972;582,833;1,50;Sim;0,01;CDI;D+0 (du);D+00 (du);113,31;90,22
NAN;CAIXA INVESTIDOR FIC DE CLASSE DE FIF RENDA FIXA LONGO PRAZO - RESPONSABILIDADE LIMITADA;2003-04-30;19,17015300;0,053;;6,57;12,76;955,799;952,291;0,85;Sim;5.000,00;CDI;D+0 (du);D+00 (du);119,59;95,67
NAN;CAIXA PATRIMÔNIO ÍNDICE DE PREÇOS FIC DE CLASSE DE FIF RENDA FIXA LONGO PRAZO - RESP LIMITADA;2003-04-30;23,79708100;0,109;;6,29;11,42;94,069;93,866;0,30;Sim;100.000,00;IPCA+6%;D+3 (du);D+03 (du);141,76;79,23
NAN;CAIXA PERSONAL FIC DE CLASSE DE FIF RENDA FIXA LONGO PRAZO - RESPONSABILIDADE LIMITADA;2003-04-30;30,83985400;0,054;;6,70;13,02;3.111,964;3.107,684;0,60;Sim;50.000,00;CDI;D+0 (du);D+00 (du);121,95;97,63
NAN;CAIXA PETROBRAS FUNDO DE INVESTIMENTO FINANCEIRO EM AÇÕES - RESPONSABILIDADE LIMITADA;2000-07-10;38,02776100;-1,236;;30,25;23,85;743,141;797,623;1,50;Sim;0,01;PETR3;D+1 (du);D+03 (du);1.375,48;380,23
NAN;CAIXA PRÁTICO FIC DE CLASSE DE FIF RENDA FIXA CURTO PRAZO - RESPONSABILIDADE LIMITADA;2003-04-30;9,48137400;0,046;;5,93;11,38;2.928,363;2.891,130;1,70;Nao;0,01;CDI;D+0 (du);D+00 (du);109,19;84,26
NAN;CAIXA RV 30 FUNDO DE INVESTIMENTO FINANCEIRO MULTIMERCADO LONGO PRAZO - RESPONSABILIDADE LIMITADA;2003-04-30;12,64190500;-0,018;;6,50;16,95;325,105;322,975;1,00;Sim;0,01;70% CDI + 30% IBOV;D+1 (du);D+03 (du);165,32;122,80
NAN;CAIXA SEBRAE FUNDO DE INVESTIMENTO FINANCEIRO RENDA FIXA LONGO PRAZO - RESPONSABILIDADE LIMITADA;2003-04-30;18,07975000;0,053;;6,79;13,28;4.806,796;4.784,967;;Sim;0,01;CDI;D+0 (du);D+01 (du);125,39;100,01
NAN;CAIXA SELEÇÃO FIC DE CLASSE DE FIF RENDA FIXA - RESPONSABILIDADE LIMITADA;2003-10-01;29,44654700;0,047;;6,18;27,44;21,107;21,078;1,10;Nao;30.000,00;CDI;D+0 (du);D+00 (du);113,86;195,72
NAN;CAIXA SOBERANO FIC DE CLASSE DE FIF RENDA FIXA LONGO PRAZO - RESPONSABILIDADE LIMITADA;2003-04-30;20,34336400;0,046;;6,07;11,73;64,688;64,528;1,50;Nao;50,00;CDI;D+0 (du);D+00 (du);111,47;87,96
NAN;CAIXA VALE DO RIO DOCE FUNDO DE INVESTIMENTO FINANCEIRO EM AÇÕES - RESPONSABILIDADE LIMITADA;2002-02-20;36,81020800;-0,327;;6,55;54,30;616,664;635,972;2,00;Sim;0,01;VALE3;D+1 (du);D+03 (du);360,65;403,15
PRIVATIZACAO;CAIXA FMP FGTS ELETROBRAS - RESP LTDA;2022-06-14T00:00:00Z;1,83552000;-1,323;;7,22;92,67;1.664,540;1.613,436;0,20;Nao;200,00;OUTROS;D+1 (du);D+05 (du);324,82;529,35
PRIVATIZACAO;CAIXA FMP FGTS ELETROBRAS MIGRAÇÃO - RESP LTDA;2022-06-10T00:00:00Z;1,88120200;-1,313;;7,15;92,57;5,249;5,002;0,20;Sim;200,00;OUTROS;D+1 (du);D+05 (du);323,39;528,52
PRIVATIZACAO;CAIXA FUNDO MÚTUO DE PRIVATIZAÇÃO - FGTS - PETROBRAS II - RESPONSABILIDADE LIMITADA;2000-08-17;37,38092900;-1,234;;30,38;23,99;524,788;559,177;1,40;Sim;0,01;PETR3;D+1 (du);D+05 (du);1.445,00;399,74
PRIVATIZACAO;CAIXA FUNDO MÚTUO DE PRIVATIZAÇÃO - FGTS - PETROBRAS III - RESPONSABILIDADE LIMITADA;2000-08-17;39,74935600;-1,235;;30,53;24,22;601,292;641,559;1,20;Nao;10.000,00;PETR3;D+1 (du);D+05 (du);1.448,41;402,10
PRIVATIZACAO;CAIXA FUNDO MÚTUO DE PRIVATIZAÇÃO - FGTS - PETROBRAS IV - RESPONSABILIDADE LIMITADA;2000-08-17;42,32037900;-1,230;;30,67;24,50;608,986;648,173;0,95;Nao;300,00;PETR3;D+1 (du);D+05 (du);1.451,48;404,68
PRIVATIZACAO;CAIXA FUNDO MÚTUO DE PRIVATIZAÇÃO - FGTS - VALE DO RIO DOCE I - RESPONSABILIDADE LIMITADA;2002-03-27;35,11480000;-0,326;;6,57;54,35;439,554;451,185;1,90;Nao;0,01;VALE3;D+1 (du);D+05 (du);373,51;423,55
PRIVATIZACAO;CAIXA FUNDO MÚTUO DE PRIVATIZAÇÃO - FGTS - VALE DO RIO DOCE II - RESPONSABILIDADE LIMITADA;2002-03-27;40,79832700;-0,324;;6,81;55,07;730,990;750,866;1,40;Nao;10.000,00;VALE3;D+1 (du);D+05 (du);378,64;429,52
PRIVATIZACAO;CAIXA FUNDO MÚTUO DE PRIVATIZAÇÃO - FGTS - VALE DO RIO DOCE MIGRAÇÃO- RESPONSABILIDADE LIMITADA;2002-02-26;34,18905500;-0,325;;6,55;54,09;11,724;11,857;1,90;Sim;0,01;VALE3;D+1 (du);D+05 (du);373,38;421,57
PRIVATIZACAO;CAIXA FUNDO MÚTUO DE PRIVATIZAÇÃO - FGTS CARTEIRA LIVRE - FGTS CL ABSOLUTO - RESP LIMITADA;2001-08-24;16,08969100;-0,874;;-4,60;16,66;110,217;110,108;1,90;Sim;0,01;PETR3;D+1 (du);D+05 (du);42,83;177,20
RENDA FIXA;CAIXA BRASIL 2027 TP FIF RF - RESP LTDA;2022-06-06T00:00:00Z;1,14500699;0,058;;4,28;6,22;517,660;515,911;0,20;Sim;300.000,00;IPCA + 5%;D+0 (du);D+00 (du);150,30;40,19
RENDA FIXA;CAIXA BRASIL 2027 TP X FIF RF LP - RESP LTDA;2023-05-16T00:00:00Z;1,10802885;0,058;;4,31;6,28;583,985;575,417;0,15;Sim;300.000,00;IPCA + 5%;D+0 (du);D+00 (du);150,89;40,67
RENDA FIXA;CAIXA BRASIL 2028 X TP FIF RF - RESP LTDA;2023-05-16T00:00:00Z;1,07463525;0,097;;2,69;4,64;561,856;560,181;0,15;Sim;300.000,00;IPCA + 5%;D+0 (du);D+00 (du);60,52;33,38
RENDA FIXA;CAIXA BRASIL 2030 II TP FIF RF - RESP LTDA;2014-03-26T00:00:00Z;1,93833299;0,200;;1,28;2,93;1.069,441;1.063,306;0,20;Sim;300.000,00;CDI;D+0 (du);D+00 (du);43,54;24,06
RENDA FIXA;CAIXA BRASIL 2030 III TP  FIF RF - RESP LTDA;2015-03-16T00:00:00Z;1,75270565;0,200;;1,28;2,97;238,823;237,453;0,20;Sim;300.000,00;CDI;D+1 (du);D+02 (du);43,60;24,28
RENDA FIXA;CAIXA BRASIL ATIVA FIC FIF RENDA FIXA LONGO PRAZO - RESP LTDA;2020-04-15T00:00:00Z;1.652,48310600;0,066;;5,29;11,42;462,328;460,216;0,40;Sim;0,01;CDI;D+0 (du);D+01 (du);100,70;77,03
RENDA FIXA;CAIXA BRASIL GESTAO ESTRATEGICA FIC FIF RF - RESP LTDA;2016-11-04T00:00:00Z;2,41529700;0,142;;4,87;11,18;3.454,564;3.562,827;0,40;Sim;0,01;IPCA;D+0 (du);D+00 (du);98,16;85,99
RENDA FIXA;CAIXA BRASIL IDKA IPCA 2A TP FIF RF LONGO PRAZO - RESP LTDA;2012-08-16T00:00:00Z;3,81475200;0,096;;5,97;11,24;3.010,362;2.993,580;0,20;Sim;0,01;IDKA2;D+0 (du);D+00 (du);142,65;81,23
RENDA FIXA;CAIXA BRASIL IMA B 5 TP FIF RF LONGO PRAZO - RESP LTDA;2010-07-09T00:00:00Z;5,19090200;0,114;;6,33;11,54;5.574,622;5.549,232;0,20;Sim;0,01;IMA-B 5;D+0 (du);D+00 (du);143,14;80,44
RENDA FIXA;CAIXA BRASIL IMA GERAL TP FIF RF LONGO PRAZO - RESP LTDA;2010-07-08T00:00:00Z;4,77050400;0,111;;5,69;11,80;475,250;501,770;0,20;Sim;0,01;IMA-GERAL TOTAL;D+0 (du);D+00 (du);119,01;90,97
RENDA FIXA;CAIXA BRASIL IMA-B 5+ TP FIF RF LONGO PRAZO - RESP LTDA;2012-04-18T00:00:00Z;3,40476200;0,062;;2,05;6,79;750,913;760,557;0,20;Sim;0,01;IMA-B 5+;D+0 (du);D+00 (du);115,19;68,43
RENDA FIXA;CAIXA BRASIL IMA-B TP FIF RF LONGO PRAZO - RESP LTDA;2010-03-08T00:00:00Z;5,11129500;0,085;;3,95;8,91;2.536,519;2.553,676;0,20;Sim;0,01;IMA-B TOTAL;D+0 (du);D+00 (du);127,69;73,65
RENDA FIXA;CAIXA BRASIL IRF M 1 MAIS TP FIF RF LONGO PRAZO - RESP LTDA;2012-05-11T00:00:00Z;3,79255700;0,375;;4,29;11,11;709,551;714,065;0,20;Sim;0,01;IRF-M 1+;D+0 (du);D+00 (du);83,69;85,59
RENDA FIXA;CAIXA BRASIL IRF-M 1 TP FIF RF - RESP LTDA;2010-05-28T00:00:00Z;4,52014900;0,070;;6,53;12,92;10.783,038;10.968,449;0,20;Sim;0,01;IRF-M 1;D+0 (du);D+00 (du);118,05;96,20
RENDA FIXA;CAIXA BRASIL IRF-M TP FIF RF LONGO PRAZO - RESP LTDA;2012-08-16T00:00:00Z;3,66130200;0,287;;4,88;11,50;1.686,140;1.716,384;0,20;Sim;0,01;IRF-M TOTAL;D+0 (du);D+00 (du);92,58;88,66
RENDA FIXA;CAIXA BRASIL MATRIZ FIF RF - RESP LTDA;2015-12-17T00:00:00Z;2,63130600;0,054;;6,85;13,32;9.124,337;9.133,491;0,20;Sim;0,01;CDI;D+0 (du);D+00 (du);125,22;99,91
RENDA FIXA;CAIXA BRASIL TP FIF RF LONGO PRAZO - RESP LTDA;2006-02-10T00:00:00Z;7,23787000;0,053;;6,76;13,16;12.446,249;12.648,698;0,20;Sim;0,01;CDI;D+0 (du);D+00 (du);124,81;99,16
RENDA FIXA;CAIXA FI MERCURIO RF LP;2019-05-29T00:00:00Z;1,93011300;0,055;;6,90;13,40;6.941,721;7.027,937;0,07;Sim;0,01;CDI;D+0 (du);D+00 (du);125,74;100,43
RENDA FIXA;CAIXA FI SENAR RENDA FIXA LONGO PRAZO;2022-06-01T00:00:00Z;1,65716300;0,054;;6,84;13,33;1.055,401;1.049,110;0,10;Sim;0,00;NÃO SE APLICA;D+0 (du);D+00 (du);125,99;100,17
RENDA FIXA;CAIXA FIC FIF ATIVA RENDA FIXA LP - RESP LTDA;2020-04-22T00:00:00Z;1.780,65100800;0,057;;5,71;11,89;122,749;122,906;0,40;Sim;50.000,00;CDI;D+0 (du);D+01 (du);110,04;92,29
RENDA FIXA;CAIXA FIC FIF BRASIL IDKA PRE 2A RF LP - RESP LTDA;2022-09-21T00:00:00Z;1,45861200;0,271;;4,61;11,18;169,207;169,302;0,20;Sim;0,01;IDKA PRÉ 2A;D+0 (du);D+00 (du);81,98;84,27
RENDA FIXA;CAIXA FIC FIF DESENVOLVER RF LP - RESP LTDA;2012-12-18T00:00:00Z;3,01872600;0,048;;6,04;11,74;1,634;1,632;1,30;Nao;500,00;CDI;D+0 (du);D+00 (du);110,52;88,47
RENDA FIXA;CAIXA FIC FIF E-FUNDO RF LP - RESP LTDA;2012-10-05T00:00:00Z;3,37966500;0,053;;6,59;12,82;63,501;62,681;0,70;Sim;0,01;CDI;D+0 (du);D+00 (du);120,51;96,19
RENDA FIXA;CAIXA FIC FIF EQUILIBRIO MPE RF LP - RESP LTDA;2006-07-05T00:00:00Z;5,93894300;0,052;;6,47;12,57;41,135;40,994;1,00;Sim;1.000,00;CDI;D+0 (du);D+00 (du);117,81;94,23
RENDA FIXA;CAIXA FIC FIF FOCO IND. DE PRECOS RF LP - RESP LTDA;2012-03-19T00:00:00Z;3,14637100;0,107;;5,94;10,72;77,912;78,065;1,00;Sim;100,00;NÃO SE APLICA;D+3 (du);D+03 (du);135,28;74,03
RENDA FIXA;CAIXA FIC FIF INSTITUCIONAL SOBERANO PLUS RF - RESP LTDA;2022-10-21T00:00:00Z;1,56365201;0,052;;6,82;13,26;367,154;367,457;0,10;Sim;5.000.000,00;CDI;D+0 (du);D+00 (du);125,57;99,76
RENDA FIXA;CAIXA FIC FIF MUTUA RF LONGO PRAZO - RESP LTDA;2008-11-20T00:00:00Z;5,20750400;0,052;;6,89;13,33;365,861;367,141;0,03;Sim;0,01;CDI;D+0 (du);D+00 (du);126,75;99,85
RENDA FIXA;CAIXA FIC FIF OBJETIVO PRE RF LP - RESP LTDA;2012-06-27T00:00:00Z;3,33533800;0,285;;4,65;11,01;133,543;134,614;0,70;Sim;1.000,00;CDI;D+0 (du);D+00 (du);88,61;84,88
RENDA FIXA;CAIXA FIC FIF PERFORMANCE IMA B RF LP - RESP LTDA;2012-05-02T00:00:00Z;3,31202300;0,088;;3,92;8,47;64,731;65,076;0,80;Sim;1.000,00;IMA-B TOTAL;D+0 (du);D+00 (du);127,19;71,35
RENDA FIXA;CAIXA FIC FIF RELACIONAMENTO IDEAL RF LP - RESP LTDA;2012-04-16T00:00:00Z;3,32764200;0,051;;6,40;12,44;12,971;13,031;1,00;Nao;1.000,00;CDI;D+0 (du);D+00 (du);117,11;93,41
RENDA FIXA;CAIXA FIC FIF RELACIONAMENTO PERSONAL RF LP - RESP LTDA;2012-04-16T00:00:00Z;3,51183600;0,053;;6,64;12,90;119,911;119,762;0,70;Sim;0,01;CDI;D+0 (du);D+00 (du);120,82;96,72
RENDA FIXA;CAIXA FIC FIF SUPREMO RF LONGO PRAZO - RESP LTDA;2006-07-04T00:00:00Z;6,23405600;0,053;;6,58;12,80;121,590;121,565;0,80;Nao;70.000,00;CDI;D+0 (du);D+00 (du);119,89;95,96
RENDA FIXA;CAIXA FIC FIF TITULO PUBLICO MPE RF LP - RESP LTDA;2012-10-05T00:00:00Z;3,24723500;0,050;;6,55;12,52;26,099;21,613;0,50;Sim;1.000,00;CDI;D+0 (du);D+00 (du);120,14;93,33
RENDA FIXA;CAIXA FIF BRASIL 2026 X TP RF - RESP LTDA;2024-04-11T00:00:00Z;1,11956132;0,064;;5,21;7,17;1.011,935;1.006,139;0,10;Sim;300.000,00;IPCA + 5%;D+0 (du);D+00 (du);82,78;47,28
RENDA FIXA;CAIXA FIF BRASIL 2030 X TP RF RESP LTDA;2023-05-16T00:00:00Z;1,03219918;0,200;;1,28;2,96;77,221;76,778;0,15;Sim;300.000,00;IPCA + 5%;D+0 (du);D+00 (du);43,60;24,25
RENDA FIXA;CAIXA FIF BRASIL 2032 X TP RF RESP LTDA;2023-05-16T00:00:00Z;1,00968191;0,312;;0,85;2,53;434,066;430,966;0,15;Sim;300.000,00;IPCA + 5%;D+0 (du);D+00 (du);46,17;23,90
RENDA FIXA;CAIXA FIF BRASIL 2033 X TP RF RESP LTDA;2023-05-16T00:00:00Z;1,00329370;0,255;;0,87;1,79;672,934;667,391;0,15;Sim;300.000,00;IPCA + 5%;D+0 (du);D+00 (du);131,73;20,66
RENDA FIXA;CAIXA FIF BRASIL 2035 X TP RF - RL;2024-04-01T00:00:00Z;0,94825901;0,047;;-0,88;0,74;113,341;112,950;0,10;Sim;300.000,00;nan;D+0 (du);D+00 (du);105,77;18,86
RENDA FIXA;CAIXA FIF BRASIL 2040 X TP RF - RL;2024-03-26T00:00:00Z;0,94848269;0,018;;-1,41;-0,10;64,845;65,149;0,10;Sim;300.000,00;NÃO SE APLICA;D+0 (du);D+00 (du);30,97;20,32
RENDA FIXA;CAIXA FIF BRASIL ESPECIAL 2026 TP RF - RESP LTDA;2024-08-14T00:00:00Z;1,12082960;0,065;;5,23;7,20;3.545,147;3.524,359;0,06;Sim;500.000,00;IPCA + 5%;D+0 (du);D+00 (du);83,14;47,49
RENDA FIXA;CAIXA FIF BRASIL ESPECIAL 2027 TP RF - RESP LTDA;2024-08-14T00:00:00Z;1,07136452;0,058;;4,36;6,37;754,977;751,945;0,06;Sim;500.000,00;IPCA + 5%;D+0 (du);D+00 (du);151,75;41,34
RENDA FIXA;CAIXA FIF BRASIL ESPECIAL 2028 TP RF - RESP LTDA;2024-08-14T00:00:00Z;1,07137341;0,097;;2,74;4,72;1.312,163;1.254,737;0,06;Sim;500.000,00;IPCA + 5%;D+0 (du);D+00 (du);61,47;34,01
RENDA FIXA;CAIXA FIF BRASIL ESPECIAL 2030 TP RF - RESP LTDA;2024-08-16T00:00:00Z;1,02940148;0,201;;1,34;3,07;427,217;408,513;0,06;Sim;500.000,00;IPCA + 5%;D+0 (du);D+00 (du);44,88;25,13
RENDA FIXA;CAIXA FIF BRASIL ESPECIAL 2032 TP RF - RL;2024-08-16T00:00:00Z;1,00722147;0,312;;0,83;2,67;51,790;45,499;0,06;Sim;500.000,00;IPCA + 5%;D+0 (du);D+00 (du);46,34;25,08
RENDA FIXA;CAIXA FIF BRASIL ESPECIAL 2033 TP RF - RL;2024-08-16T00:00:00Z;0,97663110;0,255;;0,89;1,82;53,671;53,271;0,06;Sim;500.000,00;IPCA + 5%;D+0 (du);D+00 (du);131,86;20,84
RENDA FIXA;CAIXA FIF CNI RF LONGO PRAZO - RESP LTDA;2005-01-26T00:00:00Z;8,78917900;0,054;;6,73;13,19;3.983,770;3.981,879;0,07;Sim;1,00;CDI;D+0 (du);D+00 (du);124,12;99,47
