Categoria;Fundo;Data Inicio;Cota (R$);Variacao Dia (%);Acum. Mes (%);Acum. Ano (%);Acum. 12M (%);PL (mi R$);PL Medio 30d (mi R$);Taxa Adm %;Aberto;Aplic. Min (R$);Benchmark;Resgate Conv.;Resgate Pgto;% CDI Ano;% CDI 12m
ACOES;CAIXA ATENA BRASIL ACOES LIVRE QUANT FIC FIF ACOES - RESP LTDA;2019-07-31T00:00:00Z;1,92188400;-0,764;-3,11;-7,30;5,52;726,050;776,540;2,00;Nao;0,01;NÃO SE APLICA;D+13 (du);D+15 (du);3,44;147,92
ACOES;CAIXA ATENA FIC FIF ACOES FUNCIONARIOS ACOES LIVRE QUANT RESP LTDA;2020-07-06T00:00:00Z;1.848,30809400;-0,760;-3,09;-6,89;6,63;9,790;10,472;0,80;Sim;0,01;IBOV;D+13 (du);D+15 (du);28,01;166,70
ACOES;CAIXA ATENA FIC FIF ACOES LIVRE QUANT RESP LTDA;2019-07-31T00:00:00Z;1,79597100;-0,763;-3,11;-7,31;5,48;47,372;49,106;2,00;Sim;0,01;IBOV;D+13 (du);D+15 (du);3,09;141,69
ACOES;CAIXA BRASIL ETF IBOVESPA FIF ACOES - RESP LTDA;2012-11-27T00:00:00Z;3,48196900;-0,157;-1,92;4,44;20,72;8,811;9,416;0,50;Nao;0,01;IBOV;D+1 (du);D+03 (du);290,89;194,64
ACOES;CAIXA BRASIL IBX-50 FIF ACOES - RESP LTDA;2008-02-18T00:00:00Z;1,94444400;-0,247;-2,01;2,59;17,64;191,943;202,126;0,70;Sim;0,01;IBX50;D+1 (du);D+03 (du);251,29;177,37
ACOES;CAIXA BRASIL INDEXA IBOVESPA FIF ACOES - RESP LTDA;2011-07-29T00:00:00Z;3,78498900;-0,208;-2,00;4,54;21,06;282,032;301,026;0,50;Sim;0,01;IBOV;D+1 (du);D+03 (du);295,87;197,69
ACOES;CAIXA EXPERT CLARITAS VALOR FIC FIF AÇÕES - RESP LTDA;2020-10-20T00:00:00Z;1.446,14967300;-0,344;-2,56;-3,32;5,80;20,848;22,304;0,60;Sim;10.000,00;IBOV;D+23 (du);D+25 (du);124,77;125,43
ACOES;CAIXA EXPERT VERDE AM LONG BIAS FIC FIF ACOES - RESP LTDA;2020-10-05T00:00:00Z;968,49361500;-0,292;-2,22;-1,21;12,31;7,857;8,170;0,70;Sim;10.000,00;IBOV;D+22 (du);D+24 (du);162,11;166,85
ACOES;CAIXA EXPERT VINCI VALOR DIVIDENDOS RPPS FIC FIF ACOES - RESP LTDA;2012-08-23T00:00:00Z;3,32133597;-0,257;-1,85;2,09;14,88;1.273,657;1.334,953;;Sim;10.000,00;IBOV;D+30 (du);D+32 (du);219,56;164,40
ACOES;CAIXA EXPERT VINCI VALOR RPPS FIC FIF ACOES - RESP LTDA;2011-12-12T00:00:00Z;2,40654903;-0,236;-2,31;1,82;16,07;736,641;787,456;;Sim;10.000,00;IBOV;D+21 (du);D+23 (du);250,95;178,02
ACOES;CAIXA FIC FIF ACOES ACOES MULTIGESTOR RESP LTDA;2019-06-25T00:00:00Z;1,22697800;-0,600;-2,58;-4,67;3,09;277,449;294,396;1,50;Sim;0,01;IBOV;D+23 (du);D+25 (du);89,50;95,49
ACOES;CAIXA FIC FIF ACOES COMPROMISSO BDR NIVEL I RESP LTDA;2021-11-05T00:00:00Z;1,18944600;0,044;0,68;-1,71;14,11;3,838;3,880;1,00;Sim;0,01;BDRX;D+1 (du);D+03 (du);-49,32;94,36
ACOES;CAIXA FIC FIF ACOES DIVIDENDOS QUANTITATIVO RESP LTDA;2021-09-02T00:00:00Z;1,87347300;-0,616;-2,34;-7,91;4,50;1,688;1,801;2,00;Sim;0,01;IDIV;D+13 (du);D+15 (du);-40,48;106,39
ACOES;CAIXA FIC FIF ACOES E FUNDO IBOVESPA RESP LTDA;2012-10-05T00:00:00Z;2,51041500;-0,208;-2,00;4,34;20,52;12,952;13,688;0,80;Sim;0,01;IBOV;D+1 (du);D+03 (du);290,28;193,37
ACOES;CAIXA FIF ACOES BANCO DO BRASIL PLUS RESP LTDA;2019-10-23T00:00:00Z;1.206,54152000;-0,366;-4,18;-11,74;-12,60;38,623;41,614;1,50;Sim;0,01;IBOV;D+1 (du);D+03 (du);-54,67;-179,46
ACOES;CAIXA FIF ACOES BDR NIVEL I - RESP LTDA;2013-06-24T00:00:00Z;10,21572900;1,070;-0,42;3,17;19,77;281,973;274,985;1,50;Sim;0,01;BDRX11;D+1 (du);D+03 (du);-67,01;116,71
ACOES;CAIXA FIF ACOES CAIXA SEGURIDADE RESP LTDA;2021-04-30T00:00:00Z;2,68107200;0,680;1,37;10,68;30,52;445,202;443,722;0,20;Sim;0,01;IBOV;D+1 (du);D+03 (du);207,63;168,52
ACOES;CAIXA FIF ACOES CONSTRUCAO CIVIL RESP LTDA;2009-06-22T00:00:00Z;1,74287100;-0,460;-5,97;-8,34;6,85;106,820;115,200;2,00;Sim;0,01;IMOB-IMOBILIÁRIO;D+1 (du);D+03 (du);-31,28;152,26
ACOES;CAIXA FIF ACOES CONSUMO RESP LTDA;2012-04-26T00:00:00Z;1,06371600;-0,516;-3,09;-8,61;-5,10;54,674;58,689;1,60;Sim;0,01;ICON11;D+1 (du);D+03 (du);-34,64;25,61
ACOES;CAIXA FIF ACOES ELETROBRAS RESP LTDA;2022-05-30T00:00:00Z;1,71183100;-0,471;-1,23;-0,42;67,98;261,029;276,621;0,45;Sim;0,01;OUTROS;D+1 (du);D+03 (du);329,26;519,89
ACOES;CAIXA FIF ACOES IBOVESPA ATIVO RESP LTDA;2007-02-01T00:00:00Z;2,14394600;-0,410;-1,93;2,18;18,85;34,421;36,344;2,00;Sim;0,01;IBOV;D+1 (du);D+03 (du);245,64;187,71
ACOES;CAIXA FIF ACOES IBrX ATIVO -RESP LTDA;2005-09-12T00:00:00Z;4,60741300;-0,406;-3,04;2,67;19,25;22,264;23,638;1,50;Sim;0,01;IBX;D+1 (du);D+03 (du);271,07;196,06
ACOES;CAIXA FIF ACOES INDEXA IAGRO RESP LTDA;2022-06-14T00:00:00Z;0,83184600;-0,787;-2,38;-13,58;-18,38;2,827;3,000;0,80;Sim;0,01;OUTROS;D+1 (du);D+03 (du);-125,86;-82,72
ACOES;CAIXA FIF ACOES INDEXA PIBB IBRX 50 RESP LTDA;2005-09-12T00:00:00Z;5,67690500;-0,315;-2,17;5,53;22,25;41,784;44,366;0,80;Sim;0,01;PIBB11;D+1 (du);D+03 (du);327,51;204,94
ACOES;CAIXA FIF ACOES INDEXA SETOR FINANCEIRO RESP LTDA;2021-01-27T00:00:00Z;1.439,85776000;-0,674;-2,96;-1,06;9,49;28,625;30,442;0,80;Sim;0,01;IFNC;D+1 (du);D+03 (du);151,56;101,32
ACOES;CAIXA FIF ACOES INFRAESTRUTURA RESP LTDA;2010-04-19T00:00:00Z;2,84435400;-0,250;-1,37;4,36;13,89;124,401;133,500;2,00;Sim;0,01;IBOV;D+1 (du);D+03 (du);329,00;179,66
ACOES;CAIXA FIF ACOES PETROBRAS PLUS RESP LTDA;2019-06-28T00:00:00Z;4,51150900;0,697;-1,28;43,26;42,58;76,026;81,444;1,50;Nao;0,01;PETR3;D+1 (du);D+03 (du);1.374,44;379,46
ACOES;CAIXA FIF ACOES PETROBRAS PRE-SAL RESP LTDA;2010-09-28T00:00:00Z;6,40656500;0,782;-1,06;36,59;40,84;117,874;127,501;0,50;Sim;0,01;PETR4;D+1 (du);D+03 (du);1.240,37;365,83
ACOES;CAIXA FIF ACOES SMALL CAPS ATIVO RESP LTDA;2012-11-01T00:00:00Z;1,40564800;-0,628;-3,73;-7,79;-4,05;426,380;451,854;1,50;Sim;0,01;SMLL;D+1 (du);D+03 (du);-20,21;52,67
ACOES;CAIXA FIF ACOES SUSTENTABILIDADE EMPRESARIAL ISE-IS RESP LTDA;2007-11-05T00:00:00Z;1,65996000;-0,480;-1,80;-2,62;4,49;2,054;2,242;0,80;Sim;0,01;ISE;D+1 (du);D+03 (du);124,46;115,19
ACOES;CAIXA INSTITUCIONAL BDR NIVEL I FIF ACOES - RESP LTDA;2013-06-24T00:00:00Z;11,45303187;1,079;-0,41;3,49;20,70;2.357,876;2.306,145;0,70;Sim;0,01;BDRX11;D+1 (du);D+03 (du);-60,80;123,24
ACOES;CAIXA SEGURIDADE II FIF AÇÕES - RESP LTDA;2025-03-24T00:00:00Z;1,32445800;0,679;1,36;10,61;30,34;19,645;19,701;0,20;Nao;0,01;NÃO SE APLICA;D+1 (du);D+03 (du);229,70;166,72
CAMBIAL;CAIXA FIC FIF INDEXA DOLAR CAMBIAL - RESP LTDA;2005-06-27T00:00:00Z;3,86482000;0,629;3,35;-3,86;-0,44;98,322;96,177;0,80;Sim;0,01;PTAX;D+1 (du);D+01 (du);-239,61;-57,16
FII;CAIXA RIO BRAVO FUNDO DE FII;2013-11-22T00:00:00Z;;;;;;;;1,20;Nao;0,00;IBOV;D+0 (du);D+00 (du);;
FII;CAIXA RIO BRAVO FUNDO DE FII II;2019-04-18T00:00:00Z;;;;;;;;1,15;Nao;0,00;CDI;D+0 (du);D+00 (du);;
FII;FII CAIXA CARTEIRA IMOBILIÁRIA;2022-03-16T00:00:00Z;;;;;;;;0,70;Nao;;IFIX; (du); (du);;
MULTIMERCADO;CAIXA BRASIL ESTRATEGIA LIVRE FIC FIF MM LONGO PRAZO - RESP LTDA;2019-10-23T00:00:00Z;1.530,57701000;-0,163;-1,11;3,12;10,31;128,619;131,098;1,50;Sim;0,01;CDI;D+13 (du);D+15 (du);111,58;93,02
MULTIMERCADO;CAIXA CAPITAL PROTEGIDO CICLICO III FIC FIF MM - RESP LTDA;2022-01-10T00:00:00Z;1,52233700;-0,325;-1,49;1,96;17,53;14,342;14,549;0,90;Nao;5.000,00;NÃO SE APLICA;D+0 (du);D+02 (du);75,95;132,12
MULTIMERCADO;CAIXA CAPITAL PROTEGIDO IBOV CICLICO I FIC FIF MM - RESP LTDA;2011-11-08T00:00:00Z;3,28322800;1,004;0,14;3,05;8,72;156,376;154,933;1,60;Nao;5.000,00;CDI;D+1 (du);D+03 (du);39,66;45,06
MULTIMERCADO;CAIXA CARTEIRA QUANTITATIVA DUO FIC FIF MM LP - RESP LTDA;2026-04-07T00:00:00Z;1,00295100;-0,011;-0,24;;;2,402;2,008;0,80;Sim;0,01;NÃO SE APLICA;D+8 (du);D+10 (du);;
MULTIMERCADO;CAIXA CARTEIRA QUANTITATIVA QUALI FIC FIF MM LP - RESP LTDA;2026-04-07T00:00:00Z;0,96255400;0,014;-0,30;;;1,268;0,393;0,80;Sim;0,01;NÃO SE APLICA;D+14 (du);D+16 (du);;
MULTIMERCADO;CAIXA CARTEIRA QUANTITATIVA UNO FIC FIF MM LP - RESP LTDA;2026-04-07T00:00:00Z;1,01641600;0,014;0,06;;;12,760;7,936;0,80;Sim;0,01;NÃO SE APLICA;D+1 (du);D+03 (du);;
MULTIMERCADO;CAIXA EXPERT BTG PACTUAL X 10 FIC FF MM LP - RESP LTDA;2013-03-21T00:00:00Z;6,73867000;-0,473;-1,40;4,78;14,03;127,274;129,703;1,00;Sim;10.000,00;CDI;D+8 (du);D+10 (du);145,98;119,31
MULTIMERCADO;CAIXA EXPERT GIANT ZARATHUSTRA FIC FIF MM - RESP LTDA;2021-02-12T00:00:00Z;1,34494900;-0,043;1,20;4,79;4,00;13,125;13,708;0,40;Sim;10.000,00;NÃO SE APLICA;D+22 (du);D+25 (du);55,70;15,26
MULTIMERCADO;CAIXA EXPERT HASHDEX NASDAQ CRYPTO INDEX FIC FIF MM - RESP LTDA;2025-10-07T00:00:00Z;0,46636243;5,449;-8,53;-35,42;;3,784;3,968;0,70;Sim;100,00;OUTROS;D+3 (du);D+08 (du);-538,29;
MULTIMERCADO;CAIXA EXPERT PIMCO INCOME IE FIC FIF MM LP - RESP LTDA;2023-08-21T00:00:00Z;1,41883500;-0,087;-0,47;2,99;12,58;281,025;279,827;0,93;Sim;10.000,00;NÃO SE APLICA;D+3 (du);D+08 (du);73,23;113,18
MULTIMERCADO;CAIXA EXPERT SPX NIMITZ FIC FIF MM - RESP LTDA;2020-05-04T00:00:00Z;1,79243500;0,112;0,61;1,47;9,33;176,313;176,331;2,00;Sim;10.000,00;CDI;D+22 (du);D+24 (du);-0,15;71,88
MULTIMERCADO;CAIXA FIC FIF ALOCACAO MACRO MM LP RESP LTDA;2007-02-01T00:00:00Z;5,56905300;-0,071;-0,69;4,52;12,31;890,799;899,330;0,50;Sim;10.000,00;CDI;D+1 (du);D+03 (du);121,91;100,08
MULTIMERCADO;CAIXA FIC FIF CAPITAL PROTEGIDO CESTA AGRO MM LP - RESP LTDA;2022-07-04T00:00:00Z;1,37519600;-0,289;0,15;1,40;8,91;70,472;70,956;0,90;Nao;5.000,00;OUTROS;D+0 (du);D+02 (du);69,45;62,22
MULTIMERCADO;CAIXA FIC FIF ESTRAT. LIVRE MULTIMERCADO LP - RESP LTDA;2019-10-21T00:00:00Z;1.615,34054700;-0,164;-1,12;3,09;10,29;113,028;116,446;1,50;Sim;0,01;CDI;D+13 (du);D+15 (du);111,24;92,96
MULTIMERCADO;CAIXA FIC FIF ESTRATEGICO MULTIMERCADO LP RESP LTDA;2006-04-10T00:00:00Z;5,27056264;-0,163;-1,05;2,72;10,15;32,451;33,052;1,20;Sim;0,01;CDI;D+0 (du);D+01 (du);98,90;91,33
MULTIMERCADO;CAIXA FIC FIF FOF SMART LONG SHORT LP RESP LTDA;2023-07-18T00:00:00Z;1,24382100;-0,094;-0,57;1,84;8,24;6,265;6,501;1,00;Sim;0,01;CDI;D+24 (du);D+26 (du);63,48;84,14
MULTIMERCADO;CAIXA FIC FIF FUNCIONARIOS ESTRATEGIA LIVRE MM LP RESP LTDA;2020-07-06T00:00:00Z;1.636,70062800;-0,159;-1,09;3,49;11,20;14,384;15,046;0,60;Sim;0,01;CDI;D+13 (du);D+15 (du);121,24;100,29
MULTIMERCADO;CAIXA FIC FIF HEDGE MULTIMERCADO LONGO PRAZO - RESP LTDA;2020-10-26T00:00:00Z;1.689,92261300;-0,009;1,34;7,27;13,41;29,604;30,660;1,00;Sim;0,01;CDI;D+1 (du);D+01 (du);105,18;74,27
MULTIMERCADO;CAIXA FIC FIF JUROS E MOEDAS MM LP - RESP LTDA;2012-06-28T00:00:00Z;3,64312700;-0,032;-0,20;4,74;11,82;745,740;749,009;0,70;Sim;10.000,00;CDI;D+0 (du);D+00 (du);109,05;90,73
MULTIMERCADO;CAIXA FIC FIF JUROS E MOEDAS MUL PLUS LP - RESP LTDA;2018-03-05T00:00:00Z;1,90110700;-0,033;-0,21;4,58;11,44;21,825;21,640;1,00;Sim;0,01;CDI;D+0 (du);D+00 (du);105,62;87,95
MULTIMERCADO;CAIXA FIC FIF LONG BIAS MM - RL;2024-04-01T00:00:00Z;1,11457300;-0,649;-1,58;-3,87;9,48;3,579;3,437;2,00;Sim;0,01;OUTROS;D+13 (du);D+15 (du);25,34;158,86
MULTIMERCADO;CAIXA FIC FIF MULTIGESTOR GLOBAL EQUITIES IE MM RESP LTDA;2020-11-12T00:00:00Z;1.212,41324500;-0,236;1,35;-3,38;1,90;36,964;36,090;1,00;Sim;0,01;CDI;D+7 (du);D+12 (du);-207,94;-14,12
MULTIMERCADO;CAIXA FIC FOF SMART LONG BIAS MM RESP LTDA;2023-07-18T00:00:00Z;1,38422700;-0,265;-2,40;1,40;11,84;11,477;12,064;1,00;Sim;0,01;IPCA;D+24 (du);D+26 (du);175,29;166,27
MULTIMERCADO;CAIXA FIC FOF SMART MACRO MM LP RESP LTDA;2023-07-18T00:00:00Z;1,28054100;-0,134;-0,90;1,46;7,26;27,499;28,002;1,00;Sim;0,01;CDI;D+24 (du);D+26 (du);52,98;77,77
MULTIMERCADO;CAIXA FIC FOF SMART MULTIESTRATEGIA MM RESP LTDA;2014-06-09T00:00:00Z;2,83122300;-0,140;-1,00;1,37;7,41;73,488;76,788;1,50;Sim;0,01;CDI;D+24 (du);D+26 (du);62,01;79,94
MULTIMERCADO;CAIXA FIF FIC FIM CAPITAL PROTEGIDO CICLICO II LP - RESP LTDA;2022-07-18T00:00:00Z;1,48845900;-0,076;0,04;2,93;13,48;192,995;191,706;0,90;Nao;5.000,00;NÃO SE APLICA;D+0 (du);D+02 (du);22,10;92,96
MULTIMERCADO;CAIXA FIF INDEXA BOLSA AMERICANA MULTIMERCADO LP RESP LTDA;2018-10-16T00:00:00Z;3,74561000;0,227;-2,44;11,35;29,50;2.342,253;2.343,459;0,80;Sim;0,01;CDI;D+0 (du);D+01 (du);269,97;251,57
MULTIMERCADO;CAIXA FIF INDEXA EURO MM LP - RL;2024-04-01T00:00:00Z;1,12834700;0,686;2,40;-6,42;-4,92;3,781;3,470;0,80;Sim;0,01;NÃO SE APLICA;D+1 (du);D+03 (du);-253,33;-47,74
MULTIMERCADO;CAIXA FIF INDEXA OURO MULTIMERCADO LP - RESP LTDA;2013-02-15T00:00:00Z;4,53314400;-0,028;-3,05;2,02;37,81;593,748;650,448;0,80;Sim;0,01;NÃO SE APLICA;D+1 (du);D+02 (du);242,05;351,21
MULTIMERCADO;CAIXA FIF INDEXA SHORT DOLAR MM LP - RESP LTDA;2020-10-26T00:00:00Z;2.366,39748300;-0,528;-2,90;15,21;26,44;12,761;13,020;0,80;Sim;0,01;PTAX;D+1 (du);D+01 (du);515,54;268,33
NAN;CAIXA ABSOLUTO PRÉ FIC DE CLASSE DE FIF RENDA FIXA LONGO PRAZO - RESPONSABILIDADE LIMITADA;2003-04-30;19,54575700;-0,239;-1,51;1,98;8,19;119,589;124,196;1,10;Sim;0,01;CDI;D+0 (du);D+00 (du);81,85;81,38
NAN;CAIXA CAPITAL ÍNDICE DE PREÇOS FIC DE CLASSE DE FIF RENDA FIXA LONGO PRAZO - RESP LIMITADA;2003-04-30;13,36299500;-0,161;-0,91;3,92;8,57;27,765;28,305;1,50;Sim;0,01;IPCA+6%;D+3 (du);D+03 (du);115,97;66,40
NAN;CAIXA CLÁSSICO FIC DE CLASSE DE FIF RENDA FIXA LONGO PRAZO - RESPONSABILIDADE LIMITADA;2003-04-30;14,93446000;0,053;0,18;5,40;12,49;27,731;27,850;1,40;Nao;100,00;CDI;D+0 (du);D+00 (du);113,78;90,64
NAN;CAIXA DIVIDENDOS FUNDO DE INVESTIMENTO FINANCEIRO EM AÇÕES - RESPONSABILIDADE LIMITADA;2003-10-03;6,48872900;-0,282;-1,42;2,31;16,14;331,935;347,574;1,50;Sim;0,01;IDIV11;D+1 (du);D+03 (du);204,96;164,12
NAN;CAIXA EMPREENDER FIC DE CLASSE DE FIF RENDA FIXA LONGO PRAZO - RESPONSABILIDADE LIMITADA;2003-04-30;46,09954600;0,053;0,18;5,36;12,40;40,471;40,609;1,50;Nao;50,00;CDI;D+0 (du);D+00 (du);113,02;90,01
NAN;CAIXA ESPECIAL FIC DE CLASSE DE FIF RENDA FIXA LONGO PRAZO - RESPONSABILIDADE LIMITADA;2003-08-25;10,58462900;0,068;0,22;5,89;13,67;2.361,646;2.375,172;0,40;Sim;100.000,00;CDI;D+0 (du);D+00 (du);123,66;99,08
NAN;CAIXA EXECUTIVO FIC DE CLASSE DE FIF RENDA FIXA LONGO PRAZO - RESPONSABILIDADE LIMITADA;2003-04-30;32,74540900;0,055;0,19;5,55;12,85;2.193,651;2.194,332;1,10;Sim;1.000,00;CDI;D+0 (du);D+00 (du);116,93;93,24
NAN;CAIXA IBOVESPA FUNDO DE INVESTIMENTO EM COTAS DE CLASSE DE FIF EM AÇÕES - RESPONSABILIDADE LIMITADA;1997-01-15;8,41064000;-0,213;-2,01;3,88;19,32;83,977;92,111;2,00;Sim;0,01;IBOV;D+1 (du);D+03 (du);280,13;184,07
NAN;CAIXA IDEAL FIC DE CLASSE DE FIF RENDA FIXA LONGO PRAZO - RESPONSABILIDADE LIMITADA;2003-04-30;9,69299300;0,053;0,18;5,37;12,43;582,398;583,654;1,50;Sim;0,01;CDI;D+0 (du);D+00 (du);113,31;90,22
NAN;CAIXA INVESTIDOR FIC DE CLASSE DE FIF RENDA FIXA LONGO PRAZO - RESPONSABILIDADE LIMITADA;2003-04-30;19,01326400;0,067;0,21;5,70;13,21;950,700;954,756;0,85;Sim;5.000,00;CDI;D+0 (du);D+00 (du);119,59;95,67
NAN;CAIXA PATRIMÔNIO ÍNDICE DE PREÇOS FIC DE CLASSE DE FIF RENDA FIXA LONGO PRAZO - RESP LIMITADA;2003-04-30;23,57057700;-0,128;-0,72;5,28;10,65;93,629;94,463;0,30;Sim;100.000,00;IPCA+6%;D+3 (du);D+03 (du);141,76;79,23
NAN;CAIXA PERSONAL FIC DE CLASSE DE FIF RENDA FIXA LONGO PRAZO - RESPONSABILIDADE LIMITADA;2003-04-30;30,58253000;0,068;0,21;5,81;13,48;3.098,764;3.107,576;0,60;Sim;50.000,00;CDI;D+0 (du);D+00 (du);121,95;97,63
NAN;CAIXA PETROBRAS FUNDO DE INVESTIMENTO FINANCEIRO EM AÇÕES - RESPONSABILIDADE LIMITADA;2000-07-10;41,84315800;0,698;-1,28;43,32;42,70;832,353;890,920;1,50;Sim;0,01;PETR3;D+1 (du);D+03 (du);1.375,48;380,23
NAN;CAIXA PRÁTICO FIC DE CLASSE DE FIF RENDA FIXA CURTO PRAZO - RESPONSABILIDADE LIMITADA;2003-04-30;9,41190500;0,044;0,18;5,15;11,73;2.814,813;2.870,976;1,70;Nao;0,01;CDI;D+0 (du);D+00 (du);109,19;84,26
NAN;CAIXA RV 30 FUNDO DE INVESTIMENTO FINANCEIRO MULTIMERCADO LONGO PRAZO - RESPONSABILIDADE LIMITADA;2003-04-30;12,40492600;-0,175;-1,12;4,50;14,46;321,479;328,662;1,00;Sim;0,01;70% CDI + 30% IBOV;D+1 (du);D+03 (du);165,32;122,80
NAN;CAIXA SEBRAE FUNDO DE INVESTIMENTO FINANCEIRO RENDA FIXA LONGO PRAZO - RESPONSABILIDADE LIMITADA;2003-04-30;17,92723000;0,046;0,17;5,89;13,73;4.768,690;4.783,164;;Sim;0,01;CDI;D+0 (du);D+01 (du);125,39;100,01
NAN;CAIXA SELEÇÃO FIC DE CLASSE DE FIF RENDA FIXA - RESPONSABILIDADE LIMITADA;2003-10-01;29,22201300;0,048;0,19;5,37;27,93;21,078;21,163;1,10;Nao;30.000,00;CDI;D+0 (du);D+00 (du);113,86;195,72
NAN;CAIXA SOBERANO FIC DE CLASSE DE FIF RENDA FIXA LONGO PRAZO - RESPONSABILIDADE LIMITADA;2003-04-30;20,19215800;0,047;0,19;5,28;12,16;64,508;64,635;1,50;Nao;50,00;CDI;D+0 (du);D+00 (du);111,47;87,96
NAN;CAIXA VALE DO RIO DOCE FUNDO DE INVESTIMENTO FINANCEIRO EM AÇÕES - RESPONSABILIDADE LIMITADA;2002-02-20;36,94620100;-0,804;-4,46;6,94;56,97;632,195;663,791;2,00;Sim;0,01;VALE3;D+1 (du);D+03 (du);360,65;403,15
PRIVATIZACAO;CAIXA FMP FGTS ELETROBRAS - RESP LTDA;2022-06-14T00:00:00Z;1,70565000;-0,472;-1,23;-0,36;68,30;1.553,639;1.699,629;0,20;Nao;200,00;OUTROS;D+1 (du);D+05 (du);324,82;529,35
PRIVATIZACAO;CAIXA FMP FGTS ELETROBRAS MIGRAÇÃO - RESP LTDA;2022-06-10T00:00:00Z;1,74965700;-0,470;-1,23;-0,35;68,31;4,787;5,186;0,20;Sim;200,00;OUTROS;D+1 (du);D+05 (du);323,39;528,52
PRIVATIZACAO;CAIXA FUNDO MÚTUO DE PRIVATIZAÇÃO - FGTS - PETROBRAS II - RESPONSABILIDADE LIMITADA;2000-08-17;41,12836100;0,698;-1,28;43,45;42,85;580,165;619,895;1,40;Sim;0,01;PETR3;D+1 (du);D+05 (du);1.445,00;399,74
PRIVATIZACAO;CAIXA FUNDO MÚTUO DE PRIVATIZAÇÃO - FGTS - PETROBRAS III - RESPONSABILIDADE LIMITADA;2000-08-17;43,73471600;0,702;-1,27;43,62;43,17;667,092;714,495;1,20;Nao;10.000,00;PETR3;D+1 (du);D+05 (du);1.448,41;402,10
PRIVATIZACAO;CAIXA FUNDO MÚTUO DE PRIVATIZAÇÃO - FGTS - PETROBRAS IV - RESPONSABILIDADE LIMITADA;2000-08-17;46,55262700;0,700;-1,27;43,74;43,46;672,582;716,410;0,95;Nao;300,00;PETR3;D+1 (du);D+05 (du);1.451,48;404,68
PRIVATIZACAO;CAIXA FUNDO MÚTUO DE PRIVATIZAÇÃO - FGTS - VALE DO RIO DOCE I - RESPONSABILIDADE LIMITADA;2002-03-27;35,24183700;-0,807;-4,47;6,95;57,00;442,844;467,765;1,90;Nao;0,01;VALE3;D+1 (du);D+05 (du);373,51;423,55
PRIVATIZACAO;CAIXA FUNDO MÚTUO DE PRIVATIZAÇÃO - FGTS - VALE DO RIO DOCE II - RESPONSABILIDADE LIMITADA;2002-03-27;40,93322500;-0,805;-4,46;7,17;57,76;737,745;780,829;1,40;Nao;10.000,00;VALE3;D+1 (du);D+05 (du);378,64;429,52
PRIVATIZACAO;CAIXA FUNDO MÚTUO DE PRIVATIZAÇÃO - FGTS - VALE DO RIO DOCE MIGRAÇÃO- RESPONSABILIDADE LIMITADA;2002-02-26;34,32216200;-0,805;-4,46;6,96;56,74;11,714;11,820;1,90;Sim;0,01;VALE3;D+1 (du);D+05 (du);373,38;421,57
PRIVATIZACAO;CAIXA FUNDO MÚTUO DE PRIVATIZAÇÃO - FGTS CARTEIRA LIVRE - FGTS CL ABSOLUTO - RESP LIMITADA;2001-08-24;15,83528100;-0,773;-2,70;-6,11;8,11;109,207;116,130;1,90;Sim;0,01;PETR3;D+1 (du);D+05 (du);42,83;177,20
RENDA FIXA;CAIXA BRASIL 2027 TP FIF RF - RESP LTDA;2022-06-06T00:00:00Z;1,13784898;-0,012;-0,06;3,63;6,50;514,423;516,823;0,20;Sim;300.000,00;IPCA + 5%;D+0 (du);D+00 (du);150,30;40,19
RENDA FIXA;CAIXA BRASIL 2027 TP X FIF RF LP - RESP LTDA;2023-05-16T00:00:00Z;1,10104165;-0,012;-0,06;3,66;6,57;571,118;575,226;0,15;Sim;300.000,00;IPCA + 5%;D+0 (du);D+00 (du);150,89;40,67
RENDA FIXA;CAIXA BRASIL 2028 X TP FIF RF - RESP LTDA;2023-05-16T00:00:00Z;1,06745715;-0,193;-0,81;2,00;3,87;558,103;560,530;0,15;Sim;300.000,00;IPCA + 5%;D+0 (du);D+00 (du);60,52;33,38
RENDA FIXA;CAIXA BRASIL 2030 II TP FIF RF - RESP LTDA;2014-03-26T00:00:00Z;1,91134823;-0,291;-1,76;-0,13;0,76;1.054,552;1.071,241;0,20;Sim;300.000,00;CDI;D+0 (du);D+00 (du);43,54;24,06
RENDA FIXA;CAIXA BRASIL 2030 III TP  FIF RF - RESP LTDA;2015-03-16T00:00:00Z;1,72829641;-0,291;-1,76;-0,13;0,79;235,497;239,226;0,20;Sim;300.000,00;CDI;D+1 (du);D+02 (du);43,60;24,28
RENDA FIXA;CAIXA BRASIL ATIVA FIC FIF RENDA FIXA LONGO PRAZO - RESP LTDA;2020-04-15T00:00:00Z;1.635,42235500;-0,055;-0,35;4,21;10,67;458,763;458,589;0,40;Sim;0,01;CDI;D+0 (du);D+01 (du);100,70;77,03
RENDA FIXA;CAIXA BRASIL GESTAO ESTRATEGICA FIC FIF RF - RESP LTDA;2016-11-04T00:00:00Z;2,37849700;-0,179;-1,04;3,28;10,37;3.594,829;3.725,569;0,40;Sim;0,01;IPCA;D+0 (du);D+00 (du);98,16;85,99
RENDA FIXA;CAIXA BRASIL IDKA IPCA 2A TP FIF RF LONGO PRAZO - RESP LTDA;2012-08-16T00:00:00Z;3,78954800;-0,186;-0,78;5,27;11,23;2.974,229;2.968,658;0,20;Sim;0,01;IDKA2;D+0 (du);D+00 (du);142,65;81,23
RENDA FIXA;CAIXA BRASIL IMA B 5 TP FIF RF LONGO PRAZO - RESP LTDA;2010-07-09T00:00:00Z;5,14225000;-0,126;-0,72;5,34;10,80;5.522,561;5.434,789;0,20;Sim;0,01;IMA-B 5;D+0 (du);D+00 (du);143,14;80,44
RENDA FIXA;CAIXA BRASIL IMA GERAL TP FIF RF LONGO PRAZO - RESP LTDA;2010-07-08T00:00:00Z;4,71200500;-0,096;-0,70;4,40;11,04;510,268;520,075;0,20;Sim;0,01;IMA-GERAL TOTAL;D+0 (du);D+00 (du);119,01;90,97
RENDA FIXA;CAIXA BRASIL IMA-B 5+ TP FIF RF LONGO PRAZO - RESP LTDA;2012-04-18T00:00:00Z;3,35441900;-0,486;-3,14;0,54;3,64;749,377;807,948;0,20;Sim;0,01;IMA-B 5+;D+0 (du);D+00 (du);115,19;68,43
RENDA FIXA;CAIXA BRASIL IMA-B TP FIF RF LONGO PRAZO - RESP LTDA;2010-03-08T00:00:00Z;5,04779300;-0,324;-2,06;2,66;6,68;2.529,201;2.562,846;0,20;Sim;0,01;IMA-B TOTAL;D+0 (du);D+00 (du);127,69;73,65
RENDA FIXA;CAIXA BRASIL IRF M 1 MAIS TP FIF RF LONGO PRAZO - RESP LTDA;2012-05-11T00:00:00Z;3,69226500;-0,296;-1,96;1,53;7,89;707,191;715,909;0,20;Sim;0,01;IRF-M 1+;D+0 (du);D+00 (du);83,69;85,59
RENDA FIXA;CAIXA BRASIL IRF-M 1 TP FIF RF - RESP LTDA;2010-05-28T00:00:00Z;4,47579200;0,021;0,10;5,48;13,16;10.916,703;10.892,639;0,20;Sim;0,01;IRF-M 1;D+0 (du);D+00 (du);118,05;96,20
RENDA FIXA;CAIXA BRASIL IRF-M TP FIF RF LONGO PRAZO - RESP LTDA;2012-08-16T00:00:00Z;3,58186800;-0,206;-1,38;2,61;9,38;1.717,619;1.729,911;0,20;Sim;0,01;IRF-M TOTAL;D+0 (du);D+00 (du);92,58;88,66
RENDA FIXA;CAIXA BRASIL MATRIZ FIF RF - RESP LTDA;2015-12-17T00:00:00Z;2,60895300;0,057;0,20;5,94;13,78;9.187,056;9.242,450;0,20;Sim;0,01;CDI;D+0 (du);D+00 (du);125,22;99,91
RENDA FIXA;CAIXA BRASIL TP FIF RF LONGO PRAZO - RESP LTDA;2006-02-10T00:00:00Z;7,17756500;0,045;0,18;5,87;13,62;12.667,737;12.940,754;0,20;Sim;0,01;CDI;D+0 (du);D+00 (du);124,81;99,16
RENDA FIXA;CAIXA FI MERCURIO RF LP;2019-05-29T00:00:00Z;1,91355700;0,064;0,22;5,98;13,86;6.996,709;7.045,400;0,07;Sim;0,01;CDI;D+0 (du);D+00 (du);125,74;100,43
RENDA FIXA;CAIXA FI SENAR RENDA FIXA LONGO PRAZO;2022-06-01T00:00:00Z;1,64312200;0,047;0,18;5,93;13,78;1.044,399;1.033,711;0,10;Sim;0,00;NÃO SE APLICA;D+0 (du);D+00 (du);125,99;100,17
RENDA FIXA;CAIXA FIC FIF ATIVA RENDA FIXA LP - RESP LTDA;2020-04-22T00:00:00Z;1.765,80400500;-0,025;-0,17;4,83;12,09;123,281;125,592;0,40;Sim;50.000,00;CDI;D+0 (du);D+01 (du);110,04;92,29
RENDA FIXA;CAIXA FIC FIF BRASIL IDKA PRE 2A RF LP - RESP LTDA;2022-09-21T00:00:00Z;1,42487900;-0,297;-1,33;2,19;9,23;170,340;170,645;0,20;Sim;0,01;IDKA PRÉ 2A;D+0 (du);D+00 (du);81,98;84,27
RENDA FIXA;CAIXA FIC FIF DESENVOLVER RF LP - RESP LTDA;2012-12-18T00:00:00Z;2,99605300;0,052;0,18;5,24;12,18;1,625;1,649;1,30;Nao;500,00;CDI;D+0 (du);D+00 (du);110,52;88,47
RENDA FIXA;CAIXA FIC FIF E-FUNDO RF LP - RESP LTDA;2012-10-05T00:00:00Z;3,35194600;0,056;0,20;5,72;13,25;61,997;61,693;0,70;Sim;0,01;CDI;D+0 (du);D+00 (du);120,51;96,19
RENDA FIXA;CAIXA FIC FIF EQUILIBRIO MPE RF LP - RESP LTDA;2006-07-05T00:00:00Z;5,89106300;0,066;0,21;5,61;13,01;40,915;41,339;1,00;Sim;1.000,00;CDI;D+0 (du);D+00 (du);117,81;94,23
RENDA FIXA;CAIXA FIC FIF FOCO IND. DE PRECOS RF LP - RESP LTDA;2012-03-19T00:00:00Z;3,11779300;-0,130;-0,73;4,97;9,93;78,197;79,599;1,00;Sim;100,00;NÃO SE APLICA;D+3 (du);D+03 (du);135,28;74,03
RENDA FIXA;CAIXA FIC FIF INSTITUCIONAL SOBERANO PLUS RF - RESP LTDA;2022-10-21T00:00:00Z;1,55064626;0,053;0,21;5,93;13,76;361,247;342,258;0,10;Sim;5.000.000,00;CDI;D+0 (du);D+00 (du);125,57;99,76
RENDA FIXA;CAIXA FIC FIF MUTUA RF LONGO PRAZO - RESP LTDA;2008-11-20T00:00:00Z;5,16382100;0,053;0,21;5,99;13,81;366,188;363,832;0,03;Sim;0,01;CDI;D+0 (du);D+00 (du);126,75;99,85
RENDA FIXA;CAIXA FIC FIF OBJETIVO PRE RF LP - RESP LTDA;2012-06-27T00:00:00Z;3,26399700;-0,208;-1,39;2,41;8,88;134,953;142,897;0,70;Sim;1.000,00;CDI;D+0 (du);D+00 (du);88,61;84,88
RENDA FIXA;CAIXA FIC FIF PERFORMANCE IMA B RF LP - RESP LTDA;2012-05-02T00:00:00Z;3,26800400;-0,333;-2,14;2,54;6,14;64,640;66,624;0,80;Sim;1.000,00;IMA-B TOTAL;D+0 (du);D+00 (du);127,19;71,35
RENDA FIXA;CAIXA FIC FIF RELACIONAMENTO IDEAL RF LP - RESP LTDA;2012-04-16T00:00:00Z;3,30112800;0,055;0,19;5,56;12,87;13,096;13,292;1,00;Nao;1.000,00;CDI;D+0 (du);D+00 (du);117,11;93,41
RENDA FIXA;CAIXA FIC FIF RELACIONAMENTO PERSONAL RF LP - RESP LTDA;2012-04-16T00:00:00Z;3,48280400;0,067;0,21;5,75;13,35;119,683;120,022;0,70;Sim;0,01;CDI;D+0 (du);D+00 (du);120,82;96,72
RENDA FIXA;CAIXA FIC FIF SUPREMO RF LONGO PRAZO - RESP LTDA;2006-07-04T00:00:00Z;6,18291200;0,067;0,21;5,71;13,24;121,381;122,637;0,80;Nao;70.000,00;CDI;D+0 (du);D+00 (du);119,89;95,96
RENDA FIXA;CAIXA FIC FIF TITULO PUBLICO MPE RF LP - RESP LTDA;2012-10-05T00:00:00Z;3,22112100;0,051;0,20;5,69;12,94;18,384;18,154;0,50;Sim;1.000,00;CDI;D+0 (du);D+00 (du);120,14;93,33
RENDA FIXA;CAIXA FIF BRASIL 2026 X TP RF - RESP LTDA;2024-04-11T00:00:00Z;1,10879147;0,048;0,12;4,20;7,11;1.002,201;996,137;0,10;Sim;300.000,00;IPCA + 5%;D+0 (du);D+00 (du);82,78;47,28
RENDA FIXA;CAIXA FIF BRASIL 2030 X TP RF RESP LTDA;2023-05-16T00:00:00Z;1,01782046;-0,291;-1,76;-0,13;0,78;76,145;77,350;0,15;Sim;300.000,00;IPCA + 5%;D+0 (du);D+00 (du);43,60;24,25
RENDA FIXA;CAIXA FIF BRASIL 2032 X TP RF RESP LTDA;2023-05-16T00:00:00Z;0,99477339;-0,259;-1,98;-0,64;-0,30;427,657;435,555;0,15;Sim;300.000,00;IPCA + 5%;D+0 (du);D+00 (du);46,17;23,90
RENDA FIXA;CAIXA FIF BRASIL 2033 X TP RF RESP LTDA;2023-05-16T00:00:00Z;0,98450495;-0,321;-2,43;-1,02;-1,37;659,773;683,502;0,15;Sim;300.000,00;IPCA + 5%;D+0 (du);D+00 (du);131,73;20,66
RENDA FIXA;CAIXA FIF BRASIL 2035 X TP RF - RL;2024-04-01T00:00:00Z;0,93543798;-0,370;-2,48;-2,22;-2,02;111,511;115,661;0,10;Sim;300.000,00;nan;D+0 (du);D+00 (du);105,77;18,86
RENDA FIXA;CAIXA FIF BRASIL 2040 X TP RF - RL;2024-03-26T00:00:00Z;0,93644321;-0,418;-3,08;-2,67;-3,05;64,022;66,010;0,10;Sim;300.000,00;NÃO SE APLICA;D+0 (du);D+00 (du);30,97;20,32
RENDA FIXA;CAIXA FIF BRASIL ESPECIAL 2026 TP RF - RESP LTDA;2024-08-14T00:00:00Z;1,11002321;0,048;0,12;4,21;7,14;3.509,571;3.487,985;0,06;Sim;500.000,00;IPCA + 5%;D+0 (du);D+00 (du);83,14;47,49
RENDA FIXA;CAIXA FIF BRASIL ESPECIAL 2027 TP RF - RESP LTDA;2024-08-14T00:00:00Z;1,06456177;-0,012;-0,06;3,70;6,66;748,945;751,952;0,06;Sim;500.000,00;IPCA + 5%;D+0 (du);D+00 (du);151,75;41,34
RENDA FIXA;CAIXA FIF BRASIL ESPECIAL 2028 TP RF - RESP LTDA;2024-08-14T00:00:00Z;1,06415128;-0,193;-0,81;2,04;3,96;1.221,985;1.218,056;0,06;Sim;500.000,00;IPCA + 5%;D+0 (du);D+00 (du);61,47;34,01
