Categoria;Fundo;Data Inicio;Cota (R$);Variacao Dia (%);Acum. Mes (%);Acum. Ano (%);Acum. 12M (%);PL (mi R$);PL Medio 30d (mi R$);Taxa Adm %;Aberto;Aplic. Min (R$);Benchmark;Resgate Conv.;Resgate Pgto;% CDI Ano;% CDI 12m
ACOES;CAIXA ATENA BRASIL ACOES LIVRE QUANT FIC FIF ACOES - RESP LTDA;2019-07-31T00:00:00Z;2,02350100;3,461;4,02;-2,40;17,80;757,915;731,345;2,00;Nao;0,01;NÃO SE APLICA;D+13 (du);D+15 (du);3,44;147,92
ACOES;CAIXA ATENA FIC FIF ACOES FUNCIONARIOS ACOES LIVRE QUANT RESP LTDA;2020-07-06T00:00:00Z;1.947,83618900;3,461;4,04;-1,88;19,01;9,729;9,536;0,80;Sim;0,01;IBOV;D+13 (du);D+15 (du);28,01;166,70
ACOES;CAIXA ATENA FIC FIF ACOES LIVRE QUANT RESP LTDA;2019-07-31T00:00:00Z;1,89067000;3,451;4,01;-2,42;17,75;49,659;47,769;2,00;Sim;0,01;IBOV;D+13 (du);D+15 (du);3,09;141,69
ACOES;CAIXA BRASIL ETF IBOVESPA FIF ACOES - RESP LTDA;2012-11-27T00:00:00Z;3,66334600;2,769;3,46;9,88;32,41;7,636;8,229;0,50;Nao;0,01;IBOV;D+1 (du);D+03 (du);290,89;194,64
ACOES;CAIXA BRASIL IBX-50 FIF ACOES - RESP LTDA;2008-02-18T00:00:00Z;2,05921800;3,052;2,90;8,64;29,47;203,273;195,869;0,70;Sim;0,01;IBX50;D+1 (du);D+03 (du);251,29;177,37
ACOES;CAIXA BRASIL INDEXA IBOVESPA FIF ACOES - RESP LTDA;2011-07-29T00:00:00Z;3,98834800;2,903;3,53;10,16;33,07;292,935;283,723;0,50;Sim;0,01;IBOV;D+1 (du);D+03 (du);295,87;197,69
ACOES;CAIXA EXPERT CLARITAS VALOR FIC FIF AÇÕES - RESP LTDA;2020-10-20T00:00:00Z;1.535,62616200;3,281;3,05;2,66;19,53;22,118;21,331;0,60;Sim;10.000,00;IBOV;D+23 (du);D+25 (du);124,77;125,43
ACOES;CAIXA EXPERT VERDE AM LONG BIAS FIC FIF ACOES - RESP LTDA;2020-10-05T00:00:00Z;1.034,62808600;2,666;3,31;5,54;26,71;8,362;8,030;0,70;Sim;10.000,00;IBOV;D+22 (du);D+24 (du);162,11;166,85
ACOES;CAIXA EXPERT VINCI VALOR DIVIDENDOS RPPS FIC FIF ACOES - RESP LTDA;2012-08-23T00:00:00Z;3,58783253;3,192;3,81;10,28;29,59;1.375,852;1.310,823;;Sim;10.000,00;IBOV;D+30 (du);D+32 (du);219,56;164,40
ACOES;CAIXA EXPERT VINCI VALOR RPPS FIC FIF ACOES - RESP LTDA;2011-12-12T00:00:00Z;2,57400093;3,232;3,39;8,90;30,97;787,898;755,425;;Sim;10.000,00;IBOV;D+21 (du);D+23 (du);250,95;178,02
ACOES;CAIXA FIC FIF ACOES ACOES MULTIGESTOR RESP LTDA;2019-06-25T00:00:00Z;1,30250200;3,047;3,79;1,20;16,25;293,750;281,909;1,50;Sim;0,01;IBOV;D+23 (du);D+25 (du);89,50;95,49
ACOES;CAIXA FIC FIF ACOES COMPROMISSO BDR NIVEL I RESP LTDA;2021-11-05T00:00:00Z;1,23899600;1,718;2,81;2,38;20,61;3,926;3,760;1,00;Sim;0,01;BDRX;D+1 (du);D+03 (du);-49,32;94,36
ACOES;CAIXA FIC FIF ACOES DIVIDENDOS QUANTITATIVO RESP LTDA;2021-09-02T00:00:00Z;1,98416200;3,372;4,59;-2,47;15,48;1,779;1,714;2,00;Sim;0,01;IDIV;D+13 (du);D+15 (du);-40,48;106,39
ACOES;CAIXA FIC FIF ACOES E FUNDO IBOVESPA RESP LTDA;2012-10-05T00:00:00Z;2,64390600;2,891;3,51;9,89;32,42;13,512;13,110;0,80;Sim;0,01;IBOV;D+1 (du);D+03 (du);290,28;193,37
ACOES;CAIXA FIF ACOES BANCO DO BRASIL PLUS RESP LTDA;2019-10-23T00:00:00Z;1.297,85631500;2,883;4,25;-5,06;5,53;42,619;40,552;1,50;Sim;0,01;IBOV;D+1 (du);D+03 (du);-54,67;-179,46
ACOES;CAIXA FIF ACOES BDR NIVEL I - RESP LTDA;2013-06-24T00:00:00Z;10,21419500;0,488;0,02;3,16;13,04;278,817;278,277;1,50;Sim;0,01;BDRX11;D+1 (du);D+03 (du);-67,01;116,71
ACOES;CAIXA FIF ACOES CAIXA SEGURIDADE RESP LTDA;2021-04-30T00:00:00Z;3,33888700;2,118;10,98;37,84;73,27;544,156;480,362;0,20;Sim;0,01;IBOV;D+1 (du);D+03 (du);207,63;168,52
ACOES;CAIXA FIF ACOES CONSTRUCAO CIVIL RESP LTDA;2009-06-22T00:00:00Z;1,88197600;3,805;-1,58;-1,02;23,21;114,062;112,410;2,00;Sim;0,01;IMOB-IMOBILIÁRIO;D+1 (du);D+03 (du);-31,28;152,26
ACOES;CAIXA FIF ACOES CONSUMO RESP LTDA;2012-04-26T00:00:00Z;1,10117800;2,806;0,88;-5,39;7,79;56,370;55,408;1,60;Sim;0,01;ICON11;D+1 (du);D+03 (du);-34,64;25,61
ACOES;CAIXA FIF ACOES ELETROBRAS RESP LTDA;2022-05-30T00:00:00Z;1,83013300;4,629;0,10;6,46;91,07;278,777;272,912;0,45;Sim;0,01;OUTROS;D+1 (du);D+03 (du);329,26;519,89
ACOES;CAIXA FIF ACOES IBOVESPA ATIVO RESP LTDA;2007-02-01T00:00:00Z;2,26950100;3,144;3,53;8,17;30,10;36,327;34,946;2,00;Sim;0,01;IBOV;D+1 (du);D+03 (du);245,64;187,71
ACOES;CAIXA FIF ACOES IBrX ATIVO -RESP LTDA;2005-09-12T00:00:00Z;4,87691200;2,730;2,07;8,67;31,61;23,761;22,977;1,50;Sim;0,01;IBX;D+1 (du);D+03 (du);271,07;196,06
ACOES;CAIXA FIF ACOES INDEXA IAGRO RESP LTDA;2022-06-14T00:00:00Z;0,85740000;2,509;2,45;-10,93;-11,22;2,942;2,861;0,80;Sim;0,01;OUTROS;D+1 (du);D+03 (du);-125,86;-82,72
ACOES;CAIXA FIF ACOES INDEXA PIBB IBRX 50 RESP LTDA;2005-09-12T00:00:00Z;5,95744100;2,926;3,34;10,75;33,68;43,669;42,390;0,80;Sim;0,01;PIBB11;D+1 (du);D+03 (du);327,51;204,94
ACOES;CAIXA FIF ACOES INDEXA SETOR FINANCEIRO RESP LTDA;2021-01-27T00:00:00Z;1.598,80708200;4,019;5,90;9,86;31,78;31,986;29,761;0,80;Sim;0,01;IFNC;D+1 (du);D+03 (du);151,56;101,32
ACOES;CAIXA FIF ACOES INFRAESTRUTURA RESP LTDA;2010-04-19T00:00:00Z;2,94913100;2,916;4,35;8,21;23,90;127,747;123,695;2,00;Sim;0,01;IBOV;D+1 (du);D+03 (du);329,00;179,66
ACOES;CAIXA FIF ACOES PETROBRAS PLUS RESP LTDA;2019-06-28T00:00:00Z;4,32971900;1,481;6,14;37,49;30,69;72,049;72,217;1,50;Nao;0,01;PETR3;D+1 (du);D+03 (du);1.374,44;379,46
ACOES;CAIXA FIF ACOES PETROBRAS PRE-SAL RESP LTDA;2010-09-28T00:00:00Z;6,16890100;1,094;4,69;31,52;30,60;109,512;110,769;0,50;Sim;0,01;PETR4;D+1 (du);D+03 (du);1.240,37;365,83
ACOES;CAIXA FIF ACOES SMALL CAPS ATIVO RESP LTDA;2012-11-01T00:00:00Z;1,48342400;3,563;2,38;-2,69;7,71;448,245;434,077;1,50;Sim;0,01;SMLL;D+1 (du);D+03 (du);-20,21;52,67
ACOES;CAIXA FIF ACOES SUSTENTABILIDADE EMPRESARIAL ISE-IS RESP LTDA;2007-11-05T00:00:00Z;1,78477700;3,394;4,62;4,71;20,89;2,203;2,089;0,80;Sim;0,01;ISE;D+1 (du);D+03 (du);124,46;115,19
ACOES;CAIXA INSTITUCIONAL BDR NIVEL I FIF ACOES - RESP LTDA;2013-06-24T00:00:00Z;11,45936809;0,493;0,04;3,55;13,90;2.344,560;2.329,946;0,70;Sim;0,01;BDRX11;D+1 (du);D+03 (du);-60,80;123,24
ACOES;CAIXA SEGURIDADE II FIF AÇÕES - RESP LTDA;2025-03-24T00:00:00Z;1,64923800;2,125;10,98;37,73;73,04;24,210;21,350;0,20;Nao;0,01;NÃO SE APLICA;D+1 (du);D+03 (du);229,70;166,72
CAMBIAL;CAIXA FIC FIF INDEXA DOLAR CAMBIAL - RESP LTDA;2005-06-27T00:00:00Z;3,82332500;-0,207;-1,81;-4,89;-4,91;96,167;97,187;0,80;Sim;0,01;PTAX;D+1 (du);D+01 (du);-239,61;-57,16
FII;CAIXA RIO BRAVO FUNDO DE FII;2013-11-22T00:00:00Z;;;;;;;;1,20;Nao;0,00;IBOV;D+0 (du);D+00 (du);;
FII;CAIXA RIO BRAVO FUNDO DE FII II;2019-04-18T00:00:00Z;;;;;;;;1,15;Nao;0,00;CDI;D+0 (du);D+00 (du);;
FII;FII CAIXA CARTEIRA IMOBILIÁRIA;2022-03-16T00:00:00Z;;;;;;;;0,70;Nao;;IFIX; (du); (du);;
MULTIMERCADO;CAIXA BRASIL ESTRATEGIA LIVRE FIC FIF MM LONGO PRAZO - RESP LTDA;2019-10-23T00:00:00Z;1.569,24071800;0,455;0,95;5,72;11,97;131,658;129,875;1,50;Sim;0,01;CDI;D+13 (du);D+15 (du);111,58;93,02
MULTIMERCADO;CAIXA CAPITAL PROTEGIDO CICLICO III FIC FIF MM - RESP LTDA;2022-01-10T00:00:00Z;1,56357700;0,419;0,82;4,72;23,72;14,730;14,511;0,90;Nao;5.000,00;NÃO SE APLICA;D+0 (du);D+02 (du);75,95;132,12
MULTIMERCADO;CAIXA CAPITAL PROTEGIDO IBOV CICLICO I FIC FIF MM - RESP LTDA;2011-11-08T00:00:00Z;3,33564400;0,034;0,28;4,69;8,70;158,872;157,000;1,60;Nao;5.000,00;CDI;D+1 (du);D+03 (du);39,66;45,06
MULTIMERCADO;CAIXA CARTEIRA QUANTITATIVA DUO FIC FIF MM LP - RESP LTDA;2026-04-07T00:00:00Z;1,01890100;0,266;0,52;;;2,751;2,476;0,80;Sim;0,01;NÃO SE APLICA;D+8 (du);D+10 (du);;
MULTIMERCADO;CAIXA CARTEIRA QUANTITATIVA QUALI FIC FIF MM LP - RESP LTDA;2026-04-07T00:00:00Z;0,97845000;0,432;0,62;;;1,243;1,175;0,80;Sim;0,01;NÃO SE APLICA;D+14 (du);D+16 (du);;
MULTIMERCADO;CAIXA CARTEIRA QUANTITATIVA UNO FIC FIF MM LP - RESP LTDA;2026-04-07T00:00:00Z;1,03195900;0,160;0,51;;;11,963;12,123;0,80;Sim;0,01;NÃO SE APLICA;D+1 (du);D+03 (du);;
MULTIMERCADO;CAIXA EXPERT BTG PACTUAL X 10 FIC FF MM LP - RESP LTDA;2013-03-21T00:00:00Z;6,87954500;-0,011;0,28;6,97;15,70;128,262;128,452;1,00;Sim;10.000,00;CDI;D+8 (du);D+10 (du);145,98;119,31
MULTIMERCADO;CAIXA EXPERT GIANT ZARATHUSTRA FIC FIF MM - RESP LTDA;2021-02-12T00:00:00Z;1,33816300;-0,104;-0,37;4,26;1,52;12,421;12,832;0,40;Sim;10.000,00;NÃO SE APLICA;D+22 (du);D+25 (du);55,70;15,26
MULTIMERCADO;CAIXA EXPERT HASHDEX NASDAQ CRYPTO INDEX FIC FIF MM - RESP LTDA;2025-10-07T00:00:00Z;0,46390455;0,747;4,16;-35,76;;3,699;3,657;0,70;Sim;100,00;OUTROS;D+3 (du);D+08 (du);-538,29;
MULTIMERCADO;CAIXA EXPERT PIMCO INCOME IE FIC FIF MM LP - RESP LTDA;2023-08-21T00:00:00Z;1,44101800;0,058;-0,03;4,60;13,50;284,569;283,932;0,93;Sim;10.000,00;NÃO SE APLICA;D+3 (du);D+08 (du);73,23;113,18
MULTIMERCADO;CAIXA EXPERT SPX NIMITZ FIC FIF MM - RESP LTDA;2020-05-04T00:00:00Z;1,80891900;-0,108;-0,75;2,40;10,60;174,207;175,862;2,00;Sim;10.000,00;CDI;D+22 (du);D+24 (du);-0,15;71,88
MULTIMERCADO;CAIXA FIC FIF ALOCACAO MACRO MM LP RESP LTDA;2007-02-01T00:00:00Z;5,69928700;0,380;0,87;6,97;13,63;898,645;895,121;0,50;Sim;10.000,00;CDI;D+1 (du);D+03 (du);121,91;100,08
MULTIMERCADO;CAIXA FIC FIF CAPITAL PROTEGIDO CESTA AGRO MM LP - RESP LTDA;2022-07-04T00:00:00Z;1,38876400;0,181;0,08;2,40;7,68;71,167;70,900;0,90;Nao;5.000,00;OUTROS;D+0 (du);D+02 (du);69,45;62,22
MULTIMERCADO;CAIXA FIC FIF ESTRAT. LIVRE MULTIMERCADO LP - RESP LTDA;2019-10-21T00:00:00Z;1.656,13800800;0,452;0,95;5,69;11,95;114,748;113,738;1,50;Sim;0,01;CDI;D+13 (du);D+15 (du);111,24;92,96
MULTIMERCADO;CAIXA FIC FIF ESTRATEGICO MULTIMERCADO LP RESP LTDA;2006-04-10T00:00:00Z;5,40782551;0,398;0,95;5,39;11,84;32,937;32,669;1,20;Sim;0,01;CDI;D+0 (du);D+01 (du);98,90;91,33
MULTIMERCADO;CAIXA FIC FIF FOF SMART LONG SHORT LP RESP LTDA;2023-07-18T00:00:00Z;1,26535300;0,313;0,12;3,60;9,86;5,772;6,114;1,00;Sim;0,01;CDI;D+24 (du);D+26 (du);63,48;84,14
MULTIMERCADO;CAIXA FIC FIF FUNCIONARIOS ESTRATEGIA LIVRE MM LP RESP LTDA;2020-07-06T00:00:00Z;1.679,13708800;0,455;0,97;6,17;12,86;14,501;14,440;0,60;Sim;0,01;CDI;D+13 (du);D+15 (du);121,24;100,29
MULTIMERCADO;CAIXA FIC FIF HEDGE MULTIMERCADO LONGO PRAZO - RESP LTDA;2020-10-26T00:00:00Z;1.684,84779500;-0,895;-0,69;6,94;11,62;29,966;29,791;1,00;Sim;0,01;CDI;D+1 (du);D+01 (du);105,18;74,27
MULTIMERCADO;CAIXA FIC FIF JUROS E MOEDAS MM LP - RESP LTDA;2012-06-28T00:00:00Z;3,68934900;0,052;0,37;6,07;12,12;735,637;740,106;0,70;Sim;10.000,00;CDI;D+0 (du);D+00 (du);109,05;90,73
MULTIMERCADO;CAIXA FIC FIF JUROS E MOEDAS MUL PLUS LP - RESP LTDA;2018-03-05T00:00:00Z;1,92454900;0,051;0,36;5,87;11,73;21,558;21,650;1,00;Sim;0,01;CDI;D+0 (du);D+00 (du);105,62;87,95
MULTIMERCADO;CAIXA FIC FIF LONG BIAS MM - RL;2024-04-01T00:00:00Z;1,14991800;1,997;2,13;-0,82;20,05;3,647;3,553;2,00;Sim;0,01;OUTROS;D+13 (du);D+15 (du);25,34;158,86
MULTIMERCADO;CAIXA FIC FIF MULTIGESTOR GLOBAL EQUITIES IE MM RESP LTDA;2020-11-12T00:00:00Z;1.222,66067000;0,230;-1,03;-2,56;-0,74;37,146;37,091;1,00;Sim;0,01;CDI;D+7 (du);D+12 (du);-207,94;-14,12
MULTIMERCADO;CAIXA FIC FOF SMART LONG BIAS MM RESP LTDA;2023-07-18T00:00:00Z;1,42936600;1,257;0,75;4,71;18,94;12,215;11,762;1,00;Sim;0,01;IPCA;D+24 (du);D+26 (du);175,29;166,27
MULTIMERCADO;CAIXA FIC FOF SMART MACRO MM LP RESP LTDA;2023-07-18T00:00:00Z;1,30244500;0,355;0,31;3,19;9,85;27,984;27,776;1,00;Sim;0,01;CDI;D+24 (du);D+26 (du);52,98;77,77
MULTIMERCADO;CAIXA FIC FOF SMART MULTIESTRATEGIA MM RESP LTDA;2014-06-09T00:00:00Z;2,88276700;0,440;0,33;3,21;10,25;72,481;73,237;1,50;Sim;0,01;CDI;D+24 (du);D+26 (du);62,01;79,94
MULTIMERCADO;CAIXA FIF FIC FIM CAPITAL PROTEGIDO CICLICO II LP - RESP LTDA;2022-07-18T00:00:00Z;1,49741600;0,049;1,61;3,55;10,93;194,156;192,049;0,90;Nao;5.000,00;NÃO SE APLICA;D+0 (du);D+02 (du);22,10;92,96
MULTIMERCADO;CAIXA FIF INDEXA BOLSA AMERICANA MULTIMERCADO LP RESP LTDA;2018-10-16T00:00:00Z;3,85917200;0,453;1,34;14,72;29,45;2.404,186;2.361,065;0,80;Sim;0,01;CDI;D+0 (du);D+01 (du);269,97;251,57
MULTIMERCADO;CAIXA FIF INDEXA EURO MM LP - RL;2024-04-01T00:00:00Z;1,10320500;-0,368;-1,54;-8,50;-7,35;3,731;3,750;0,80;Sim;0,01;NÃO SE APLICA;D+1 (du);D+03 (du);-253,33;-47,74
MULTIMERCADO;CAIXA FIF INDEXA OURO MULTIMERCADO LP - RESP LTDA;2013-02-15T00:00:00Z;4,33511500;-0,537;1,34;-2,43;30,96;514,196;548,722;0,80;Sim;0,01;NÃO SE APLICA;D+1 (du);D+02 (du);242,05;351,21
MULTIMERCADO;CAIXA FIF INDEXA SHORT DOLAR MM LP - RESP LTDA;2020-10-26T00:00:00Z;2.446,79821300;0,302;2,53;19,12;32,35;13,255;13,189;0,80;Sim;0,01;PTAX;D+1 (du);D+01 (du);515,54;268,33
NAN;CAIXA ABSOLUTO PRÉ FIC DE CLASSE DE FIF RENDA FIXA LONGO PRAZO - RESPONSABILIDADE LIMITADA;2003-04-30;20,05866700;0,488;0,72;4,65;10,85;116,821;118,667;1,10;Sim;0,01;CDI;D+0 (du);D+00 (du);81,85;81,38
NAN;CAIXA CAPITAL ÍNDICE DE PREÇOS FIC DE CLASSE DE FIF RENDA FIXA LONGO PRAZO - RESP LIMITADA;2003-04-30;13,55174600;0,062;0,65;5,38;10,22;27,663;27,602;1,50;Sim;0,01;IPCA+6%;D+3 (du);D+03 (du);115,97;66,40
NAN;CAIXA CLÁSSICO FIC DE CLASSE DE FIF RENDA FIXA LONGO PRAZO - RESPONSABILIDADE LIMITADA;2003-04-30;15,10910500;0,046;0,34;6,63;12,51;27,741;27,729;1,40;Nao;100,00;CDI;D+0 (du);D+00 (du);113,78;90,64
NAN;CAIXA DIVIDENDOS FUNDO DE INVESTIMENTO FINANCEIRO EM AÇÕES - RESPONSABILIDADE LIMITADA;2003-10-03;6,99325700;2,984;4,28;10,26;29,03;340,415;330,010;1,50;Sim;0,01;IDIV11;D+1 (du);D+03 (du);204,96;164,12
NAN;CAIXA EMPREENDER FIC DE CLASSE DE FIF RENDA FIXA LONGO PRAZO - RESPONSABILIDADE LIMITADA;2003-04-30;46,63494900;0,046;0,34;6,58;12,42;40,825;40,624;1,50;Nao;50,00;CDI;D+0 (du);D+00 (du);113,02;90,01
NAN;CAIXA ESPECIAL FIC DE CLASSE DE FIF RENDA FIXA LONGO PRAZO - RESPONSABILIDADE LIMITADA;2003-08-25;10,71998900;0,050;0,37;7,24;13,69;2.408,341;2.388,526;0,40;Sim;100.000,00;CDI;D+0 (du);D+00 (du);123,66;99,08
NAN;CAIXA EXECUTIVO FIC DE CLASSE DE FIF RENDA FIXA LONGO PRAZO - RESPONSABILIDADE LIMITADA;2003-04-30;33,13910500;0,047;0,35;6,82;12,87;2.213,434;2.196,077;1,10;Sim;1.000,00;CDI;D+0 (du);D+00 (du);116,93;93,24
NAN;CAIXA IBOVESPA FUNDO DE INVESTIMENTO EM COTAS DE CLASSE DE FIF EM AÇÕES - RESPONSABILIDADE LIMITADA;1997-01-15;8,84847900;2,886;3,47;9,29;31,11;87,998;85,524;2,00;Sim;0,01;IBOV;D+1 (du);D+03 (du);280,13;184,07
NAN;CAIXA IDEAL FIC DE CLASSE DE FIF RENDA FIXA LONGO PRAZO - RESPONSABILIDADE LIMITADA;2003-04-30;9,80588400;0,046;0,34;6,60;12,46;584,137;583,201;1,50;Sim;0,01;CDI;D+0 (du);D+00 (du);113,31;90,22
NAN;CAIXA INVESTIDOR FIC DE CLASSE DE FIF RENDA FIXA LONGO PRAZO - RESPONSABILIDADE LIMITADA;2003-04-30;19,24838500;0,048;0,36;7,00;13,22;958,233;953,562;0,85;Sim;5.000,00;CDI;D+0 (du);D+00 (du);119,59;95,67
NAN;CAIXA PATRIMÔNIO ÍNDICE DE PREÇOS FIC DE CLASSE DE FIF RENDA FIXA LONGO PRAZO - RESP LIMITADA;2003-04-30;23,93841400;0,053;0,67;6,92;12,08;94,628;93,987;0,30;Sim;100.000,00;IPCA+6%;D+3 (du);D+03 (du);141,76;79,23
NAN;CAIXA PERSONAL FIC DE CLASSE DE FIF RENDA FIXA LONGO PRAZO - RESPONSABILIDADE LIMITADA;2003-04-30;30,96820500;0,049;0,36;7,14;13,49;3.121,880;3.110,691;0,60;Sim;50.000,00;CDI;D+0 (du);D+00 (du);121,95;97,63
NAN;CAIXA PETROBRAS FUNDO DE INVESTIMENTO FINANCEIRO EM AÇÕES - RESPONSABILIDADE LIMITADA;2000-07-10;40,15996600;1,484;6,14;37,56;30,80;783,487;787,434;1,50;Sim;0,01;PETR3;D+1 (du);D+03 (du);1.375,48;380,23
NAN;CAIXA PRÁTICO FIC DE CLASSE DE FIF RENDA FIXA CURTO PRAZO - RESPONSABILIDADE LIMITADA;2003-04-30;9,51597500;0,045;0,32;6,31;11,79;2.872,546;2.887,231;1,70;Nao;0,01;CDI;D+0 (du);D+00 (du);109,19;84,26
NAN;CAIXA RV 30 FUNDO DE INVESTIMENTO FINANCEIRO MULTIMERCADO LONGO PRAZO - RESPONSABILIDADE LIMITADA;2003-04-30;12,80548500;0,943;1,45;7,88;18,46;328,949;323,704;1,00;Sim;0,01;70% CDI + 30% IBOV;D+1 (du);D+03 (du);165,32;122,80
NAN;CAIXA SEBRAE FUNDO DE INVESTIMENTO FINANCEIRO RENDA FIXA LONGO PRAZO - RESPONSABILIDADE LIMITADA;2003-04-30;18,15617800;0,051;0,37;7,24;13,76;4.776,179;4.786,808;;Sim;0,01;CDI;D+0 (du);D+01 (du);125,39;100,01
NAN;CAIXA SELEÇÃO FIC DE CLASSE DE FIF RENDA FIXA - RESPONSABILIDADE LIMITADA;2003-10-01;29,55846000;0,047;0,33;6,59;27,93;21,183;21,098;1,10;Nao;30.000,00;CDI;D+0 (du);D+00 (du);113,86;195,72
NAN;CAIXA SOBERANO FIC DE CLASSE DE FIF RENDA FIXA LONGO PRAZO - RESPONSABILIDADE LIMITADA;2003-04-30;20,41941400;0,046;0,33;6,46;12,15;59,388;63,318;1,50;Nao;50,00;CDI;D+0 (du);D+00 (du);111,47;87,96
NAN;CAIXA VALE DO RIO DOCE FUNDO DE INVESTIMENTO FINANCEIRO EM AÇÕES - RESPONSABILIDADE LIMITADA;2002-02-20;35,04778600;1,395;-4,89;1,45;46,92;586,448;626,762;2,00;Sim;0,01;VALE3;D+1 (du);D+03 (du);360,65;403,15
PRIVATIZACAO;CAIXA FMP FGTS ELETROBRAS - RESP LTDA;2022-06-14T00:00:00Z;1,82368000;4,640;0,11;6,53;91,43;1.651,126;1.619,487;0,20;Nao;200,00;OUTROS;D+1 (du);D+05 (du);324,82;529,35
PRIVATIZACAO;CAIXA FMP FGTS ELETROBRAS MIGRAÇÃO - RESP LTDA;2022-06-10T00:00:00Z;1,86901500;4,599;0,10;6,45;91,32;5,215;5,047;0,20;Sim;200,00;OUTROS;D+1 (du);D+05 (du);323,39;528,52
PRIVATIZACAO;CAIXA FUNDO MÚTUO DE PRIVATIZAÇÃO - FGTS - PETROBRAS II - RESPONSABILIDADE LIMITADA;2000-08-17;39,47965100;1,484;6,14;37,70;30,95;552,351;552,941;1,40;Sim;0,01;PETR3;D+1 (du);D+05 (du);1.445,00;399,74
PRIVATIZACAO;CAIXA FUNDO MÚTUO DE PRIVATIZAÇÃO - FGTS - PETROBRAS III - RESPONSABILIDADE LIMITADA;2000-08-17;41,98317000;1,484;6,15;37,87;31,21;634,034;634,400;1,20;Nao;10.000,00;PETR3;D+1 (du);D+05 (du);1.448,41;402,10
PRIVATIZACAO;CAIXA FUNDO MÚTUO DE PRIVATIZAÇÃO - FGTS - PETROBRAS IV - RESPONSABILIDADE LIMITADA;2000-08-17;44,69948700;1,484;6,15;38,01;31,49;642,680;641,447;0,95;Nao;300,00;PETR3;D+1 (du);D+05 (du);1.451,48;404,68
PRIVATIZACAO;CAIXA FUNDO MÚTUO DE PRIVATIZAÇÃO - FGTS - VALE DO RIO DOCE I - RESPONSABILIDADE LIMITADA;2002-03-27;33,42929400;1,399;-4,90;1,45;46,94;417,527;445,091;1,90;Nao;0,01;VALE3;D+1 (du);D+05 (du);373,51;423,55
PRIVATIZACAO;CAIXA FUNDO MÚTUO DE PRIVATIZAÇÃO - FGTS - VALE DO RIO DOCE II - RESPONSABILIDADE LIMITADA;2002-03-27;38,84405900;1,398;-4,89;1,70;47,64;694,453;740,540;1,40;Nao;10.000,00;VALE3;D+1 (du);D+05 (du);378,64;429,52
PRIVATIZACAO;CAIXA FUNDO MÚTUO DE PRIVATIZAÇÃO - FGTS - VALE DO RIO DOCE MIGRAÇÃO- RESPONSABILIDADE LIMITADA;2002-02-26;32,55619700;1,390;-4,88;1,46;46,74;11,164;11,748;1,90;Sim;0,01;VALE3;D+1 (du);D+05 (du);373,38;421,57
PRIVATIZACAO;CAIXA FUNDO MÚTUO DE PRIVATIZAÇÃO - FGTS CARTEIRA LIVRE - FGTS CL ABSOLUTO - RESP LIMITADA;2001-08-24;16,68596900;3,404;3,73;-1,07;20,98;113,958;110,146;1,90;Sim;0,01;PETR3;D+1 (du);D+05 (du);42,83;177,20
RENDA FIXA;CAIXA BRASIL 2027 TP FIF RF - RESP LTDA;2022-06-06T00:00:00Z;1,14963846;-0,039;0,40;4,70;6,65;519,754;516,754;0,20;Sim;300.000,00;IPCA + 5%;D+0 (du);D+00 (du);150,30;40,19
RENDA FIXA;CAIXA BRASIL 2027 TP X FIF RF LP - RESP LTDA;2023-05-16T00:00:00Z;1,11253353;-0,039;0,40;4,74;6,72;586,359;578,190;0,15;Sim;300.000,00;IPCA + 5%;D+0 (du);D+00 (du);150,89;40,67
RENDA FIXA;CAIXA BRASIL 2028 X TP FIF RF - RESP LTDA;2023-05-16T00:00:00Z;1,08169340;0,034;0,75;3,36;5,32;565,546;561,113;0,15;Sim;300.000,00;IPCA + 5%;D+0 (du);D+00 (du);60,52;33,38
RENDA FIXA;CAIXA BRASIL 2030 II TP FIF RF - RESP LTDA;2014-03-26T00:00:00Z;1,95678809;0,233;1,14;2,24;3,91;1.079,623;1.065,757;0,20;Sim;300.000,00;CDI;D+0 (du);D+00 (du);43,54;24,06
RENDA FIXA;CAIXA BRASIL 2030 III TP  FIF RF - RESP LTDA;2015-03-16T00:00:00Z;1,76939507;0,233;1,14;2,25;3,95;241,097;238,000;0,20;Sim;300.000,00;CDI;D+1 (du);D+02 (du);43,60;24,28
RENDA FIXA;CAIXA BRASIL ATIVA FIC FIF RENDA FIXA LONGO PRAZO - RESP LTDA;2020-04-15T00:00:00Z;1.659,55755800;0,073;0,39;5,75;11,90;462,772;460,709;0,40;Sim;0,01;CDI;D+0 (du);D+01 (du);100,70;77,03
RENDA FIXA;CAIXA BRASIL GESTAO ESTRATEGICA FIC FIF RF - RESP LTDA;2016-11-04T00:00:00Z;2,42608800;0,205;0,53;5,34;11,68;3.416,388;3.521,071;0,40;Sim;0,01;IPCA;D+0 (du);D+00 (du);98,16;85,99
RENDA FIXA;CAIXA BRASIL IDKA IPCA 2A TP FIF RF LONGO PRAZO - RESP LTDA;2012-08-16T00:00:00Z;3,84023900;0,045;0,76;6,68;11,98;3.026,810;2.999,163;0,20;Sim;0,01;IDKA2;D+0 (du);D+00 (du);142,65;81,23
RENDA FIXA;CAIXA BRASIL IMA B 5 TP FIF RF LONGO PRAZO - RESP LTDA;2010-07-09T00:00:00Z;5,22254300;0,059;0,68;6,98;12,22;5.597,711;5.559,607;0,20;Sim;0,01;IMA-B 5;D+0 (du);D+00 (du);143,14;80,44
RENDA FIXA;CAIXA BRASIL IMA GERAL TP FIF RF LONGO PRAZO - RESP LTDA;2010-07-08T00:00:00Z;4,79749500;0,176;0,68;6,29;12,43;477,949;494,544;0,20;Sim;0,01;IMA-GERAL TOTAL;D+0 (du);D+00 (du);119,01;90,97
RENDA FIXA;CAIXA BRASIL IMA-B 5+ TP FIF RF LONGO PRAZO - RESP LTDA;2012-04-18T00:00:00Z;3,45299200;0,349;1,96;3,50;8,30;755,904;758,051;0,20;Sim;0,01;IMA-B 5+;D+0 (du);D+00 (du);115,19;68,43
RENDA FIXA;CAIXA BRASIL IMA-B TP FIF RF LONGO PRAZO - RESP LTDA;2010-03-08T00:00:00Z;5,16530100;0,215;1,39;5,05;10,06;2.545,524;2.548,601;0,20;Sim;0,01;IMA-B TOTAL;D+0 (du);D+00 (du);127,69;73,65
RENDA FIXA;CAIXA BRASIL IRF M 1 MAIS TP FIF RF LONGO PRAZO - RESP LTDA;2012-05-11T00:00:00Z;3,80892000;0,610;0,86;4,74;11,59;694,925;711,204;0,20;Sim;0,01;IRF-M 1+;D+0 (du);D+00 (du);83,69;85,59
RENDA FIXA;CAIXA BRASIL IRF-M 1 TP FIF RF - RESP LTDA;2010-05-28T00:00:00Z;4,54199100;0,114;0,44;7,04;13,47;11.158,338;10.966,432;0,20;Sim;0,01;IRF-M 1;D+0 (du);D+00 (du);118,05;96,20
RENDA FIXA;CAIXA BRASIL IRF-M TP FIF RF LONGO PRAZO - RESP LTDA;2012-08-16T00:00:00Z;3,67779400;0,483;0,75;5,35;12,00;1.670,644;1.705,354;0,20;Sim;0,01;IRF-M TOTAL;D+0 (du);D+00 (du);92,58;88,66
RENDA FIXA;CAIXA BRASIL MATRIZ FIF RF - RESP LTDA;2015-12-17T00:00:00Z;2,64251500;0,050;0,37;7,30;13,80;9.065,794;9.120,568;0,20;Sim;0,01;CDI;D+0 (du);D+00 (du);125,22;99,91
RENDA FIXA;CAIXA BRASIL TP FIF RF LONGO PRAZO - RESP LTDA;2006-02-10T00:00:00Z;7,26812900;0,050;0,37;7,20;13,63;12.797,228;12.569,286;0,20;Sim;0,01;CDI;D+0 (du);D+00 (du);124,81;99,16
RENDA FIXA;CAIXA FI MERCURIO RF LP;2019-05-29T00:00:00Z;1,93838500;0,051;0,37;7,36;13,88;6.922,923;7.006,453;0,07;Sim;0,01;CDI;D+0 (du);D+00 (du);125,74;100,43
RENDA FIXA;CAIXA FI SENAR RENDA FIXA LONGO PRAZO;2022-06-01T00:00:00Z;1,66414600;0,051;0,37;7,29;13,81;1.059,848;1.051,538;0,10;Sim;0,00;NÃO SE APLICA;D+0 (du);D+00 (du);125,99;100,17
RENDA FIXA;CAIXA FIC FIF ATIVA RENDA FIXA LP - RESP LTDA;2020-04-22T00:00:00Z;1.788,17947400;0,051;0,38;6,16;12,37;123,399;122,792;0,40;Sim;50.000,00;CDI;D+0 (du);D+01 (du);110,04;92,29
RENDA FIXA;CAIXA FIC FIF BRASIL IDKA PRE 2A RF LP - RESP LTDA;2022-09-21T00:00:00Z;1,46694700;0,416;0,82;5,21;11,82;169,689;169,221;0,20;Sim;0,01;IDKA PRÉ 2A;D+0 (du);D+00 (du);81,98;84,27
RENDA FIXA;CAIXA FIC FIF DESENVOLVER RF LP - RESP LTDA;2012-12-18T00:00:00Z;3,03003400;0,045;0,33;6,43;12,16;1,638;1,633;1,30;Nao;500,00;CDI;D+0 (du);D+00 (du);110,52;88,47
RENDA FIXA;CAIXA FIC FIF E-FUNDO RF LP - RESP LTDA;2012-10-05T00:00:00Z;3,39348800;0,049;0,36;7,03;13,28;63,426;62,904;0,70;Sim;0,01;CDI;D+0 (du);D+00 (du);120,51;96,19
RENDA FIXA;CAIXA FIC FIF EQUILIBRIO MPE RF LP - RESP LTDA;2006-07-05T00:00:00Z;5,96281400;0,047;0,35;6,90;13,02;41,359;41,070;1,00;Sim;1.000,00;CDI;D+0 (du);D+00 (du);117,81;94,23
RENDA FIXA;CAIXA FIC FIF FOCO IND. DE PRECOS RF LP - RESP LTDA;2012-03-19T00:00:00Z;3,16436200;0,051;0,65;6,54;11,35;77,516;77,962;1,00;Sim;100,00;NÃO SE APLICA;D+3 (du);D+03 (du);135,28;74,03
RENDA FIXA;CAIXA FIC FIF INSTITUCIONAL SOBERANO PLUS RF - RESP LTDA;2022-10-21T00:00:00Z;1,57021234;0,051;0,37;7,26;13,74;608,941;434,896;0,10;Sim;5.000.000,00;CDI;D+0 (du);D+00 (du);125,57;99,76
RENDA FIXA;CAIXA FIC FIF MUTUA RF LONGO PRAZO - RESP LTDA;2008-11-20T00:00:00Z;5,22956500;0,052;0,37;7,34;13,81;370,953;367,945;0,03;Sim;0,01;CDI;D+0 (du);D+00 (du);126,75;99,85
RENDA FIXA;CAIXA FIC FIF OBJETIVO PRE RF LP - RESP LTDA;2012-06-27T00:00:00Z;3,34986900;0,481;0,74;5,11;11,49;132,474;134,084;0,70;Sim;1.000,00;CDI;D+0 (du);D+00 (du);88,61;84,88
RENDA FIXA;CAIXA FIC FIF PERFORMANCE IMA B RF LP - RESP LTDA;2012-05-02T00:00:00Z;3,34601800;0,210;1,37;4,99;9,58;64,938;64,940;0,80;Sim;1.000,00;IMA-B TOTAL;D+0 (du);D+00 (du);127,19;71,35
RENDA FIXA;CAIXA FIC FIF RELACIONAMENTO IDEAL RF LP - RESP LTDA;2012-04-16T00:00:00Z;3,34085800;0,047;0,35;6,83;12,89;13,010;13,021;1,00;Nao;1.000,00;CDI;D+0 (du);D+00 (du);117,11;93,41
RENDA FIXA;CAIXA FIC FIF RELACIONAMENTO PERSONAL RF LP - RESP LTDA;2012-04-16T00:00:00Z;3,52631500;0,049;0,36;7,08;13,36;121,106;120,073;0,70;Sim;0,01;CDI;D+0 (du);D+00 (du);120,82;96,72
RENDA FIXA;CAIXA FIC FIF SUPREMO RF LONGO PRAZO - RESP LTDA;2006-07-04T00:00:00Z;6,25956000;0,048;0,36;7,02;13,26;121,976;121,634;0,80;Nao;70.000,00;CDI;D+0 (du);D+00 (du);119,89;95,96
RENDA FIXA;CAIXA FIC FIF TITULO PUBLICO MPE RF LP - RESP LTDA;2012-10-05T00:00:00Z;3,26038800;0,050;0,35;6,98;12,98;25,380;22,720;0,50;Sim;1.000,00;CDI;D+0 (du);D+00 (du);120,14;93,33
RENDA FIXA;CAIXA FIF BRASIL 2026 X TP RF - RESP LTDA;2024-04-11T00:00:00Z;1,12271114;-0,074;0,25;5,51;7,47;1.014,782;1.008,326;0,10;Sim;300.000,00;IPCA + 5%;D+0 (du);D+00 (du);82,78;47,28
RENDA FIXA;CAIXA FIF BRASIL 2030 X TP RF RESP LTDA;2023-05-16T00:00:00Z;1,04202701;0,233;1,14;2,25;3,94;77,956;76,955;0,15;Sim;300.000,00;IPCA + 5%;D+0 (du);D+00 (du);43,60;24,25
RENDA FIXA;CAIXA FIF BRASIL 2032 X TP RF RESP LTDA;2023-05-16T00:00:00Z;1,01935798;0,361;1,31;1,82;3,51;438,226;431,928;0,15;Sim;300.000,00;IPCA + 5%;D+0 (du);D+00 (du);46,17;23,90
RENDA FIXA;CAIXA FIF BRASIL 2033 X TP RF RESP LTDA;2023-05-16T00:00:00Z;1,01247788;0,269;1,41;1,79;2,72;679,455;669,185;0,15;Sim;300.000,00;IPCA + 5%;D+0 (du);D+00 (du);131,73;20,66
RENDA FIXA;CAIXA FIF BRASIL 2035 X TP RF - RL;2024-04-01T00:00:00Z;0,95608687;0,174;1,48;-0,06;1,57;114,276;113,063;0,10;Sim;300.000,00;nan;D+0 (du);D+00 (du);105,77;18,86
RENDA FIXA;CAIXA FIF BRASIL 2040 X TP RF - RL;2024-03-26T00:00:00Z;0,96226095;0,464;2,14;0,02;1,36;65,787;65,130;0,10;Sim;300.000,00;NÃO SE APLICA;D+0 (du);D+00 (du);30,97;20,32
RENDA FIXA;CAIXA FIF BRASIL ESPECIAL 2026 TP RF - RESP LTDA;2024-08-14T00:00:00Z;1,12399422;-0,074;0,25;5,53;7,50;3.555,160;3.532,159;0,06;Sim;500.000,00;IPCA + 5%;D+0 (du);D+00 (du);83,14;47,49
RENDA FIXA;CAIXA FIF BRASIL ESPECIAL 2027 TP RF - RESP LTDA;2024-08-14T00:00:00Z;1,07575116;-0,039;0,40;4,79;6,81;759,197;753,367;0,06;Sim;500.000,00;IPCA + 5%;D+0 (du);D+00 (du);151,75;41,34
RENDA FIXA;CAIXA FIF BRASIL ESPECIAL 2028 TP RF - RESP LTDA;2024-08-14T00:00:00Z;1,07844409;0,035;0,75;3,42;5,41;1.321,990;1.271,839;0,06;Sim;500.000,00;IPCA + 5%;D+0 (du);D+00 (du);61,47;34,01
RENDA FIXA;CAIXA FIF BRASIL ESPECIAL 2030 TP RF - RESP LTDA;2024-08-16T00:00:00Z;1,03924812;0,233;1,14;2,31;4,06;443,460;415,854;0,06;Sim;500.000,00;IPCA + 5%;D+0 (du);D+00 (du);44,88;25,13
