Categoria;Fundo;Data Inicio;Cota (R$);Variacao Dia (%);Acum. Mes (%);Acum. Ano (%);Acum. 12M (%);PL (mi R$);PL Medio 30d (mi R$);Taxa Adm %;Aberto;Aplic. Min (R$);Benchmark;Resgate Conv.;Resgate Pgto;% CDI Ano;% CDI 12m
ACOES;CAIXA ATENA BRASIL ACOES LIVRE QUANT FIC FIF ACOES - RESP LTDA;2019-07-31T00:00:00Z;1,93234100;-1,812;-0,67;-6,80;12,49;723,770;731,440;2,00;Nao;0,01;NÃO SE APLICA;D+13 (du);D+15 (du);3,44;147,92
ACOES;CAIXA ATENA FIC FIF ACOES FUNCIONARIOS ACOES LIVRE QUANT RESP LTDA;2020-07-06T00:00:00Z;1.859,86439300;-1,806;-0,66;-6,31;13,63;9,329;9,559;0,80;Sim;0,01;IBOV;D+13 (du);D+15 (du);28,01;166,70
ACOES;CAIXA ATENA FIC FIF ACOES LIVRE QUANT RESP LTDA;2019-07-31T00:00:00Z;1,80572200;-1,807;-0,67;-6,81;12,46;47,518;47,746;2,00;Sim;0,01;IBOV;D+13 (du);D+15 (du);3,09;141,69
ACOES;CAIXA BRASIL ETF IBOVESPA FIF ACOES - RESP LTDA;2012-11-27T00:00:00Z;3,55447700;-1,032;0,38;6,61;28,48;7,409;8,353;0,50;Nao;0,01;IBOV;D+1 (du);D+03 (du);290,89;194,64
ACOES;CAIXA BRASIL IBX-50 FIF ACOES - RESP LTDA;2008-02-18T00:00:00Z;2,01005900;-0,929;0,44;6,05;26,38;198,420;195,505;0,70;Sim;0,01;IBX50;D+1 (du);D+03 (du);251,29;177,37
ACOES;CAIXA BRASIL INDEXA IBOVESPA FIF ACOES - RESP LTDA;2011-07-29T00:00:00Z;3,86959800;-0,896;0,45;6,88;29,10;284,312;283,414;0,50;Sim;0,01;IBOV;D+1 (du);D+03 (du);295,87;197,69
ACOES;CAIXA EXPERT CLARITAS VALOR FIC FIF AÇÕES - RESP LTDA;2020-10-20T00:00:00Z;1.492,90150700;-1,225;0,18;-0,19;16,20;21,513;21,305;0,60;Sim;10.000,00;IBOV;D+23 (du);D+25 (du);124,77;125,43
ACOES;CAIXA EXPERT VERDE AM LONG BIAS FIC FIF ACOES - RESP LTDA;2020-10-05T00:00:00Z;1.006,32359800;-0,657;0,48;2,65;23,25;8,133;8,009;0,70;Sim;10.000,00;IBOV;D+22 (du);D+24 (du);162,11;166,85
ACOES;CAIXA EXPERT VINCI VALOR DIVIDENDOS RPPS FIC FIF ACOES - RESP LTDA;2012-08-23T00:00:00Z;3,46293829;-0,823;0,19;6,44;25,08;1.327,958;1.306,359;;Sim;10.000,00;IBOV;D+30 (du);D+32 (du);219,56;164,40
ACOES;CAIXA EXPERT VINCI VALOR RPPS FIC FIF ACOES - RESP LTDA;2011-12-12T00:00:00Z;2,49565862;-0,999;0,24;5,59;26,98;763,918;753,619;;Sim;10.000,00;IBOV;D+21 (du);D+23 (du);250,95;178,02
ACOES;CAIXA FIC FIF ACOES ACOES MULTIGESTOR RESP LTDA;2019-06-25T00:00:00Z;1,25987600;-1,062;0,39;-2,11;12,45;284,511;281,367;1,50;Sim;0,01;IBOV;D+23 (du);D+25 (du);89,50;95,49
ACOES;CAIXA FIC FIF ACOES COMPROMISSO BDR NIVEL I RESP LTDA;2021-11-05T00:00:00Z;1,21188800;-0,673;0,56;0,14;17,97;3,841;3,743;1,00;Sim;0,01;BDRX;D+1 (du);D+03 (du);-49,32;94,36
ACOES;CAIXA FIC FIF ACOES DIVIDENDOS QUANTITATIVO RESP LTDA;2021-09-02T00:00:00Z;1,90187200;-1,043;0,25;-6,52;10,69;1,715;1,712;2,00;Sim;0,01;IDIV;D+13 (du);D+15 (du);-40,48;106,39
ACOES;CAIXA FIC FIF ACOES E FUNDO IBOVESPA RESP LTDA;2012-10-05T00:00:00Z;2,56559500;-0,895;0,44;6,63;28,50;13,166;13,095;0,80;Sim;0,01;IBOV;D+1 (du);D+03 (du);290,28;193,37
ACOES;CAIXA FIF ACOES BANCO DO BRASIL PLUS RESP LTDA;2019-10-23T00:00:00Z;1.247,26883100;-1,052;0,18;-8,76;1,41;40,999;40,426;1,50;Sim;0,01;IBOV;D+1 (du);D+03 (du);-54,67;-179,46
ACOES;CAIXA FIF ACOES BDR NIVEL I - RESP LTDA;2013-06-24T00:00:00Z;10,18084200;0,107;-0,30;2,82;12,68;278,922;278,373;1,50;Sim;0,01;BDRX11;D+1 (du);D+03 (du);-67,01;116,71
ACOES;CAIXA FIF ACOES CAIXA SEGURIDADE RESP LTDA;2021-04-30T00:00:00Z;3,11721500;0,242;3,61;28,68;61,76;507,167;472,663;0,20;Sim;0,01;IBOV;D+1 (du);D+03 (du);207,63;168,52
ACOES;CAIXA FIF ACOES CONSTRUCAO CIVIL RESP LTDA;2009-06-22T00:00:00Z;1,89389000;-2,403;-0,96;-0,40;23,99;114,813;112,708;2,00;Sim;0,01;IMOB-IMOBILIÁRIO;D+1 (du);D+03 (du);-31,28;152,26
ACOES;CAIXA FIF ACOES CONSUMO RESP LTDA;2012-04-26T00:00:00Z;1,07873400;-1,912;-1,17;-7,32;5,59;55,260;55,497;1,60;Sim;0,01;ICON11;D+1 (du);D+03 (du);-34,64;25,61
ACOES;CAIXA FIF ACOES ELETROBRAS RESP LTDA;2022-05-30T00:00:00Z;1,81365100;-0,797;-0,80;5,51;89,35;276,576;272,774;0,45;Sim;0,01;OUTROS;D+1 (du);D+03 (du);329,26;519,89
ACOES;CAIXA FIF ACOES IBOVESPA ATIVO RESP LTDA;2007-02-01T00:00:00Z;2,19741400;-1,022;0,25;4,73;25,97;35,230;34,885;2,00;Sim;0,01;IBOV;D+1 (du);D+03 (du);245,64;187,71
ACOES;CAIXA FIF ACOES IBrX ATIVO -RESP LTDA;2005-09-12T00:00:00Z;4,81132600;-0,859;0,69;7,21;29,84;23,438;22,939;1,50;Sim;0,01;IBX;D+1 (du);D+03 (du);271,07;196,06
ACOES;CAIXA FIF ACOES INDEXA IAGRO RESP LTDA;2022-06-14T00:00:00Z;0,82912500;-1,062;-0,93;-13,87;-14,15;2,844;2,860;0,80;Sim;0,01;OUTROS;D+1 (du);D+03 (du);-125,86;-82,72
ACOES;CAIXA FIF ACOES INDEXA PIBB IBRX 50 RESP LTDA;2005-09-12T00:00:00Z;5,78577800;-0,998;0,36;7,56;29,83;42,432;42,355;0,80;Sim;0,01;PIBB11;D+1 (du);D+03 (du);327,51;204,94
ACOES;CAIXA FIF ACOES INDEXA SETOR FINANCEIRO RESP LTDA;2021-01-27T00:00:00Z;1.525,10330000;-0,554;1,02;4,80;25,70;30,513;29,596;0,80;Sim;0,01;IFNC;D+1 (du);D+03 (du);151,56;101,32
ACOES;CAIXA FIF ACOES INFRAESTRUTURA RESP LTDA;2010-04-19T00:00:00Z;2,83844200;-1,300;0,43;4,14;19,25;122,938;123,567;2,00;Sim;0,01;IBOV;D+1 (du);D+03 (du);329,00;179,66
ACOES;CAIXA FIF ACOES PETROBRAS PLUS RESP LTDA;2019-06-28T00:00:00Z;4,10559300;-1,256;0,64;30,37;23,93;68,347;72,366;1,50;Nao;0,01;PETR3;D+1 (du);D+03 (du);1.374,44;379,46
ACOES;CAIXA FIF ACOES PETROBRAS PRE-SAL RESP LTDA;2010-09-28T00:00:00Z;5,88288400;-1,229;-0,16;25,43;24,55;104,097;111,160;0,50;Sim;0,01;PETR4;D+1 (du);D+03 (du);1.240,37;365,83
ACOES;CAIXA FIF ACOES SMALL CAPS ATIVO RESP LTDA;2012-11-01T00:00:00Z;1,44354200;-1,455;-0,37;-5,31;4,81;436,362;434,116;1,50;Sim;0,01;SMLL;D+1 (du);D+03 (du);-20,21;52,67
ACOES;CAIXA FIF ACOES SUSTENTABILIDADE EMPRESARIAL ISE-IS RESP LTDA;2007-11-05T00:00:00Z;1,71068600;-0,913;0,28;0,36;15,88;2,111;2,082;0,80;Sim;0,01;ISE;D+1 (du);D+03 (du);124,46;115,19
ACOES;CAIXA INSTITUCIONAL BDR NIVEL I FIF ACOES - RESP LTDA;2013-06-24T00:00:00Z;11,42042515;0,110;-0,30;3,20;13,51;2.337,528;2.329,486;0,70;Sim;0,01;BDRX11;D+1 (du);D+03 (du);-60,80;123,24
ACOES;CAIXA SEGURIDADE II FIF AÇÕES - RESP LTDA;2025-03-24T00:00:00Z;1,53970300;0,242;3,61;28,58;61,55;22,642;21,001;0,20;Nao;0,01;NÃO SE APLICA;D+1 (du);D+03 (du);229,70;166,72
CAMBIAL;CAIXA FIC FIF INDEXA DOLAR CAMBIAL - RESP LTDA;2005-06-27T00:00:00Z;3,83780100;-0,734;-1,44;-4,53;-4,55;97,346;97,282;0,80;Sim;0,01;PTAX;D+1 (du);D+01 (du);-239,61;-57,16
FII;CAIXA RIO BRAVO FUNDO DE FII;2013-11-22T00:00:00Z;;;;;;;;1,20;Nao;0,00;IBOV;D+0 (du);D+00 (du);;
FII;CAIXA RIO BRAVO FUNDO DE FII II;2019-04-18T00:00:00Z;;;;;;;;1,15;Nao;0,00;CDI;D+0 (du);D+00 (du);;
FII;FII CAIXA CARTEIRA IMOBILIÁRIA;2022-03-16T00:00:00Z;;;;;;;;0,70;Nao;;IFIX; (du); (du);;
MULTIMERCADO;CAIXA BRASIL ESTRATEGIA LIVRE FIC FIF MM LONGO PRAZO - RESP LTDA;2019-10-23T00:00:00Z;1.559,09574200;0,018;0,30;5,04;11,25;130,806;129,696;1,50;Sim;0,01;CDI;D+13 (du);D+15 (du);111,58;93,02
MULTIMERCADO;CAIXA CAPITAL PROTEGIDO CICLICO III FIC FIF MM - RESP LTDA;2022-01-10T00:00:00Z;1,55555300;0,079;0,30;4,18;23,09;14,655;14,486;0,90;Nao;5.000,00;NÃO SE APLICA;D+0 (du);D+02 (du);75,95;132,12
MULTIMERCADO;CAIXA CAPITAL PROTEGIDO IBOV CICLICO I FIC FIF MM - RESP LTDA;2011-11-08T00:00:00Z;3,33386100;0,171;0,23;4,64;8,64;158,787;156,709;1,60;Nao;5.000,00;CDI;D+1 (du);D+03 (du);39,66;45,06
MULTIMERCADO;CAIXA CARTEIRA QUANTITATIVA DUO FIC FIF MM LP - RESP LTDA;2026-04-07T00:00:00Z;1,01542500;-0,004;0,18;;;2,642;2,437;0,80;Sim;0,01;NÃO SE APLICA;D+8 (du);D+10 (du);;
MULTIMERCADO;CAIXA CARTEIRA QUANTITATIVA QUALI FIC FIF MM LP - RESP LTDA;2026-04-07T00:00:00Z;0,97359800;-0,113;0,12;;;1,309;1,156;0,80;Sim;0,01;NÃO SE APLICA;D+14 (du);D+16 (du);;
MULTIMERCADO;CAIXA CARTEIRA QUANTITATIVA UNO FIC FIF MM LP - RESP LTDA;2026-04-07T00:00:00Z;1,02851800;0,036;0,18;;;11,964;12,150;0,80;Sim;0,01;NÃO SE APLICA;D+1 (du);D+03 (du);;
MULTIMERCADO;CAIXA EXPERT BTG PACTUAL X 10 FIC FF MM LP - RESP LTDA;2013-03-21T00:00:00Z;6,87259400;-0,170;0,18;6,86;15,58;128,574;128,472;1,00;Sim;10.000,00;CDI;D+8 (du);D+10 (du);145,98;119,31
MULTIMERCADO;CAIXA EXPERT GIANT ZARATHUSTRA FIC FIF MM - RESP LTDA;2021-02-12T00:00:00Z;1,33960400;0,048;-0,26;4,37;1,63;12,545;12,893;0,40;Sim;10.000,00;NÃO SE APLICA;D+22 (du);D+25 (du);55,70;15,26
MULTIMERCADO;CAIXA EXPERT HASHDEX NASDAQ CRYPTO INDEX FIC FIF MM - RESP LTDA;2025-10-07T00:00:00Z;0,46500176;0,492;4,40;-35,60;;3,689;3,654;0,70;Sim;100,00;OUTROS;D+3 (du);D+08 (du);-538,29;
MULTIMERCADO;CAIXA EXPERT PIMCO INCOME IE FIC FIF MM LP - RESP LTDA;2023-08-21T00:00:00Z;1,44672800;0,155;0,37;5,01;13,95;285,695;283,861;0,93;Sim;10.000,00;NÃO SE APLICA;D+3 (du);D+08 (du);73,23;113,18
MULTIMERCADO;CAIXA EXPERT SPX NIMITZ FIC FIF MM - RESP LTDA;2020-05-04T00:00:00Z;1,80888600;-0,050;-0,76;2,40;10,60;174,918;176,106;2,00;Sim;10.000,00;CDI;D+22 (du);D+24 (du);-0,15;71,88
MULTIMERCADO;CAIXA FIC FIF ALOCACAO MACRO MM LP RESP LTDA;2007-02-01T00:00:00Z;5,66643700;0,021;0,29;6,35;12,97;894,017;895,153;0,50;Sim;10.000,00;CDI;D+1 (du);D+03 (du);121,91;100,08
MULTIMERCADO;CAIXA FIC FIF CAPITAL PROTEGIDO CESTA AGRO MM LP - RESP LTDA;2022-07-04T00:00:00Z;1,39243700;-0,065;0,35;2,67;7,96;71,356;70,856;0,90;Nao;5.000,00;OUTROS;D+0 (du);D+02 (du);69,45;62,22
MULTIMERCADO;CAIXA FIC FIF ESTRAT. LIVRE MULTIMERCADO LP - RESP LTDA;2019-10-21T00:00:00Z;1.645,46545700;0,018;0,30;5,01;11,22;114,122;113,665;1,50;Sim;0,01;CDI;D+13 (du);D+15 (du);111,24;92,96
MULTIMERCADO;CAIXA FIC FIF ESTRATEGICO MULTIMERCADO LP RESP LTDA;2006-04-10T00:00:00Z;5,37305112;0,036;0,31;4,72;11,12;32,729;32,652;1,20;Sim;0,01;CDI;D+0 (du);D+01 (du);98,90;91,33
MULTIMERCADO;CAIXA FIC FIF FOF SMART LONG SHORT LP RESP LTDA;2023-07-18T00:00:00Z;1,26393300;-0,095;0,01;3,49;9,73;5,765;6,171;1,00;Sim;0,01;CDI;D+24 (du);D+26 (du);63,48;84,14
MULTIMERCADO;CAIXA FIC FIF FUNCIONARIOS ESTRATEGIA LIVRE MM LP RESP LTDA;2020-07-06T00:00:00Z;1.668,12473300;0,022;0,31;5,48;12,12;14,467;14,437;0,60;Sim;0,01;CDI;D+13 (du);D+15 (du);121,24;100,29
MULTIMERCADO;CAIXA FIC FIF HEDGE MULTIMERCADO LONGO PRAZO - RESP LTDA;2020-10-26T00:00:00Z;1.695,99842200;0,292;-0,04;7,65;12,36;30,155;29,725;1,00;Sim;0,01;CDI;D+1 (du);D+01 (du);105,18;74,27
MULTIMERCADO;CAIXA FIC FIF JUROS E MOEDAS MM LP - RESP LTDA;2012-06-28T00:00:00Z;3,68163900;0,058;0,16;5,85;11,88;734,579;740,957;0,70;Sim;10.000,00;CDI;D+0 (du);D+00 (du);109,05;90,73
MULTIMERCADO;CAIXA FIC FIF JUROS E MOEDAS MUL PLUS LP - RESP LTDA;2018-03-05T00:00:00Z;1,92063900;0,056;0,16;5,66;11,50;21,518;21,667;1,00;Sim;0,01;CDI;D+0 (du);D+00 (du);105,62;87,95
MULTIMERCADO;CAIXA FIC FIF LONG BIAS MM - RL;2024-04-01T00:00:00Z;1,11987200;-0,922;-0,54;-3,42;16,91;3,555;3,551;2,00;Sim;0,01;OUTROS;D+13 (du);D+15 (du);25,34;158,86
MULTIMERCADO;CAIXA FIC FIF MULTIGESTOR GLOBAL EQUITIES IE MM RESP LTDA;2020-11-12T00:00:00Z;1.228,52043600;-0,607;-0,55;-2,09;-0,26;37,356;37,069;1,00;Sim;0,01;CDI;D+7 (du);D+12 (du);-207,94;-14,12
MULTIMERCADO;CAIXA FIC FOF SMART LONG BIAS MM RESP LTDA;2023-07-18T00:00:00Z;1,41542800;-0,382;-0,23;3,69;17,78;12,056;11,718;1,00;Sim;0,01;IPCA;D+24 (du);D+26 (du);175,29;166,27
MULTIMERCADO;CAIXA FIC FOF SMART MACRO MM LP RESP LTDA;2023-07-18T00:00:00Z;1,30004300;0,012;0,12;3,00;9,65;27,936;27,757;1,00;Sim;0,01;CDI;D+24 (du);D+26 (du);52,98;77,77
MULTIMERCADO;CAIXA FIC FOF SMART MULTIESTRATEGIA MM RESP LTDA;2014-06-09T00:00:00Z;2,87534200;-0,040;0,07;2,95;9,97;72,541;73,395;1,50;Sim;0,01;CDI;D+24 (du);D+26 (du);62,01;79,94
MULTIMERCADO;CAIXA FIF FIC FIM CAPITAL PROTEGIDO CICLICO II LP - RESP LTDA;2022-07-18T00:00:00Z;1,49451000;0,050;1,41;3,34;10,72;193,779;191,735;0,90;Nao;5.000,00;NÃO SE APLICA;D+0 (du);D+02 (du);22,10;92,96
MULTIMERCADO;CAIXA FIF INDEXA BOLSA AMERICANA MULTIMERCADO LP RESP LTDA;2018-10-16T00:00:00Z;3,83804200;0,255;0,79;14,09;28,74;2.391,611;2.356,770;0,80;Sim;0,01;CDI;D+0 (du);D+01 (du);269,97;251,57
MULTIMERCADO;CAIXA FIF INDEXA EURO MM LP - RL;2024-04-01T00:00:00Z;1,11020800;-0,698;-0,91;-7,92;-6,76;3,752;3,750;0,80;Sim;0,01;NÃO SE APLICA;D+1 (du);D+03 (du);-253,33;-47,74
MULTIMERCADO;CAIXA FIF INDEXA OURO MULTIMERCADO LP - RESP LTDA;2013-02-15T00:00:00Z;4,37593700;-0,403;2,30;-1,51;32,20;526,389;553,645;0,80;Sim;0,01;NÃO SE APLICA;D+1 (du);D+02 (du);242,05;351,21
MULTIMERCADO;CAIXA FIF INDEXA SHORT DOLAR MM LP - RESP LTDA;2020-10-26T00:00:00Z;2.428,26635300;0,835;1,75;18,22;31,35;13,490;13,184;0,80;Sim;0,01;PTAX;D+1 (du);D+01 (du);515,54;268,33
NAN;CAIXA ABSOLUTO PRÉ FIC DE CLASSE DE FIF RENDA FIXA LONGO PRAZO - RESPONSABILIDADE LIMITADA;2003-04-30;19,96313200;0,224;0,25;4,16;10,32;118,501;119,035;1,10;Sim;0,01;CDI;D+0 (du);D+00 (du);81,85;81,38
NAN;CAIXA CAPITAL ÍNDICE DE PREÇOS FIC DE CLASSE DE FIF RENDA FIXA LONGO PRAZO - RESP LIMITADA;2003-04-30;13,50892100;0,169;0,33;5,05;9,87;27,616;27,596;1,50;Sim;0,01;IPCA+6%;D+3 (du);D+03 (du);115,97;66,40
NAN;CAIXA CLÁSSICO FIC DE CLASSE DE FIF RENDA FIXA LONGO PRAZO - RESPONSABILIDADE LIMITADA;2003-04-30;15,08044200;0,050;0,15;6,43;12,30;27,736;27,724;1,40;Nao;100,00;CDI;D+0 (du);D+00 (du);113,78;90,64
NAN;CAIXA DIVIDENDOS FUNDO DE INVESTIMENTO FINANCEIRO EM AÇÕES - RESPONSABILIDADE LIMITADA;2003-10-03;6,71576600;-0,811;0,14;5,89;23,91;329,949;329,571;1,50;Sim;0,01;IDIV11;D+1 (du);D+03 (du);204,96;164,12
NAN;CAIXA EMPREENDER FIC DE CLASSE DE FIF RENDA FIXA LONGO PRAZO - RESPONSABILIDADE LIMITADA;2003-04-30;46,54709300;0,050;0,15;6,38;12,21;40,788;40,592;1,50;Nao;50,00;CDI;D+0 (du);D+00 (du);113,02;90,01
NAN;CAIXA ESPECIAL FIC DE CLASSE DE FIF RENDA FIXA LONGO PRAZO - RESPONSABILIDADE LIMITADA;2003-08-25;10,69778500;0,055;0,16;7,02;13,46;2.405,663;2.385,150;0,40;Sim;100.000,00;CDI;D+0 (du);D+00 (du);123,66;99,08
NAN;CAIXA EXECUTIVO FIC DE CLASSE DE FIF RENDA FIXA LONGO PRAZO - RESPONSABILIDADE LIMITADA;2003-04-30;33,07444200;0,051;0,15;6,61;12,65;2.217,412;2.192,981;1,10;Sim;1.000,00;CDI;D+0 (du);D+00 (du);116,93;93,24
NAN;CAIXA IBOVESPA FUNDO DE INVESTIMENTO EM COTAS DE CLASSE DE FIF EM AÇÕES - RESPONSABILIDADE LIMITADA;1997-01-15;8,58795400;-0,899;0,43;6,07;27,25;85,453;85,475;2,00;Sim;0,01;IBOV;D+1 (du);D+03 (du);280,13;184,07
NAN;CAIXA IDEAL FIC DE CLASSE DE FIF RENDA FIXA LONGO PRAZO - RESPONSABILIDADE LIMITADA;2003-04-30;9,78735900;0,050;0,15;6,40;12,24;584,121;582,998;1,50;Sim;0,01;CDI;D+0 (du);D+00 (du);113,31;90,22
NAN;CAIXA INVESTIDOR FIC DE CLASSE DE FIF RENDA FIXA LONGO PRAZO - RESPONSABILIDADE LIMITADA;2003-04-30;19,20984700;0,054;0,16;6,79;13,00;956,509;952,934;0,85;Sim;5.000,00;CDI;D+0 (du);D+00 (du);119,59;95,67
NAN;CAIXA PATRIMÔNIO ÍNDICE DE PREÇOS FIC DE CLASSE DE FIF RENDA FIXA LONGO PRAZO - RESP LIMITADA;2003-04-30;23,86164600;0,173;0,34;6,58;11,72;94,324;93,907;0,30;Sim;100.000,00;IPCA+6%;D+3 (du);D+03 (du);141,76;79,23
NAN;CAIXA PERSONAL FIC DE CLASSE DE FIF RENDA FIXA LONGO PRAZO - RESPONSABILIDADE LIMITADA;2003-04-30;30,90495700;0,055;0,16;6,92;13,26;3.117,568;3.109,060;0,60;Sim;50.000,00;CDI;D+0 (du);D+00 (du);121,95;97,63
NAN;CAIXA PETROBRAS FUNDO DE INVESTIMENTO FINANCEIRO EM AÇÕES - RESPONSABILIDADE LIMITADA;2000-07-10;38,08173200;-1,256;0,64;30,44;24,03;744,116;789,342;1,50;Sim;0,01;PETR3;D+1 (du);D+03 (du);1.375,48;380,23
NAN;CAIXA PRÁTICO FIC DE CLASSE DE FIF RENDA FIXA CURTO PRAZO - RESPONSABILIDADE LIMITADA;2003-04-30;9,49872900;0,046;0,14;6,12;11,59;2.875,977;2.889,802;1,70;Nao;0,01;CDI;D+0 (du);D+00 (du);109,19;84,26
NAN;CAIXA RV 30 FUNDO DE INVESTIMENTO FINANCEIRO MULTIMERCADO LONGO PRAZO - RESPONSABILIDADE LIMITADA;2003-04-30;12,65822200;-0,191;0,29;6,64;17,10;325,399;323,334;1,00;Sim;0,01;70% CDI + 30% IBOV;D+1 (du);D+03 (du);165,32;122,80
NAN;CAIXA SEBRAE FUNDO DE INVESTIMENTO FINANCEIRO RENDA FIXA LONGO PRAZO - RESPONSABILIDADE LIMITADA;2003-04-30;18,11833500;0,053;0,16;7,02;13,52;4.807,872;4.788,184;;Sim;0,01;CDI;D+0 (du);D+01 (du);125,39;100,01
NAN;CAIXA SELEÇÃO FIC DE CLASSE DE FIF RENDA FIXA - RESPONSABILIDADE LIMITADA;2003-10-01;29,50245000;0,047;0,14;6,39;27,68;21,144;21,086;1,10;Nao;30.000,00;CDI;D+0 (du);D+00 (du);113,86;195,72
NAN;CAIXA SOBERANO FIC DE CLASSE DE FIF RENDA FIXA LONGO PRAZO - RESPONSABILIDADE LIMITADA;2003-04-30;20,38180300;0,047;0,14;6,27;11,94;59,553;63,934;1,50;Nao;50,00;CDI;D+0 (du);D+00 (du);111,47;87,96
NAN;CAIXA VALE DO RIO DOCE FUNDO DE INVESTIMENTO FINANCEIRO EM AÇÕES - RESPONSABILIDADE LIMITADA;2002-02-20;36,75723800;-1,335;-0,25;6,40;54,08;616,356;633,296;2,00;Sim;0,01;VALE3;D+1 (du);D+03 (du);360,65;403,15
PRIVATIZACAO;CAIXA FMP FGTS ELETROBRAS - RESP LTDA;2022-06-14T00:00:00Z;1,80719700;-0,795;-0,80;5,57;89,70;1.637,484;1.619,269;0,20;Nao;200,00;OUTROS;D+1 (du);D+05 (du);324,82;529,35
PRIVATIZACAO;CAIXA FMP FGTS ELETROBRAS MIGRAÇÃO - RESP LTDA;2022-06-10T00:00:00Z;1,85232900;-0,790;-0,79;5,50;89,61;5,169;5,035;0,20;Sim;200,00;OUTROS;D+1 (du);D+05 (du);323,39;528,52
PRIVATIZACAO;CAIXA FUNDO MÚTUO DE PRIVATIZAÇÃO - FGTS - PETROBRAS II - RESPONSABILIDADE LIMITADA;2000-08-17;37,43393600;-1,257;0,64;30,57;24,16;524,419;553,934;1,40;Sim;0,01;PETR3;D+1 (du);D+05 (du);1.445,00;399,74
PRIVATIZACAO;CAIXA FUNDO MÚTUO DE PRIVATIZAÇÃO - FGTS - PETROBRAS III - RESPONSABILIDADE LIMITADA;2000-08-17;39,80823700;-1,253;0,65;30,73;24,41;601,904;635,534;1,20;Nao;10.000,00;PETR3;D+1 (du);D+05 (du);1.448,41;402,10
PRIVATIZACAO;CAIXA FUNDO MÚTUO DE PRIVATIZAÇÃO - FGTS - PETROBRAS IV - RESPONSABILIDADE LIMITADA;2000-08-17;42,38377000;-1,252;0,65;30,86;24,68;609,743;642,323;0,95;Nao;300,00;PETR3;D+1 (du);D+05 (du);1.451,48;404,68
PRIVATIZACAO;CAIXA FUNDO MÚTUO DE PRIVATIZAÇÃO - FGTS - VALE DO RIO DOCE I - RESPONSABILIDADE LIMITADA;2002-03-27;35,06362200;-1,337;-0,25;6,41;54,13;438,581;449,569;1,90;Nao;0,01;VALE3;D+1 (du);D+05 (du);373,51;423,55
PRIVATIZACAO;CAIXA FUNDO MÚTUO DE PRIVATIZAÇÃO - FGTS - VALE DO RIO DOCE II - RESPONSABILIDADE LIMITADA;2002-03-27;40,74215600;-1,334;-0,25;6,67;54,86;728,954;748,065;1,40;Nao;10.000,00;VALE3;D+1 (du);D+05 (du);378,64;429,52
PRIVATIZACAO;CAIXA FUNDO MÚTUO DE PRIVATIZAÇÃO - FGTS - VALE DO RIO DOCE MIGRAÇÃO- RESPONSABILIDADE LIMITADA;2002-02-26;34,13920800;-1,330;-0,25;6,39;53,87;11,707;11,844;1,90;Sim;0,01;VALE3;D+1 (du);D+05 (du);373,38;421,57
PRIVATIZACAO;CAIXA FUNDO MÚTUO DE PRIVATIZAÇÃO - FGTS CARTEIRA LIVRE - FGTS CL ABSOLUTO - RESP LIMITADA;2001-08-24;16,00283200;-1,508;-0,52;-5,12;16,03;109,533;110,153;1,90;Sim;0,01;PETR3;D+1 (du);D+05 (du);42,83;177,20
RENDA FIXA;CAIXA BRASIL 2027 TP FIF RF - RESP LTDA;2022-06-06T00:00:00Z;1,14795810;0,083;0,25;4,55;6,49;518,994;516,294;0,20;Sim;300.000,00;IPCA + 5%;D+0 (du);D+00 (du);150,30;40,19
RENDA FIXA;CAIXA BRASIL 2027 TP X FIF RF LP - RESP LTDA;2023-05-16T00:00:00Z;1,11089537;0,084;0,25;4,58;6,56;585,495;576,906;0,15;Sim;300.000,00;IPCA + 5%;D+0 (du);D+00 (du);150,89;40,67
RENDA FIXA;CAIXA BRASIL 2028 X TP FIF RF - RESP LTDA;2023-05-16T00:00:00Z;1,07843990;0,193;0,45;3,05;5,01;563,845;560,531;0,15;Sim;300.000,00;IPCA + 5%;D+0 (du);D+00 (du);60,52;33,38
RENDA FIXA;CAIXA BRASIL 2030 II TP FIF RF - RESP LTDA;2014-03-26T00:00:00Z;1,94386167;0,311;0,47;1,57;3,23;1.072,491;1.064,164;0,20;Sim;300.000,00;CDI;D+0 (du);D+00 (du);43,54;24,06
RENDA FIXA;CAIXA BRASIL 2030 III TP  FIF RF - RESP LTDA;2015-03-16T00:00:00Z;1,75770530;0,311;0,47;1,57;3,26;239,504;237,644;0,20;Sim;300.000,00;CDI;D+1 (du);D+02 (du);43,60;24,28
RENDA FIXA;CAIXA BRASIL ATIVA FIC FIF RENDA FIXA LONGO PRAZO - RESP LTDA;2020-04-15T00:00:00Z;1.655,81463300;0,059;0,17;5,51;11,65;461,728;460,453;0,40;Sim;0,01;CDI;D+0 (du);D+01 (du);100,70;77,03
RENDA FIXA;CAIXA BRASIL GESTAO ESTRATEGICA FIC FIF RF - RESP LTDA;2016-11-04T00:00:00Z;2,41826800;0,108;0,20;5,00;11,32;3.406,244;3.538,734;0,40;Sim;0,01;IPCA;D+0 (du);D+00 (du);98,16;85,99
RENDA FIXA;CAIXA BRASIL IDKA IPCA 2A TP FIF RF LONGO PRAZO - RESP LTDA;2012-08-16T00:00:00Z;3,82821900;0,194;0,45;6,35;11,63;3.014,004;2.995,685;0,20;Sim;0,01;IDKA2;D+0 (du);D+00 (du);142,65;81,23
RENDA FIXA;CAIXA BRASIL IMA B 5 TP FIF RF LONGO PRAZO - RESP LTDA;2010-07-09T00:00:00Z;5,20550100;0,176;0,36;6,63;11,85;5.590,367;5.553,890;0,20;Sim;0,01;IMA-B 5;D+0 (du);D+00 (du);143,14;80,44
RENDA FIXA;CAIXA BRASIL IMA GERAL TP FIF RF LONGO PRAZO - RESP LTDA;2010-07-08T00:00:00Z;4,78055200;0,156;0,33;5,91;12,04;475,245;497,471;0,20;Sim;0,01;IMA-GERAL TOTAL;D+0 (du);D+00 (du);119,01;90,97
RENDA FIXA;CAIXA BRASIL IMA-B 5+ TP FIF RF LONGO PRAZO - RESP LTDA;2012-04-18T00:00:00Z;3,42564800;0,473;1,15;2,68;7,44;751,902;758,727;0,20;Sim;0,01;IMA-B 5+;D+0 (du);D+00 (du);115,19;68,43
RENDA FIXA;CAIXA BRASIL IMA-B TP FIF RF LONGO PRAZO - RESP LTDA;2010-03-08T00:00:00Z;5,13482700;0,337;0,79;4,43;9,41;2.534,558;2.549,919;0,20;Sim;0,01;IMA-B TOTAL;D+0 (du);D+00 (du);127,69;73,65
RENDA FIXA;CAIXA BRASIL IRF M 1 MAIS TP FIF RF LONGO PRAZO - RESP LTDA;2012-05-11T00:00:00Z;3,78760100;0,286;0,30;4,16;10,96;709,286;712,927;0,20;Sim;0,01;IRF-M 1+;D+0 (du);D+00 (du);83,69;85,59
RENDA FIXA;CAIXA BRASIL IRF-M 1 TP FIF RF - RESP LTDA;2010-05-28T00:00:00Z;4,53001100;0,065;0,18;6,76;13,17;10.869,995;10.942,801;0,20;Sim;0,01;IRF-M 1;D+0 (du);D+00 (du);118,05;96,20
RENDA FIXA;CAIXA BRASIL IRF-M TP FIF RF LONGO PRAZO - RESP LTDA;2012-08-16T00:00:00Z;3,66001100;0,229;0,26;4,84;11,46;1.683,948;1.710,784;0,20;Sim;0,01;IRF-M TOTAL;D+0 (du);D+00 (du);92,58;88,66
RENDA FIXA;CAIXA BRASIL MATRIZ FIF RF - RESP LTDA;2015-12-17T00:00:00Z;2,63694600;0,054;0,16;7,07;13,56;9.108,135;9.128,450;0,20;Sim;0,01;CDI;D+0 (du);D+00 (du);125,22;99,91
RENDA FIXA;CAIXA BRASIL TP FIF RF LONGO PRAZO - RESP LTDA;2006-02-10T00:00:00Z;7,25319300;0,053;0,16;6,98;13,40;12.241,719;12.585,054;0,20;Sim;0,01;CDI;D+0 (du);D+00 (du);124,81;99,16
RENDA FIXA;CAIXA FI MERCURIO RF LP;2019-05-29T00:00:00Z;1,93427600;0,055;0,16;7,13;13,64;6.971,764;7.016,652;0,07;Sim;0,01;CDI;D+0 (du);D+00 (du);125,74;100,43
RENDA FIXA;CAIXA FI SENAR RENDA FIXA LONGO PRAZO;2022-06-01T00:00:00Z;1,66067500;0,053;0,16;7,06;13,57;1.057,638;1.050,340;0,10;Sim;0,00;NÃO SE APLICA;D+0 (du);D+00 (du);125,99;100,17
RENDA FIXA;CAIXA FIC FIF ATIVA RENDA FIXA LP - RESP LTDA;2020-04-22T00:00:00Z;1.784,38565500;0,057;0,16;5,93;12,13;122,274;122,795;0,40;Sim;50.000,00;CDI;D+0 (du);D+01 (du);110,04;92,29
RENDA FIXA;CAIXA FIC FIF BRASIL IDKA PRE 2A RF LP - RESP LTDA;2022-09-21T00:00:00Z;1,45932300;0,166;0,29;4,66;11,24;169,688;169,269;0,20;Sim;0,01;IDKA PRÉ 2A;D+0 (du);D+00 (du);81,98;84,27
RENDA FIXA;CAIXA FIC FIF DESENVOLVER RF LP - RESP LTDA;2012-12-18T00:00:00Z;3,02445600;0,048;0,14;6,24;11,95;1,635;1,632;1,30;Nao;500,00;CDI;D+0 (du);D+00 (du);110,52;88,47
RENDA FIXA;CAIXA FIC FIF E-FUNDO RF LP - RESP LTDA;2012-10-05T00:00:00Z;3,38666000;0,053;0,16;6,81;13,05;63,449;62,815;0,70;Sim;0,01;CDI;D+0 (du);D+00 (du);120,51;96,19
RENDA FIXA;CAIXA FIC FIF EQUILIBRIO MPE RF LP - RESP LTDA;2006-07-05T00:00:00Z;5,95105800;0,053;0,15;6,69;12,80;41,224;41,032;1,00;Sim;1.000,00;CDI;D+0 (du);D+00 (du);117,81;94,23
RENDA FIXA;CAIXA FIC FIF FOCO IND. DE PRECOS RF LP - RESP LTDA;2012-03-19T00:00:00Z;3,15456100;0,171;0,33;6,21;11,01;77,730;78,023;1,00;Sim;100,00;NÃO SE APLICA;D+3 (du);D+03 (du);135,28;74,03
RENDA FIXA;CAIXA FIC FIF INSTITUCIONAL SOBERANO PLUS RF - RESP LTDA;2022-10-21T00:00:00Z;1,56695561;0,053;0,16;7,04;13,50;612,825;407,124;0,10;Sim;5.000.000,00;CDI;D+0 (du);D+00 (du);125,57;99,76
RENDA FIXA;CAIXA FIC FIF MUTUA RF LONGO PRAZO - RESP LTDA;2008-11-20T00:00:00Z;5,21866000;0,053;0,16;7,12;13,57;370,260;367,509;0,03;Sim;0,01;CDI;D+0 (du);D+00 (du);126,75;99,85
RENDA FIXA;CAIXA FIC FIF OBJETIVO PRE RF LP - RESP LTDA;2012-06-27T00:00:00Z;3,33391700;0,227;0,26;4,61;10,96;133,127;134,377;0,70;Sim;1.000,00;CDI;D+0 (du);D+00 (du);88,61;84,88
RENDA FIXA;CAIXA FIC FIF PERFORMANCE IMA B RF LP - RESP LTDA;2012-05-02T00:00:00Z;3,32669600;0,336;0,78;4,38;8,95;64,686;64,983;0,80;Sim;1.000,00;IMA-B TOTAL;D+0 (du);D+00 (du);127,19;71,35
RENDA FIXA;CAIXA FIC FIF RELACIONAMENTO IDEAL RF LP - RESP LTDA;2012-04-16T00:00:00Z;3,33433300;0,051;0,15;6,62;12,67;12,993;13,024;1,00;Nao;1.000,00;CDI;D+0 (du);D+00 (du);117,11;93,41
RENDA FIXA;CAIXA FIC FIF RELACIONAMENTO PERSONAL RF LP - RESP LTDA;2012-04-16T00:00:00Z;3,51918100;0,054;0,16;6,86;13,13;120,978;119,898;0,70;Sim;0,01;CDI;D+0 (du);D+00 (du);120,82;96,72
RENDA FIXA;CAIXA FIC FIF SUPREMO RF LONGO PRAZO - RESP LTDA;2006-07-04T00:00:00Z;6,24699600;0,054;0,16;6,81;13,03;121,789;121,590;0,80;Nao;70.000,00;CDI;D+0 (du);D+00 (du);119,89;95,96
RENDA FIXA;CAIXA FIC FIF TITULO PUBLICO MPE RF LP - RESP LTDA;2012-10-05T00:00:00Z;3,25387700;0,051;0,15;6,77;12,75;25,577;22,273;0,50;Sim;1.000,00;CDI;D+0 (du);D+00 (du);120,14;93,33
RENDA FIXA;CAIXA FIF BRASIL 2026 X TP RF - RESP LTDA;2024-04-11T00:00:00Z;1,12188630;0,069;0,17;5,43;7,39;1.014,037;1.007,257;0,10;Sim;300.000,00;IPCA + 5%;D+0 (du);D+00 (du);82,78;47,28
RENDA FIXA;CAIXA FIF BRASIL 2030 X TP RF RESP LTDA;2023-05-16T00:00:00Z;1,03514378;0,310;0,47;1,57;3,25;77,441;76,840;0,15;Sim;300.000,00;IPCA + 5%;D+0 (du);D+00 (du);43,60;24,25
RENDA FIXA;CAIXA FIF BRASIL 2032 X TP RF RESP LTDA;2023-05-16T00:00:00Z;1,01014627;0,267;0,39;0,90;2,58;434,266;431,254;0,15;Sim;300.000,00;IPCA + 5%;D+0 (du);D+00 (du);46,17;23,90
RENDA FIXA;CAIXA FIF BRASIL 2033 X TP RF RESP LTDA;2023-05-16T00:00:00Z;1,00445953;0,300;0,61;0,98;1,91;674,074;667,963;0,15;Sim;300.000,00;IPCA + 5%;D+0 (du);D+00 (du);131,73;20,66
RENDA FIXA;CAIXA FIF BRASIL 2035 X TP RF - RL;2024-04-01T00:00:00Z;0,94818568;0,320;0,64;-0,89;0,73;113,332;112,924;0,10;Sim;300.000,00;nan;D+0 (du);D+00 (du);105,77;18,86
RENDA FIXA;CAIXA FIF BRASIL 2040 X TP RF - RL;2024-03-26T00:00:00Z;0,95240874;0,403;1,09;-1,01;0,32;65,114;65,071;0,10;Sim;300.000,00;NÃO SE APLICA;D+0 (du);D+00 (du);30,97;20,32
RENDA FIXA;CAIXA FIF BRASIL ESPECIAL 2026 TP RF - RESP LTDA;2024-08-14T00:00:00Z;1,12316355;0,069;0,17;5,45;7,42;3.552,530;3.528,357;0,06;Sim;500.000,00;IPCA + 5%;D+0 (du);D+00 (du);83,14;47,49
RENDA FIXA;CAIXA FIF BRASIL ESPECIAL 2027 TP RF - RESP LTDA;2024-08-14T00:00:00Z;1,07415213;0,084;0,26;4,63;6,65;756,941;752,584;0,06;Sim;500.000,00;IPCA + 5%;D+0 (du);D+00 (du);151,75;41,34
RENDA FIXA;CAIXA FIF BRASIL ESPECIAL 2028 TP RF - RESP LTDA;2024-08-14T00:00:00Z;1,07518341;0,194;0,45;3,10;5,09;1.316,830;1.264,118;0,06;Sim;500.000,00;IPCA + 5%;D+0 (du);D+00 (du);61,47;34,01
